"REMARKS","RUNWAY","DIRECTION","AIRPORT","dateonly","timeonly","DATE","CALLSIGN","POD","PRIMARYCODE","SECONDARYCODES","REPORTINGFACILITY","MORID.CEDAR","FACILITY.CEDAR","UTCTIME.CEDAR","UTCTIME24.CEDAR","CALENDARDATE.CEDAR","NEARESTAIRPORT.CEDAR","AIRSPACECLASS.CEDAR","ACLOCATION.CEDAR","ACALTITUDE.CEDAR","ACHEADING.CEDAR","RELATIVECLOCKPOSITION.CEDAR","UASLONG.CEDAR","UASLAT.CEDAR","SUMMARY.CEDAR","QAFINDINGS.CEDAR","RWYLOCATION","UASLOCATION","DATASET"
"Reported a red quad-copter UAS 2 feet in diameter 200 feet below the aircraft altitude of 3,000 feet while on a 10 NM final to runway 16 at Lackland AFB. No evasive action taken. San Antonio PD notified at7. ","['rwy 16 ']","[]","[]","1/10/2018","5:06","2018-01-10T05:06Z","ALAMO03","NCRCC","UAS",NA,"SAT",NA,NA,NA,NA,NA,NA,NA,NA,NA,NA,NA,NA,NA,NA,NA,NA,"SAT","EXCEPTION"
"A pedestrian reported observing a UAS hovering 100 to 200 feet off of the ground in the vicinity of 19th Ave, near the fence are off of the departure end of Runway 25L at Deer Valley Airport. Unknown if LEO notification was made. ","['rwy 25l']","[]","[]","1/11/2018","6:58","2018-01-11T06:58Z",NA,"DEN","UAS",NA,"PHX",NA,NA,NA,NA,NA,NA,NA,NA,NA,NA,NA,NA,NA,NA,NA,NA,"PHX","EXCEPTION"
"Observed a large UAS 50 feet off the left side of the aircraft at the same altitude, stationary or moving slowly in the same direction while Sbound at 2,400 feet on a 4.7 NM final to runway 17C. No evasive action taken. Vance AFB Security Force Operations notified at.","['rwy 17c']","[]","[]","1/12/2018","0:29","2018-01-12T00:29Z","BALL56","NCRCC","UAS",NA,"END",NA,NA,NA,NA,NA,NA,NA,NA,NA,NA,NA,NA,NA,NA,NA,NA,"END","EXCEPTION"
"Reported a UAS 200 feet above the aircraft and off the right side while WNW bound at 1,000 feet on a 1.5 NM final to runway 30. No evasive action taken. Miami Dade PD notified at.","['rwy 30 ']","[]","[]","1/13/2018","3:01","2018-01-13T03:01Z","UAL1237","NCRCC","UAS",NA,"MIA",NA,NA,NA,NA,NA,NA,NA,NA,NA,NA,NA,NA,NA,NA,NA,NA,"MIA","EXCEPTION"
"While at 1,000 feet on a 3 NM final to runway 24, reported a UAS on the right at the same altitude. No evasive action taken. Port Authority PD notified at.","['rwy 24']","[]","[]","1/18/2018","2:36","2018-01-18T02:36Z","EDV3664","NCRCC","UAS",NA,"RSW",NA,NA,NA,NA,NA,NA,NA,NA,NA,NA,NA,NA,NA,NA,NA,NA,"RSW","EXCEPTION"
"Reported a UAS with a red light on top while on left base for runway 8 at 800 - 900 feet 1 SW of Pensacola. No evasive action taken. No LE notification made.","['rwy 8 ']","[]","[]","1/20/2018","2:06","2018-01-20T02:06Z","N0887L","NCRCC","UAS",NA,"P31",NA,NA,NA,NA,NA,NA,NA,NA,NA,NA,NA,NA,NA,NA,NA,NA,"P31","EXCEPTION"
"Reported a UAS of unknown size and color approximately150 feet above the ground while conducting right closed traffic to runway 13R at RHV. No evasive action taken. LE notification not reported.","['rwy 13r']","[]","['13R', 'RHV']","1/26/2018","0:51","2018-01-26T00:51Z","N4927B","NCRCC","UAS",NA,"RHV",NA,NA,NA,NA,NA,NA,NA,NA,NA,NA,NA,NA,NA,NA,NA,NA,"RHV","EXCEPTION"
"Reported 2 UAS operating off the departure end of runway 21 at the shoreline. No description of the UAS or altitude reported. No evasive action reported. Santa Monica Police notified on frequency. ","['rwy 21 ']","[]","[]","1/31/2018","21:56","2018-01-31T21:56Z","N683WA","NCRCC","UAS",NA,"SMO",NA,NA,NA,NA,NA,NA,NA,NA,NA,NA,NA,NA,NA,NA,NA,NA,"SMO","EXCEPTION"
"Reported a UAS, size and color not reported, at 4,000 feet while turning final to runway 20 at Richmond. No evasive action taken. Hanover County Police notified at.","['rwy 20 ']","[]","[]","2/1/2018","1:29","2018-02-01T01:29Z","N80FW","NCRCC","UAS",NA,"PCT",NA,NA,NA,NA,NA,NA,NA,NA,NA,NA,NA,NA,NA,NA,NA,NA,"PCT","EXCEPTION"
"Reported a UAS at the same altitude of 600 feeton the left side of the aircraft on a 4 NM final to runway 12. No evasive action taken. Martin County Sheriff notified at.","['rwy 12 ']","[]","[]","2/1/2018","21:59","2018-02-01T21:59Z","EJA374","NCRCC","UAS",NA,"PBI",NA,NA,NA,NA,NA,NA,NA,NA,NA,NA,NA,NA,NA,NA,NA,NA,"PBI","EXCEPTION"
"Reported a sliver quad-copter off the left wing while on final to runway 25L. No evasive action reported. LAX Airport Authority notified at.","['rwy 25l']","[]","['LAX']","2/4/2018","22:25","2018-02-04T22:25Z","CPA2091","NCRCC","UAS",NA,"LAX",NA,NA,NA,NA,NA,NA,NA,NA,NA,NA,NA,NA,NA,NA,NA,NA,"LAX","EXCEPTION"
"Reported a UAS 50 feet below while on final to runway27 at 200 feet. No evasive action taken. LE notification not reported.","['rwy27 ']","[]","[]","2/5/2018","19:43","2018-02-05T19:43Z","GTI34","NCRCC","UAS",NA,"MIA",NA,NA,NA,NA,NA,NA,NA,NA,NA,NA,NA,NA,NA,NA,NA,NA,"MIA","EXCEPTION"
"While the aircraft wasE bound at 1,100 feet, reported a flying candle type UAS with red and orange lights off the right side of the aircraft at 500 feet AGL justS of therunway 8 centerline at BUR. No evasive action reported and the aircraft landed without incident. ATCT personnel also observed the UAS from the tower but lost sight of it while working traffic. LAPD Air Support Division notified at. Police10, helo,was in the area andwas notified on frequency and searched for the UAS without success. 0600 HQ DEN followed up with LAPD Air Division and they stated that they were unable to locate the UAS or operator(s) but they are following up on some leads form the day before.","['rwy 8 c']","[]","['BUR', 'TCT', 'DEN']","2/14/2018","10:52","2018-02-14T10:52Z","SWA645","NCRCC","UAS",NA,"BUR",NA,NA,NA,NA,NA,NA,NA,NA,NA,NA,NA,NA,NA,NA,NA,NA,"BUR","EXCEPTION"
"Reported a UAS off the left wing while on final to runway 10R at FL at 1,500 feet. No evasive action reported. LE notified but no contact number provided.","['rwy 10r']","[]","[]","2/18/2018","1:11","2018-02-18T01:11Z","DPJ47","NCRCC","UAS",NA,"FLL",NA,NA,NA,NA,NA,NA,NA,NA,NA,NA,NA,NA,NA,NA,NA,NA,"FLL","EXCEPTION"
"The aircraft was instructed to enter left traffic to runway 31L at RHV. When the aircraft was mid-field left downwind the PIC reported a UAS off the right side within 100 feet of the aircraft at 1,400 feet. No description of the UAS provided. The PIC reported a NM AC with the UAS and had to take evasive action to avoid the UAS. San Jose PD notified at. Information received by the WOCfrom a DRAthrough the ROC. ","['rwy 31l']","[]","['RHV', 'ROC']","2/18/2018","6:09","2018-02-18T06:09Z","N3180W","NCRCC","UAS","PAGED","RHV",NA,NA,NA,NA,NA,NA,NA,NA,NA,NA,NA,NA,NA,NA,NA,NA,"RHV","EXCEPTION"
"Reported a white UAS at the same altitude while on right base to runway 24 at PNE. No evasive action taken. LE notified but no contact number supplied.","['rwy 24 ']","[]","['PNE']","2/21/2018","0:55","2018-02-21T00:55Z","N6NY","NCRCC","UAS",NA,"PHL",NA,NA,NA,NA,NA,NA,NA,NA,NA,NA,NA,NA,NA,NA,NA,NA,"PHL","EXCEPTION"
"Aircraft reportedan 18 - 24 inchUAS from the left side 100 FT below Aircraft while onfinal For Rwy 24R at 400 FT. No evasive action taken. Cleveland PD notified at.","['rwy24r']","[]","['24R']","2/26/2018","1:41","2018-02-26T01:41Z","UAL1809","DEN","UAS",NA,"CLE",NA,NA,NA,NA,NA,NA,NA,NA,NA,NA,NA,NA,NA,NA,NA,NA,"CLE","EXCEPTION"
"HIF, Hill AFB Security Forces advised Hill AFB ATCT of a UAS in the vicinity of base housing at 250 feet, moving towards the RWY. No aircraft were involved. ","[]","[]","['HIF', 'TCT']","3/24/2018","10:51","2018-03-24T10:51Z",NA,"DEN","UAS",NA,"WOC",NA,NA,NA,NA,NA,NA,NA,NA,NA,NA,NA,NA,NA,NA,NA,NA,"WOC","EXCEPTION"
"Observed a UAS at 200 feet hovering between Runway 22L and 22R. No evasive action taken. NY Police Aviation Unit notified at.","['rwy 22l']","[]","[]","3/29/2018","1:57","2018-03-29T01:57Z","AAL292","DEN","UAS",NA,"N90",NA,NA,NA,NA,NA,NA,NA,NA,NA,NA,NA,NA,NA,NA,NA,NA,"N90","EXCEPTION"
"While on a 2 NM final for Runway 24, reported a light colored UAS off left side at 800 feet. No evasive action taken. Jefferson County Sheriff notified.","['rwy 24']","[]","[]","3/30/2018","4:36","2018-03-30T04:36Z","N525BP","DEN","UAS",NA,"BHM",NA,NA,NA,NA,NA,NA,NA,NA,NA,NA,NA,NA,NA,NA,NA,NA,"BHM","EXCEPTION"
"Reported a UAS off the right wing at 2,600 feet while being vectored for ILS Runway 15. No evasive action reported. UNKN if LEO notified","['rwy 15 ']","[]","['UNK']","3/30/2018","4:44","2018-03-30T04:44Z","PAT008","DEN","UAS",NA,"BTV",NA,NA,NA,NA,NA,NA,NA,NA,NA,NA,NA,NA,NA,NA,NA,NA,"BTV","EXCEPTION"
"2200: Reported a white UAS with steady white lights pass below the aircraft at 1,600 feetafter departing runway 14 at OKV (approximately DCA299055). No evasive action reported. Frederick County Sheriff notified at.0039 CLOSEOUT: A Frederick County Sheriff's Deputy responded, checked the area and nothing was found. NFA.","['rwy 14 ']","[]","['OKV', 'DCA']","4/22/2018","4:07","2018-04-22T04:07Z","N456CS","NCRCC","UAS","PAGED","PCT",NA,NA,NA,NA,NA,NA,NA,NA,NA,NA,NA,NA,NA,NA,NA,NA,"PCT","EXCEPTION"
"DCA-2: DCA134009 (2 NM final to runway 1L), reported a white UAS 100 feet off the right side, Ebound at 600 feet. No evasive action reported. MD State Police notified at. ADW to file MOR. ","['rwy 1l']","[]","['DCA', 'DCA', 'ADW', 'MOR']","6/1/2018","22:14","2018-06-01T22:14Z","VENUS94","NCRCC","TOI-NCR FRZ","MOR, PAGED, TOI, UAS","ADW",NA,NA,NA,NA,NA,NA,NA,NA,NA,NA,NA,NA,NA,NA,NA,NA,"ADW","EXCEPTION"
"UAS reported 3SE of BWI at 500 feet while landing runway 33R at BWI. LEO's contacted pending. Location approximately BWI2:BWI ATCT reports Ann Arundel PD notified at. ","['rwy 33r']","[]","['BWI', '33R', 'BWI', 'BWI', 'BWI', 'TCT']","7/4/2018","21:00","2018-07-04T21:00Z","N625LR","NCRCC","UAS",NA,"BWI",NA,NA,NA,NA,NA,NA,NA,NA,NA,NA,NA,NA,NA,NA,NA,NA,"BWI","EXCEPTION"
"Cyril E King ARPT ATCT advised Virgin Island Port Authority (VIPA) found a UAS on the edge of runway adjacent TWY C during their RWY/TWY check. UAS was confiscated and turned over to FBI and VIPA PD. No registration record found for UAS. No impact to operations. ","[]","[]","['TCT']","7/7/2018","0:01","2018-07-07T00:01Z",NA,"DEN","UAS","NOTIFICATION-LATE, PAGED","STT",NA,NA,NA,NA,NA,NA,NA,NA,NA,NA,NA,NA,NA,NA,NA,NA,"STT","EXCEPTION"
"PIC reported UAS at 500FT S of RWY during departure. Evasive action not reported. LEO notification not reported.","[]","[]","['00F']","7/18/2018","2:03","2018-07-18T02:03Z","N4727D","DEN","UAS",NA,"VNY",NA,NA,NA,NA,NA,NA,NA,NA,NA,NA,NA,NA,NA,NA,NA,NA,"VNY","EXCEPTION"
"ATC advised that an SR-22 PIC reported a metallic UAS while in the run-up area of runway 35. UAS was adjacent Airport fence in vicinity of Keil Rd at 200 feet. No evasive action reported. Aurora PD notified at.","['rwy 35 ']","[]","[]","7/29/2018","4:28","2018-07-29T04:28Z",NA,"DEN","UAS",NA,"UAO",NA,NA,NA,NA,NA,NA,NA,NA,NA,NA,NA,NA,NA,NA,NA,NA,"UAO","EXCEPTION"
"Reported a Black 5 blade UAS while WSW bound at 2,800 feet from the 12 o'clock position while on a 9 NM final to LAX runway 24R. No evasive action was taken. LEO notification was not reported. DEN contacted LAX, ATCT reported thatairport authority already knew of event and LE was not contacted due to late report by aircrewand no other aircraft were impacted.","['rwy 24r']","[]","['LAX', '24R', 'DEN', 'LAX', 'TCT']","8/21/2018","7:51","2018-08-21T07:51Z","EIN1AK","DEN","UAS",NA,"LAX",NA,NA,NA,NA,NA,NA,NA,NA,NA,NA,NA,NA,NA,NA,NA,NA,"LAX","EXCEPTION"
"Passenger in terminal reported a UAS between the runways at street level. Lights were observed but no sounds. No Aircraft in VCNTY. RWY FOD checks conducted with negative findings.","[]","[]","['FOD']","8/21/2018","15:09","2018-08-21T15:09Z",NA,"DEN","UAS",NA,"ZAN",NA,NA,NA,NA,NA,NA,NA,NA,NA,NA,NA,NA,NA,NA,NA,NA,"ZAN","EXCEPTION"
"Reported a UAS on the right side of aircraft while on downwind for Runway 9L to Miami Executive Airport at unknown altitude. No evasive action taken. LEO notification not reported.","['rwy 9l']","[]","[]","8/29/2018","22:50","2018-08-29T22:50Z","N991BJ","DEN","UAS",NA,"MIA",NA,NA,NA,NA,NA,NA,NA,NA,NA,NA,NA,NA,NA,NA,NA,NA,"MIA","EXCEPTION"
"The flight encountered a UAS at 1,500 feet landing runway 20 at RIC.No evasive action taken.PCT is contacting local law enforcement.1602:PCT contacted Hanover county Sheriff at. ","['rwy 20 ']","[]","['RIC']","9/25/2018","20:41","2018-09-25T20:41Z","JBU1081","NCRCC","UAS",NA,"PCT",NA,NA,NA,NA,NA,NA,NA,NA,NA,NA,NA,NA,NA,NA,NA,NA,"PCT","EXCEPTION"
"Reported UAS 100 feet off left wing at the same altitude, 7300 feet, on a 4 mi final to runway 35R, Centennial. No evasive action reported. Douglas County Sheriff notified at.","['rwy 35r']","[]","[]","10/4/2018","8:11","2018-10-04T08:11Z","N322GC","DEN","UAS",NA,"APA",NA,NA,NA,NA,NA,NA,NA,NA,NA,NA,NA,NA,NA,NA,NA,NA,"APA","EXCEPTION"
"Reported a UAS while SW bound at 5,000 feet on a 15 NM final to Runway 21. No evasive action taken. Detroit PD notified at.","['rwy 21 ']","[]","[]","10/10/2018","1:32","2018-10-10T01:32Z","EDV5146","DEN","UAS",NA,"D21",NA,NA,NA,NA,NA,NA,NA,NA,NA,NA,NA,NA,NA,NA,NA,NA,"D21","EXCEPTION"
"Aircraft departed Runway 21 and reported seeing a UAS passing below the aircraft at 500 feet. No evasive action was reported. LEO not notified.","['rwy 21 ']","[]","[]","11/22/2018","6:38","2018-11-22T06:38Z","N32169","CONR","UAS",NA,"SMO",NA,NA,NA,NA,NA,NA,NA,NA,NA,NA,NA,NA,NA,NA,NA,NA,"SMO","EXCEPTION"
"Aircraft advised Tucson Approach thetermination of a practice approach at Benson Airport (E95) due to a UAS operating over the RWY at pattern altitude. No description of UAS given. LEO notification unknown. ","[]","[]","['E95']","12/7/2018","0:57","2018-12-07T00:57Z","N4768E","DEN","UAS",NA,"U90",NA,NA,NA,NA,NA,NA,NA,NA,NA,NA,NA,NA,NA,NA,NA,NA,"U90","EXCEPTION"
"While at Vancouver, BC, Canada reported a UAS near the threshold of Runway 8R while holding short prior to departure. The crew stated that the UAS passed 50 feet in front of the aircraft. No known operational impact. ","['rwy 8r']","[]","[]","1/3/2019","10:22","2019-01-03T10:22Z","UAL595","DEN","UAS",NA,"WOC",NA,NA,NA,NA,NA,NA,NA,NA,NA,NA,NA,NA,NA,NA,NA,NA,"WOC","EXCEPTION"
"Reported a black medium sized UAS off right side while N bound at 400 feet on a 1 NM final to Runway 36 No evasive action taken. Pinellas County Sheriff notified on frequency. Sheriff's helicopter did not locate UAS.","['rwy 36 ']","[]","[]","1/6/2019","23:50","2019-01-06T23:50Z","AAY845","DEN","UAS",NA,"PIE",NA,NA,NA,NA,NA,NA,NA,NA,NA,NA,NA,NA,NA,NA,NA,NA,"PIE","EXCEPTION"
"Reported a UAS at 400 feet while on short final to Runway 24 at ARB. UAS description not provided. No evasive action taken. Pittsfield PD notified at.","['rwy 24 ']","[]","['ARB']","1/7/2019","1:59","2019-01-07T01:59Z","N9608K","DEN","UAS",NA,"ARB",NA,NA,NA,NA,NA,NA,NA,NA,NA,NA,NA,NA,NA,NA,NA,NA,"ARB","EXCEPTION"
"PIC reported a white UAS moving E to W at approximately 2,000 feet while on 6 NM final to runway 19C. No evasive action reported. Louden County Sheriff notified at.","['rwy 19c']","[]","[]","2/16/2019","1:54","2019-02-16T01:54Z","DLH418","NCRCC","UAS",NA,"IAD",NA,NA,NA,NA,NA,NA,NA,NA,NA,NA,NA,NA,NA,NA,NA,NA,"IAD","EXCEPTION"
"Reported an orange, red and black UAS off the left side while W bound at 1,800 feet 5 NM final to Runway28. No evasive action taken. LEO notification not reported.","['rwy28 ']","[]","[]","2/24/2019","22:49","2019-02-24T22:49Z","COBALT818","DEN","UAS",NA,"SAV",NA,NA,NA,NA,NA,NA,NA,NA,NA,NA,NA,NA,NA,NA,NA,NA,"SAV","EXCEPTION"
"Reported a UAS off right wing at same altitude 2,200 feet while on an 8 NM final to Runway 10L at FLL. No evasive action taken. Broward County Sheriff notified at. ","['rwy 10l']","[]","['FLL']","3/9/2019","20:59","2019-03-09T20:59Z","SWA4911","DEN","UAS",NA,"FLL",NA,NA,NA,NA,NA,NA,NA,NA,NA,NA,NA,NA,NA,NA,NA,NA,"FLL","EXCEPTION"
"Reported a green UAS 200 feet above aircraft while on a 3 NM final to Runway 26L at 2,500 feet. No evasive action taken. LAS PD notified at.","['rwy 26l']","[]","['LAS']","3/10/2019","11:07","2019-03-10T11:07Z","ROU1857","DEN","UAS",NA,"LAS",NA,NA,NA,NA,NA,NA,NA,NA,NA,NA,NA,NA,NA,NA,NA,NA,"LAS","EXCEPTION"
"Reported a small black UAS 300 feet above off left wing while NW bound at 2300 feet on 6 NM final runway 30. No evasive action taken. STL PD notified at. ","['rwy 30 ']","[]","['STL']","3/31/2019","23:30","2019-03-31T23:30Z","KAP1081","DEN","UAS",NA,"STL",NA,NA,NA,NA,NA,NA,NA,NA,NA,NA,NA,NA,NA,NA,NA,NA,"STL","EXCEPTION"
"Reported a dark colored UAS pass 50 feet off the left wing while descending through 3,000 feet on a 6 NM final for Runway 27. No evasive action taken. San Diego PD notified at.","['rwy 27 ']","[]","[]","4/8/2019","6:52","2019-04-08T06:52Z","BAW44N","DEN","UAS",NA,"SAN",NA,NA,NA,NA,NA,NA,NA,NA,NA,NA,NA,NA,NA,NA,NA,NA,"SAN","EXCEPTION"
"Reported a white UAS at 1,700 feet while on final approach to Runway 18. No evasive action taken. Horry County PD notified.","['rwy 18 ']","[]","[]","5/20/2019","23:03","2019-05-20T23:03Z","AAL408","DEN","UAS",NA,"MYR",NA,NA,NA,NA,NA,NA,NA,NA,NA,NA,NA,NA,NA,NA,NA,NA,"MYR","EXCEPTION"
"Reported a UAS at 300 feet on final to Runway 35. No evasive action taken. Kent County Sheriff notified at.","['rwy 35 ']","[]","[]","5/23/2019","19:37","2019-05-23T19:37Z","N65TH","DEN","UAS",NA,"GRR",NA,NA,NA,NA,NA,NA,NA,NA,NA,NA,NA,NA,NA,NA,NA,NA,"GRR","EXCEPTION"
"Reported an orange UAS at 2,400 feet while on a 7 NM final to Runway 22L. No evasive action taken. PANYNJ PD notified at.","['rwy 22l']","['7 NM ']","['PAN']","5/28/2019","18:52","2019-05-28T18:52Z","UCA4934","DEN","UAS",NA,"EWR",NA,NA,NA,NA,NA,NA,NA,NA,NA,NA,NA,NA,NA,NA,NA,NA,"EWR","EXCEPTION"
"Reported while on ILS approach to Runway15, observed a white UAS 200 feet off the left side at 1,500 feet. No evasive action taken. LEO not notified.","['rwy15']","[]","[]","6/4/2019","22:25","2019-06-04T22:25Z","TURTLE4","DEN","UAS","COD","CHS",NA,NA,NA,NA,NA,NA,NA,NA,NA,NA,NA,NA,NA,NA,NA,NA,"CHS","EXCEPTION"
"Reported observing a large bundle of Mylar balloons blowing across theRWY at TWY E while on short final. Aircraft executed a missed approach and went aroundafter ASDE-X-ALERT activated. Aircraft landed without incident on the second approach.  ","[]","[]","['ASD']","7/5/2019","1:10","2019-07-05T01:10Z","DAL143","DEN","UAS",NA,"SEA",NA,NA,NA,NA,NA,NA,NA,NA,NA,NA,NA,NA,NA,NA,NA,NA,"SEA","EXCEPTION"
"Reported a UAS with blue lights at 1,500 feet off the right side while on 4 NM final to runway 1R. No evasive action reported.Fairfax County PD notified at 703 691 2131.","['rwy 1r']","[]","[]","7/9/2019","6:36","2019-07-09T06:36Z","JIA5095","NCRCC","UAS",NA,"IAD",NA,NA,NA,NA,NA,NA,NA,NA,NA,NA,NA,NA,NA,NA,NA,NA,"IAD","EXCEPTION"
"USSS detected Mavic Pro just S of runway 22L. Cross streets: Point Breeze Place and Mott Ave. 60 � 197 feet flying along the beach and over the water. 40.610.094, 73.771.399. Protective Intelligence (PI) Notified. Short duration flight. Operator not identified / UAS not located.  ","['rwy 22l']","[]","[]","9/24/2019","14:00","2019-09-24T14:00Z",NA,"JATOC","UAS","TOI-UAS-TFR","USSS",NA,NA,NA,NA,NA,NA,NA,NA,NA,NA,NA,NA,NA,NA,NA,NA,"USSS","EXCEPTION"
"At approximately 1000L the ATM was notified that there was an individual operating a UAS less than one NM from the runway. No manned aircraft were involved or interfered with during his operation. The pilot of the UAS was identified as Mr. Dave Scranton. His cell number is. Copied from MOR.","[]","[]","['ATM', 'MOR']","10/29/2019","14:00","2019-10-29T14:00Z",NA,"DEN","UAS",NA,"RME",NA,NA,NA,NA,NA,NA,NA,NA,NA,NA,NA,NA,NA,NA,NA,NA,"RME","EXCEPTION"
"The pilot of ASH6022 originally reported a bird strike at approximately the DCA315020, which is N of Sterling, VA just W of the Trump National Golf course.   The aircraft was heading S at altitude 2,700 feet setting up for a landing on runway 19L.  No injuries or damage to aircraft were reported.  The strike occurred about 0025 Zulu and aircraft landed 0029 Zulu without incident.  The pilot reported a bird strike, but upon inspection of the aircraft on the ground, the crew could not locate any normal signs of a bird strike, such as blood, feathers or anything biological.  The crew upon reflection said the strike did not sound like a bird which is usually a soft thud, but it sounded more like a sharp crack like a baseball bat.   Because of the lack of biological evidence and the sharp sound of impact, the crew believes they hit a UAS.  Fairfax County PD is being notified of this incident.  0154:  The Washington Operations Center (WOC) called the FAA DEN position and told them Mesa Airlines (ASH) had a maintenance crew re examine the aircraft and the airline is now changing this incident to Bird Strike.  The airline did not pass to the FAA why they changed this report.  NFA. ","['rwy 19l']","[]","['ASH', 'DCA', 'DEN', 'ASH']","11/3/2019","1:07","2019-11-03T01:07Z","ASH6022","NCRCC","UAS",NA,"PCT",NA,NA,NA,NA,NA,NA,NA,NA,NA,NA,NA,NA,NA,NA,NA,NA,"PCT","EXCEPTION"
"A citizen observed a UAS off the S end of Runway 18R. No aircraft were involved. Orange County Sheriff notified at 407-*893-3600.","['rwy 18r']","[]","[]","11/5/2019","17:49","2019-11-05T17:49Z",NA,"DEN","UAS",NA,"MCO",NA,NA,NA,NA,NA,NA,NA,NA,NA,NA,NA,NA,NA,NA,NA,NA,"MCO","EXCEPTION"
"Military Police observed a UAS at the approach end of Runway 18. No impact to the operation. ","['rwy 18 ']","[]","[]","12/19/2019","4:25","2019-12-19T04:25Z",NA,"DEN","UAS",NA,"NZY",NA,NA,NA,NA,NA,NA,NA,NA,NA,NA,NA,NA,NA,NA,NA,NA,"NZY","EXCEPTION"
"Airport PD observed a UAS hovering 80 feet over Terminal Concourse B, then went across all 3 runways and disappeared. AWO/MR notified.","[]","[]","['AWO']","2/26/2020","14:12","2020-02-26T14:12Z",NA,"DEN","UAS",NA,"RNO",NA,NA,NA,NA,NA,NA,NA,NA,NA,NA,NA,NA,NA,NA,NA,NA,"RNO","EXCEPTION"
"Airport Operation advised Air Traffic that a UAS has been detected on the E side of the airport. Air Traffic Operations have been suspended for Runways 10/28 and 1R/19L.. Airport Operations has dispatched vehicles to search the area. AWO/MR notified. 2245 TPA ATCT reports Airport Operations was unable to find the UAS or the Operators, Airport Operations normal. ","[]","[]","['AWO', 'TPA', 'TCT']","4/19/2020","22:18","2020-04-19T22:18Z",NA,"DEN","UAS",NA,"TPA",NA,NA,NA,NA,NA,NA,NA,NA,NA,NA,NA,NA,NA,NA,NA,NA,"TPA","EXCEPTION"
"DCA-1: PIC reported a quad-copter UAS, white and/or silver, 1 - 1.5 feet in diameter on 2 NM final to runway 1 at DCA (DCA180002). The UAS was at the 1 o'clock position and moving SW bound at approximately 200 feet and passed behind and below the aircraft. The aircraft was at 600 feet. No evasive action taken. DC Metro Harbor PD notified at. DCA will complete a MOR. MX notified.","['rwy 1 ']","[]","['DCA', 'DCA', 'DCA', 'DCA', 'MOR']","5/12/2020","19:22","2020-05-12T19:22Z","AAL1290","NCRCC","TOI-NCR FRZ","LAW ENFORCEMENT, UAS","DCA",NA,NA,NA,NA,NA,NA,NA,NA,NA,NA,NA,NA,NA,NA,NA,NA,"DCA","EXCEPTION"
"Via MOR, aircraft observed a UAS while on a 2 NM final for Runway 28R at 1,100 feet. No evasive action was taken. Hayward PD notified at.","['rwy 28r']","['2 NM ']","['MOR']","6/1/2020","1:09","2020-06-01T01:09Z","N99JY","DEN","UAS",NA,"HWD",NA,NA,NA,NA,NA,NA,NA,NA,NA,NA,NA,NA,NA,NA,NA,NA,"HWD","EXCEPTION"
"While conducting a routine runway sweep, an Airport Operations Vehicle discovered a UAS on Runway 2. ATC reports no impact on airport operations. New Haven PD notified at. PD confiscated the UAS.","['rwy 2  ']","[]","[]","4/4/2021","22:34","2021-04-04T22:34Z",NA,"DEN","UAS",NA,"HVN",NA,NA,NA,NA,NA,NA,NA,NA,NA,NA,NA,NA,NA,NA,NA,NA,"HVN","EXCEPTION"
"A Flight Instructor walking on the ramp observed a UAS fly over the Runway. The individual flying the UAS was identified by Airport Operations and had a waiver issued by the FAA to operate but failed to notified ATC prior to operating the UAS. Airport operations were not impacted.","[]","[]","[]","4/17/2021","18:42","2021-04-17T18:42Z",NA,"DEN","UAS",NA,"RAL",NA,NA,NA,NA,NA,NA,NA,NA,NA,NA,NA,NA,NA,NA,NA,NA,"RAL","EXCEPTION"
"2155 EDT / 0155 UTC 8/23/2021
Chicago OHare (ORD) ATCT/Chicago TRACON (C90)  Sunday, August 22, 2021 at 6:25 p.m. CDT:  (Envoy) ENY3961/E170 departed the ORD Airport on Runway 9C and collided with a Unmanned Aerial Vehicle (UAV) approximately 1 NM from the departure end.  ENY3961 declared an emergency, returned to the ORD Airport, and landed without incident.  (JetBlue) JBU2112/E170, a prior departure from Runway 9C, had reported to ORD ATCT they had observed an UAV on departure.  In a post event aircraft inspection, it was reported that drone materials were found in the aircraft engine.  ATC services were provided by ORD and C90.
An SRT will be conducted on Monday, August 23, 2021, at a time to be determined.
","['rwy 9c', 'rwy 9c']","[]","['ORD', 'TCT', 'RAC', 'NY39', 'ORD', 'NY39', 'ORD', 'ORD', 'TCT', 'ORD']","8/23/2021","1:51","2021-08-23T01:51Z",NA,"JATOC","UAS",NA,"ORD",NA,NA,NA,NA,NA,NA,NA,NA,NA,NA,NA,NA,NA,NA,NA,NA,"ORD","EXCEPTION"
"MA State PD observed a UAS over the airport at multiple altitudes on Runway 15R final. Airport configuration was changed to land Runway 27. MA State PD responding to area. 0056 MA State PD has secured the UAS and has the user in custody. CT/AWO notified. Airport Ops resume normal. 0117 UPDATE: 5 aircraft pulled off the final. AWO notified.","['rwy 15r', 'rwy 27 ']","[]","['AWO', 'AWO']","8/26/2021","0:47","2021-08-26T00:47Z",NA,"DEN","UAS",NA,"BOS",NA,NA,NA,NA,NA,NA,NA,NA,NA,NA,NA,NA,NA,NA,NA,NA,"BOS","EXCEPTION"
"Pilot reported a largesilver UAS at 1,300 feet near Wiregrass VOR while on left base for RWY 32. No evasive action reported. LEO notification not reported. ","['rwy32 ']","[]","[]","12/12/2018","22:23","2018-12-12T22:23Z","R51271","DEN","UAS",NA,"DHN",NA,NA,NA,NA,NA,NA,NA,NA,NA,NA,NA,NA,NA,NA,NA,NA,"DHN","NAVAID"
"W-ROC reports aircraft reported a white UAS at 2,500 feet off the right side while NNW bound at the same altitude on final to RWY 34R. No evasive action taken. Local LEO notified by 911. ","['rwy34r']","[]","['ROC', '34R']","1/4/2018","5:00","2018-01-04T05:00Z","ASA918","DEN","UAS",NA,"WOC",NA,NA,NA,NA,NA,NA,NA,NA,NA,NA,NA,NA,NA,NA,NA,"RWY 34R","WOC","RUNWAY"
"Aircrew reported observing a light from a UAS, 200 feet off of his right wing operating in the area of the W ramp to RWY 11R while on final.No evasive action taken. Tucson LEO aircraft on the frequency and in the area SRVY1 and AIRE1 conducted a search, but did not locate the UAS operator. ","['rwy11r']","[]","['11R', 'SRV']","1/5/2018","11:35","2018-01-05T11:35Z","SKW3019","DEN","UAS",NA,"TUS",NA,NA,NA,NA,NA,NA,NA,NA,NA,NA,NA,NA,NA,NA,NA,"RWY 11R","TUS","RUNWAY"
"GEG ATCT noticed a person parked at the approach end of the runway operating an UAS near the approach lights for RWY 21.No Aircraft were involved. GEG Airport Police notified.","['rwy21 ']","[]","['GEG', 'TCT', 'GEG']","1/26/2018","4:45","2018-01-26T04:45Z",NA,"DEN","UAS",NA,"GEG",NA,NA,NA,NA,NA,NA,NA,NA,NA,NA,NA,NA,NA,NA,NA,"RWY 21","GEG","RUNWAY"
"UAS over flew Aircraft while taxiing for departure RWY 12L, UAS disappeared towards Flatirons Mall. Broomfield PD notified at.","['rwy12l']","[]","[]","1/26/2018","9:59","2018-01-26T09:59Z","N144RU","DEN","UAS",NA,"BJC",NA,NA,NA,NA,NA,NA,NA,NA,NA,NA,NA,NA,NA,NA,NA,"RWY 12L","BJC","RUNWAY"
"Reported a red and green UAS at 2,900 feet off the right side of the aircraft while on a 3 NM final to RWY 12R. No evasive action taken. LEO notification not reported.","['rwy12r']","['3 NM ']","[]","1/28/2018","7:53","2018-01-28T07:53Z","N310CE","DEN","UAS",NA,"LAS",NA,NA,NA,NA,NA,NA,NA,NA,NA,NA,NA,NA,NA,NA,NA,"RWY 12R","LAS","RUNWAY"
"While in the touch and go pattern for RWY 29R reported a UAS pass within a few hundred feet, just underneath the right wing. No evasive action taken. Air# helicopter notified on frequency. ","['rwy29r']","[]","[]","2/6/2018","7:17","2018-02-06T07:17Z","ZAPER12","DEN","UAS",NA,"TUS",NA,NA,NA,NA,NA,NA,NA,NA,NA,NA,NA,NA,NA,NA,NA,"RWY 29R","TUS","RUNWAY"
"Reported small grey UAS off right side while on final approach to OAK RWY 30.No evasive action taken. LEO notification not reported. ","['rwy30 ']","[]","['OAK']","2/11/2018","6:35","2018-02-11T06:35Z","NAX7073","DEN","UAS",NA,"OAK",NA,NA,NA,NA,NA,NA,NA,NA,NA,NA,NA,NA,NA,NA,NA,"RWY 30","OAK","RUNWAY"
"ATCT observed a UAS moving E-to-W and hovering along the first 3,000 feet of RWY 28. No Aircraft involved. Local LEO and CFR notified. ","['rwy28 ']","[]","['TCT']","2/15/2018","4:36","2018-02-15T04:36Z",NA,"DEN","UAS",NA,"STX",NA,NA,NA,NA,NA,NA,NA,NA,NA,NA,NA,NA,NA,NA,NA,"RWY 28","STX","RUNWAY"
"I90 advised observing a radar target at 2151initially over the approach end of RWY 22 with a beacon code of 4245, climb from 1,000 feetto 10,100 feet and then hover over the approach end of RWY 31L.AADS replay shows a tag as AV1 at 2154, roll to UFO, then TFC at 2203. Target descends and drops from AADS at 2204. No Aircraft observed the UAS, however HOU ATCT visually observed a 'large white UAS until they lost sight of it to the ESE. HOU PD notified at. No impact to ATC. NW advised. ","['rwy22 ', 'rwy31l']","[]","['ADS', 'ADS', 'HOU', 'TCT', 'HOU']","3/2/2018","6:52","2018-03-02T06:52Z",NA,"DEN","OTHER","UAS","I90",NA,NA,NA,NA,NA,NA,NA,NA,NA,NA,NA,NA,NA,NA,NA,"RWY 22","I90","RUNWAY"
"Aircraft reported 2 white quad rotor UASs approximately 5 feet in width pass 100 feet off the left side heading SW bound while the aircraft was N bound at 1,000 feet on a 3 NM final to RWY 36L. No evasive action take. Orange County Sheriff Aviation Unit notified at. ","['rwy36l']","['3 NM ']","[]","3/8/2018","2:25","2018-03-08T02:25Z","UPS5528","DEN","UAS",NA,"MCO",NA,NA,NA,NA,NA,NA,NA,NA,NA,NA,NA,NA,NA,NA,NA,"RWY 36L","MCO","RUNWAY"
"Aircraft reported striking a bird or a UAS while on a 5 NM final to RWY 01R at 2,500 feet. ","['rwy01r']","['5 NM ']","[]","3/9/2018","4:45","2018-03-09T04:45Z","RPA4659","DEN","UAS",NA,"MCI",NA,NA,NA,NA,NA,NA,NA,NA,NA,NA,NA,NA,NA,NA,NA,"RWY 01R","MCI","RUNWAY"
"March 8, 2345 - Aircraft reported striking a bird or a UAS while on a 5 NM final to RWY 01R at 2,500 feet. UPDATE: Republic Airlines Chief Pilot reports thatthe aircraft did not experience a bird or UAS strikeduring landing at MCI.PIC advisedthe sighting was most likely a bird, but co-pilot reported a UAS striketoATC during landing. MR notified. NFA. ","['rwy01r']","['5 NM ']","['MCI']","3/10/2018","1:01","2018-03-10T01:01Z","RPA4659","DEN","UAS",NA,"HQ DEN",NA,NA,NA,NA,NA,NA,NA,NA,NA,NA,NA,NA,NA,NA,NA,"RWY 01R","HQ DEN","RUNWAY"
"PIC reported a black and red UAS 300 feet below at the 3 o'clock position at 700 feet while departing RWY 25. No evasive action taken. LEOS not notified.","['rwy25 ']","[]","['EOS']","3/19/2018","21:19","2018-03-19T21:19Z","N65624","DEN","UAS",NA,"ORL",NA,NA,NA,NA,NA,NA,NA,NA,NA,NA,NA,NA,NA,NA,NA,"RWY 25","ORL","RUNWAY"
"Reported that a UAS passed 10 feet off of the right side while SE bound at 1,500 feet on a 4 NM final to RWY 32L. No evasive action taken. LEOwas not notified. ","['rwy32l']","[]","[]","3/20/2018","10:06","2018-03-20T10:06Z","N58CW","DEN","UAS",NA,"BFI",NA,NA,NA,NA,NA,NA,NA,NA,NA,NA,NA,NA,NA,NA,NA,"RWY 32L","BFI","RUNWAY"
"Airport personnel reported a UAS with a red light a 300 feet 1.5 NM off the approach end of RWY 16. No Aircraft involved. No impact to operations. Volusia County Sheriff notified via 911.","['rwy16 ']","['5 NM ']","[]","3/22/2018","10:07","2018-03-22T10:07Z",NA,"DEN","UAS",NA,"DAB",NA,NA,NA,NA,NA,NA,NA,NA,NA,NA,NA,NA,NA,NA,NA,"RWY 16","DAB","RUNWAY"
"Reported a white 2 inch wide UAS while N bound on final to RWY 09L at 300 FT. No evasive action taken. Chicago Airport PD notified at. ","['rwy09l']","[]","[]","3/24/2018","2:25","2018-03-24T02:25Z","UAL2011","DEN","UAS",NA,"ORD",NA,NA,NA,NA,NA,NA,NA,NA,NA,NA,NA,NA,NA,NA,NA,"RWY 09L","ORD","RUNWAY"
"Reported observing a UAS moving Nbound towards an observation area in the vicinity of the airport while the aircraft was waiting for departure on TWY C for RWY 10L. Unknown if LEO was notified. ","['rwy10l']","[]","[]","3/26/2018","6:27","2018-03-26T06:27Z","JBU1590","DEN","UAS",NA,"FLL",NA,NA,NA,NA,NA,NA,NA,NA,NA,NA,NA,NA,NA,NA,NA,"RWY 10L","FLL","RUNWAY"
"Aircraft departed RWY 24,1 NM after departure, PIC reported a small UASabout 2 feet in diameter off his right side at approximately 1,100 feet.Pilot reported taking evasive action by turning a couple of degrees to avoidtheUAS. Unknown if LEOwasnotified. MR notified.","['rwy24']","[]","[]","3/29/2018","3:30","2018-03-29T03:30Z","N6624J","DEN","UAS","MOR","CSG",NA,NA,NA,NA,NA,NA,NA,NA,NA,NA,NA,NA,NA,NA,NA,"RWY 24","CSG","RUNWAY"
"Aircraft reportedUAS off left side at 800 feetwhile on 2 NM final for RWY 24. No evasive action taken. Jefferson County Sheriff notified.","['rwy24 ']","['2 NM ']","[]","3/30/2018","2:38","2018-03-30T02:38Z","N525BP","DEN","UAS",NA,"BHM",NA,NA,NA,NA,NA,NA,NA,NA,NA,NA,NA,NA,NA,NA,NA,"RWY 24","BHM","RUNWAY"
"Reported observing a black 4 rotor UAS passing 100 feetabove while on an 8 NM final for RWY 25L at 2,500 feet. No evasive action taken. LAX PD notified at.","['rwy25l']","[]","['LAX']","4/1/2018","22:42","2018-04-01T22:42Z","SWA5069","DEN","UAS",NA,"LAX",NA,NA,NA,NA,NA,NA,NA,NA,NA,NA,NA,NA,NA,NA,NA,"RWY 25L","LAX","RUNWAY"
"PIC reported a large white UASat 400-500 feet near departure end of RWY 25R. No evasive action reported. Police notified at, and Sheriff notified at.","['rwy25r']","[]","[]","4/4/2018","7:47","2018-04-04T07:47Z","N1827N","DEN","UAS",NA,"LGB",NA,NA,NA,NA,NA,NA,NA,NA,NA,NA,NA,NA,NA,NA,NA,"RWY 25R","LGB","RUNWAY"
"PIC reported a UAS 1,000 feet below Aircraftwhile inbound to RWY 22L at 2,000 feet VCNTY of the Punchbowl. No evasive action taken. LEO notified via 911. ","['rwy22l']","[]","[]","4/4/2018","8:24","2018-04-04T08:24Z","MHO59","DEN","UAS",NA,"HNL",NA,NA,NA,NA,NA,NA,NA,NA,NA,NA,NA,NA,NA,NA,NA,"RWY 22L","HNL","RUNWAY"
"Reported a UAS off the right side 800 feet below aircraft while at 1,500 feet on a 5 NM final to RWY 35R. No evasive action taken. Orange Co PD notified at.","['rwy35r']","['5 NM ']","[]","4/5/2018","22:03","2018-04-05T22:03Z","CMP446","DEN","UAS",NA,"MCO",NA,NA,NA,NA,NA,NA,NA,NA,NA,NA,NA,NA,NA,NA,NA,"RWY 35R","MCO","RUNWAY"
"Reported observing a silver and white multi-rotor UAS at 2,000 feet while inbound on left downwind to RWY 34. No evasive action taken. Wheeling PD notified at.","['rwy34 ']","[]","[]","4/7/2018","23:50","2018-04-07T23:50Z","N346XL","DEN","UAS",NA,"PWK",NA,NA,NA,NA,NA,NA,NA,NA,NA,NA,NA,NA,NA,NA,NA,"RWY 34","PWK","RUNWAY"
"PIC reported an orange and white UAS on final to RWY 08L. UAS was N bound at 150-200 feet. No evasive action taken. LEO notification not reported.","['rwy08l']","[]","[]","4/9/2018","0:54","2018-04-09T00:54Z","DAL15","DEN","UAS",NA,"A80",NA,NA,NA,NA,NA,NA,NA,NA,NA,NA,NA,NA,NA,NA,NA,"RWY 08L","A80","RUNWAY"
"PIC reported a red and black UAS on left side at same altitude while at 1,200 feet on 3 NM final to RWY 24R. No evasive action reported. LAPD Aviation Unit notified at. ","['rwy24r']","['3 NM ']","['24R']","4/9/2018","5:00","2018-04-09T05:00Z","NKS478","DEN","UAS",NA,"LAX",NA,NA,NA,NA,NA,NA,NA,NA,NA,NA,NA,NA,NA,NA,NA,"RWY 24R","LAX","RUNWAY"
"PIC reported a UAS at 800 feet while S bound on final to RWY 19. No evasive action taken. Hackensack Police notified at. ","['rwy19 ']","[]","[]","4/10/2018","3:20","2018-04-10T03:20Z","EJM42","DEN","UAS",NA,"TEB",NA,NA,NA,NA,NA,NA,NA,NA,NA,NA,NA,NA,NA,NA,NA,"RWY 19","TEB","RUNWAY"
"Reported a UAS 300 FT underneath Aircraft while SE bound at 2.600ft 5.5 NW SAT on final RWY 13R. No evasive action taken. San Antonio PD notified at. ","['rwy13r']","[]","['SAT', '13R']","4/12/2018","3:53","2018-04-12T03:53Z","SWA2024","DEN","UAS",NA,"SAT",NA,NA,NA,NA,NA,NA,NA,NA,NA,NA,NA,NA,NA,NA,NA,"RWY 13R","SAT","RUNWAY"
"Reported a UAS off the left side after departing RWY 18L heading Ebound climbing to 13,000 feet. Evasive action not reported. CVG Airport PD notified.","['rwy18l']","[]","['CVG']","4/16/2018","5:10","2018-04-16T05:10Z","EDV3320","DEN","UAS",NA,"CVG",NA,NA,NA,NA,NA,NA,NA,NA,NA,NA,NA,NA,NA,NA,NA,"RWY 18L","CVG","RUNWAY"
"IAB reported a UAS pass over RWY 01R and 1L at approximately 150 feet to 200 feet and continue SW bound. Aircraft operations not impacted. Base security notified via 911. ","['rwy01r']","[]","['IAB']","4/19/2018","16:53","2018-04-19T16:53Z",NA,"DEN","UAS",NA,"ICT",NA,NA,NA,NA,NA,NA,NA,NA,NA,NA,NA,NA,NA,NA,NA,"RWY 01R","ICT","RUNWAY"
"Reported a Black UAS at 2,000 feet while on right base to RWY 04L. No evasive action taken. LIT PD notified at.","['rwy04l']","[]","['LIT']","4/19/2018","21:34","2018-04-19T21:34Z","DAL1913","DEN","UAS",NA,"LIT",NA,NA,NA,NA,NA,NA,NA,NA,NA,NA,NA,NA,NA,NA,NA,"RWY 04L","LIT","RUNWAY"
"PIC reported an orange UAS off left side at 1,000 feet while on final to RWY 36. No evasive action taken. Collin County Sheriff notified, phone number not provided.","['rwy36 ']","[]","[]","4/23/2018","2:52","2018-04-23T02:52Z","N1369Q","DEN","UAS",NA,"TKI",NA,NA,NA,NA,NA,NA,NA,NA,NA,NA,NA,NA,NA,NA,NA,"RWY 36","TKI","RUNWAY"
"PIC reported a black UAS 200 feet below while on a2 NM final to RWY 25L at 500 feet. No evasive action reported. LA Airport Authority notified at.","['rwy25l']","['2 NM ']","[]","4/24/2018","5:38","2018-04-24T05:38Z","UAL935","DEN","UAS",NA,"LAX",NA,NA,NA,NA,NA,NA,NA,NA,NA,NA,NA,NA,NA,NA,NA,"RWY 25L","LAX","RUNWAY"
"PIC reported a UAS 300 feet off right side while on final to RWY 27 at 1,000 feet. No evasive action taken. San Diego Harbor Patrol notified at.","['rwy27 ']","[]","[]","4/25/2018","6:41","2018-04-25T06:41Z","BAW44N","DEN","UAS",NA,"SAN",NA,NA,NA,NA,NA,NA,NA,NA,NA,NA,NA,NA,NA,NA,NA,"RWY 27","SAN","RUNWAY"
"PIC reported a black UAS passing 50 feet above Aircraft while on final to RWY 34. No evasive action taken. Arlington Police notified via 911. ","['rwy34 ']","[]","[]","4/27/2018","5:10","2018-04-27T05:10Z","N348N","DEN","UAS",NA,"GKY",NA,NA,NA,NA,NA,NA,NA,NA,NA,NA,NA,NA,NA,NA,NA,"RWY 34","GKY","RUNWAY"
"Reported a UAS flew within 50 feet over the top of his aircraft while on a 2 NM final to RWY 13. Evasive action was not reported. LEO was notified. ","['rwy13 ']","[]","[]","4/28/2018","7:20","2018-04-28T07:20Z","N60100","DEN","UAS",NA,"SUN",NA,NA,NA,NA,NA,NA,NA,NA,NA,NA,NA,NA,NA,NA,NA,"RWY 13","SUN","RUNWAY"
"Reported a UAS below and 1 NM lateral from aircraft while WSW bound at 2,000 feet on a 4 NM final to RWY 24R. No evasive action taken. Airport Ops notified. ","['rwy24r']","['1 NM ', '4 NM ']","['24R']","5/1/2018","2:19","2018-05-01T02:19Z","DAL1543","DEN","UAS",NA,"LAX",NA,NA,NA,NA,NA,NA,NA,NA,NA,NA,NA,NA,NA,NA,NA,"RWY 24R","LAX","RUNWAY"
"Reported a UAS while S bound at 3,000 feet on a 3 NM final to RWY 19. No evasive action taken. LEO notification not reported. ","['rwy19 ']","['3 NM ']","[]","5/1/2018","6:09","2018-05-01T06:09Z","WWW443","DEN","UAS",NA,"L30",NA,NA,NA,NA,NA,NA,NA,NA,NA,NA,NA,NA,NA,NA,NA,"RWY 19","L30","RUNWAY"
"PIC reported a UAS at same altitude at 1,800 feet on 4 NM final to RWY 34L. No evasive action taken. LEO notification not reported. ","['rwy34l']","['4 NM ']","[]","5/2/2018","7:31","2018-05-02T07:31Z","N321MX","DEN","UAS",NA,"PAE",NA,NA,NA,NA,NA,NA,NA,NA,NA,NA,NA,NA,NA,NA,NA,"RWY 34L","PAE","RUNWAY"
"Reported a UAS at 1,400 feet while on final approach to RWY 01R. No evasive action taken. Broward Co PD notified at.","['rwy01r']","[]","[]","5/12/2018","0:05","2018-05-12T00:05Z","NKS197","DEN","UAS",NA,"FLL",NA,NA,NA,NA,NA,NA,NA,NA,NA,NA,NA,NA,NA,NA,NA,"RWY 01R","FLL","RUNWAY"
"Reported a UAS or Mylar balloon 100 feet from aircraft while at 500 feet on a 1.5 NM final to RWY 19. No evasive action taken. LEO notification not reported.","['rwy19 ']","['5 NM ']","[]","5/14/2018","5:43","2018-05-14T05:43Z","N759FJ","DEN","UAS",NA,"BTV",NA,NA,NA,NA,NA,NA,NA,NA,NA,NA,NA,NA,NA,NA,NA,"RWY 19","BTV","RUNWAY"
"Reported a UAS pass below aircraft while climbing after departure from RWY 23L. No evasive action taken. LEO notified.","['rwy23l']","[]","[]","5/15/2018","2:15","2018-05-15T02:15Z","SKW4617","DEN","UAS",NA,"RDU",NA,NA,NA,NA,NA,NA,NA,NA,NA,NA,NA,NA,NA,NA,NA,"RWY 23L","RDU","RUNWAY"
"Reported a UAS 100 feet off the right side while on a 6 NM final to RWY 25L. No evasive action taken. Lapd notified at.","['rwy25l']","['6 NM ']","[]","5/15/2018","6:23","2018-05-15T06:23Z","NAX7097","DEN","UAS",NA,"LAX",NA,NA,NA,NA,NA,NA,NA,NA,NA,NA,NA,NA,NA,NA,NA,"RWY 25L","LAX","RUNWAY"
"PIC reported a large flat UAS off right side while SE bound at 2,000 feet on final to RWY 13R. No evasive action taken. FBI notified, phone number not provided. ","['rwy13r']","[]","['13R']","5/15/2018","6:23","2018-05-15T06:23Z","SWA5595","DEN","UAS",NA,"HOU",NA,NA,NA,NA,NA,NA,NA,NA,NA,NA,NA,NA,NA,NA,NA,"RWY 13R","HOU","RUNWAY"
"Reported a large UAS 500 feet below aircraft S of the final approach course from RWY 28L. No evasive action taken. LEO notification not reported.","['rwy28l']","[]","[]","5/18/2018","9:28","2018-05-18T09:28Z","ASA771","DEN","UAS",NA,"PDX",NA,NA,NA,NA,NA,NA,NA,NA,NA,NA,NA,NA,NA,NA,NA,"RWY 28L","PDX","RUNWAY"
"Aircraft reported possible UAS strike while on short final RWY 18 at HSD. PICreported minor damage to prop and front cowling, 1POB, no injuries to FTW FSS. LEO notification not reported. FTW FSS filed FAA Form 8020-9 and notified CSA ROC.","['rwy18 ']","[]","['HSD', 'POB', 'FTW', 'FTW', 'ROC']","5/20/2018","3:48","2018-05-20T03:48Z","N80S","DEN","UAS",NA,"WOC",NA,NA,NA,NA,NA,NA,NA,NA,NA,NA,NA,NA,NA,NA,NA,"RWY 18","WOC","RUNWAY"
"PIC observed a UAS at 800 feet while on final to RWY 27R. No evasive action taken. Philadelphia Police notified at.","['rwy27r']","[]","['27R']","5/24/2018","2:45","2018-05-24T02:45Z","SKV7534","DEN","UAS",NA,"PHL",NA,NA,NA,NA,NA,NA,NA,NA,NA,NA,NA,NA,NA,NA,NA,"RWY 27R","PHL","RUNWAY"
"PIC reported a white UAS 300 feet below off right side while at 2,300 feet on final to RWY 08L. No evasive action taken. Fulton County Police notified at. ","['rwy08l']","[]","[]","5/24/2018","4:26","2018-05-24T04:26Z","ASQ5528","DEN","UAS",NA,"ATL",NA,NA,NA,NA,NA,NA,NA,NA,NA,NA,NA,NA,NA,NA,NA,"RWY 08L","ATL","RUNWAY"
"PIC reported a white UAS while at 300 feet on final to RWY 12R at VRB. No evasive action reported. Indian River Sheriff and Vero Beach Police notified, phone numbers not provided. ","['rwy12r']","[]","['VRB']","5/24/2018","5:31","2018-05-24T05:31Z","SFY203","DEN","UAS",NA,"VRB",NA,NA,NA,NA,NA,NA,NA,NA,NA,NA,NA,NA,NA,NA,NA,"RWY 12R","VRB","RUNWAY"
"Reported sighting a UAS operating at 500 feet while Ebound forRWY 19L. No evasive action taken. Hillsborough County Sheriff notified. ","['rwy19l']","[]","[]","5/25/2018","20:47","2018-05-25T20:47Z","DAL1502","DEN","UAS",NA,"TPA",NA,NA,NA,NA,NA,NA,NA,NA,NA,NA,NA,NA,NA,NA,NA,"RWY 19L","TPA","RUNWAY"
"Multiple arriving Aircraft and Local Controller reported a white 2 foot quadcopter UAS operating below 200 feet on short final RWY 12Lat MSP. Closest proximity was approximately1000 vertical from all Aircraft. No evasive actions reported. MSP ASRPT PDnotified via 911. 1859 CLOSEOUT: HQ DEN contact ATCT todetermine outcome.UAS activity has ceased,PD was unable to locate the UAS pilot.  ","['rwy12l']","[]","['MSP', 'MSP', 'DEN', 'TCT']","5/28/2018","23:28","2018-05-28T23:28Z",NA,"DEN","UAS",NA,"MSP",NA,NA,NA,NA,NA,NA,NA,NA,NA,NA,NA,NA,NA,NA,NA,"RWY 12L","MSP","RUNWAY"
"PIC reported a UAS 300 feet below while SSE bound at 2,000 feet on 5 NM final to RWY 17L. No evasive action taken. DFW DPS notified, phone number not provided.","['rwy17l']","['5 NM ']","['DFW']","5/30/2018","6:14","2018-05-30T06:14Z","AAL2254","DEN","UAS",NA,"DFW",NA,NA,NA,NA,NA,NA,NA,NA,NA,NA,NA,NA,NA,NA,NA,"RWY 17L","DFW","RUNWAY"
"Reported a UAS at 3,000 feet on final to RWY 18R. No evasive action taken. Orange Co PD notified.","['rwy18r']","[]","[]","5/31/2018","23:42","2018-05-31T23:42Z","SWA766","DEN","UAS",NA,"MCO",NA,NA,NA,NA,NA,NA,NA,NA,NA,NA,NA,NA,NA,NA,NA,"RWY 18R","MCO","RUNWAY"
"Reported a UAS off the left side at 1,200 feet while on a3 NM final to RWY 18R. No evasive action taken. Orange County Sheriff notified at. ","['rwy18r']","['3 NM ']","[]","6/1/2018","20:51","2018-06-01T20:51Z","NKS1669","DEN","UAS",NA,"MCO",NA,NA,NA,NA,NA,NA,NA,NA,NA,NA,NA,NA,NA,NA,NA,"RWY 18R","MCO","RUNWAY"
"Numerous aircraft reported a UAS on TCAS while on a 2 NM final to RWY 34R. No RA's received. No visual confirmation received. LEO notification not reported. ","['rwy34r']","['2 NM ']","['34R']","6/2/2018","22:19","2018-06-02T22:19Z","SKW5770","DEN","UAS",NA,"DEN",NA,NA,NA,NA,NA,NA,NA,NA,NA,NA,NA,NA,NA,NA,NA,"RWY 34R","DEN","RUNWAY"
"UAS INCIDENT: 2212 The Pilot of AAL1678departing RWY 27R reported a white UAS over RWY 27R moving S bound across the airport. ATL ATCT also observed the UAS flying across the Airport S bound towards the approach area for RWY 27L just as DAL2046 was on short-final to this Runway. ATL ATCT instructed DAL2046 tocancel itsapproach and go-around due to the close proximity of the UAS. ATL ATCT also observed a grey and black SUV parked on the access road on the S side of the Airport and an individual standing outside the vehicle who appeared to be controlling the UAS. The Individual quicklygot in his vehicle and left the areaafter the DAL2046 approach was disrupted. ATL Airport Operations was notified and they dispatched a vehicle to patrol the area with negative results. TSOC notified. MR notified. ","['rwy27r', 'rwy27r', 'rwy27l']","[]","['CID', 'AL16', '27R', '27R', 'ATL', 'TCT', 'DAL', 'ATL', 'TCT', 'DAL', 'ATL', 'TCT', 'DAL', 'ATL', 'TSO']","6/4/2018","3:56","2018-06-04T03:56Z","AAL1678","DEN","UAS","PAGED","ATL",NA,NA,NA,NA,NA,NA,NA,NA,NA,NA,NA,NA,NA,NA,NA,"RWY 27R","ATL","RUNWAY"
"PIC reported a white and orange UAS at 12 o'clock and 3,000 feet after departing RWY 04R. Evasive action not reported. NYPD Aviation Unit notified at. ","['rwy04r']","[]","[]","6/4/2018","5:05","2018-06-04T05:05Z","UAL1807","DEN","UAS",NA,"N90",NA,NA,NA,NA,NA,NA,NA,NA,NA,NA,NA,NA,NA,NA,NA,"RWY 04R","N90","RUNWAY"
"PIC reported a small white UAS 50 feet below while WNW bound at 100 feet off departure end of RWY 30. No evasive action taken. Alameda County Sheriff notified at.","['rwy30 ']","[]","[]","6/5/2018","1:23","2018-06-05T01:23Z","AAY1020","DEN","UAS",NA,"NCT",NA,NA,NA,NA,NA,NA,NA,NA,NA,NA,NA,NA,NA,NA,NA,"RWY 30","NCT","RUNWAY"
"PIC reported a UAS while on downwind to RWY 31. No other details given. No evasive action taken. LEO notification not reported.","['rwy31 ']","[]","[]","6/5/2018","3:04","2018-06-05T03:04Z","N2126Y","DEN","UAS",NA,"MDT",NA,NA,NA,NA,NA,NA,NA,NA,NA,NA,NA,NA,NA,NA,NA,"RWY 31","MDT","RUNWAY"
"PIC reported a UAS at 1,500 feet while on final to RWY 06. No evasive action taken. LEO notified, agency and phone number not provided. ","['rwy06 ']","[]","[]","6/5/2018","3:46","2018-06-05T03:46Z","N835ZT","DEN","UAS",NA,"TEB",NA,NA,NA,NA,NA,NA,NA,NA,NA,NA,NA,NA,NA,NA,NA,"RWY 06","TEB","RUNWAY"
"PIC reported a UAS on short final to RWY 28L. No other details given. SFO Airport Operations notified, phone number not provided.","['rwy28l']","[]","['SFO']","6/5/2018","3:49","2018-06-05T03:49Z","KLM183","DEN","UAS",NA,"SFO",NA,NA,NA,NA,NA,NA,NA,NA,NA,NA,NA,NA,NA,NA,NA,"RWY 28L","SFO","RUNWAY"
"Whiletaxing onto RWY 13, takeoff clearance was cancelled due to two UAS off the departure end. NYPDAviation unit notified at.","['rwy13']","[]","[]","6/11/2018","3:13","2018-06-11T03:13Z","EDV3337","DEN","UAS",NA,"LGA",NA,NA,NA,NA,NA,NA,NA,NA,NA,NA,NA,NA,NA,NA,NA,"RWY 13","LGA","RUNWAY"
"PIC reported a UAS with flashing lights at 1,000 feet while on left base for RWY 15 at CHS. No evasive action taken. LEO notification not reported. ","['rwy15 ']","[]","['CHS']","6/17/2018","1:31","2018-06-17T01:31Z","N23798","DEN","UAS",NA,"CHS",NA,NA,NA,NA,NA,NA,NA,NA,NA,NA,NA,NA,NA,NA,NA,"RWY 15","CHS","RUNWAY"
"PIC reported a red UAS or R/C Aircraft off right side while NNE bound at 800-1,000 feet on final to RWY 02. No evasive action reported. LEO notification not reported. ","['rwy02 ']","[]","[]","6/17/2018","5:39","2018-06-17T05:39Z","N446PA","DEN","UAS",NA,"HIO",NA,NA,NA,NA,NA,NA,NA,NA,NA,NA,NA,NA,NA,NA,NA,"RWY 02","HIO","RUNWAY"
"PIC reported a UAS while E bound at 2,000 feet on final to RWY 28. No evasive action taken. Montgomery County Sheriff notified at. ","['rwy28 ']","[]","[]","6/19/2018","1:44","2018-06-19T01:44Z","N807GK","DEN","UAS",NA,"MGM",NA,NA,NA,NA,NA,NA,NA,NA,NA,NA,NA,NA,NA,NA,NA,"RWY 28","MGM","RUNWAY"
"Reported a UAS while NE bound at 500 feet on a 2 NM final to RWY 04R. No evasive action taken. Nypd Aviation Unit notified at.","['rwy04r']","['2 NM ']","[]","6/20/2018","3:29","2018-06-20T03:29Z","DAL475","DEN","UAS",NA,"JFK",NA,NA,NA,NA,NA,NA,NA,NA,NA,NA,NA,NA,NA,NA,NA,"RWY 04R","JFK","RUNWAY"
"Reported a UAS while SW bound at 800 feet off the right side on a 3 NM final to RWY 04R. No evasive action taken. Nj State Police notified at.","['rwy04r']","['3 NM ']","[]","6/20/2018","3:35","2018-06-20T03:35Z","SKV7740","DEN","UAS",NA,"EWR",NA,NA,NA,NA,NA,NA,NA,NA,NA,NA,NA,NA,NA,NA,NA,"RWY 04R","EWR","RUNWAY"
"Reported a UAS off the right side at 1,600 feet, 3.5 NM off the departure end of RWY 27R at SFB. No evasive action taken. Seminole Co Sheriff notified at.","['rwy27r']","['5 NM ']","['27R', 'SFB']","6/21/2018","3:00","2018-06-21T03:00Z","N1999E","DEN","UAS",NA,"SFB",NA,NA,NA,NA,NA,NA,NA,NA,NA,NA,NA,NA,NA,NA,NA,"RWY 27R","SFB","RUNWAY"
"Reported a UAS 200 feet below aircraft while on a 1 NM final to RWY 32 at 1,000 feet. No evasive action taken. Myrna Arpt Office Of Safety notified at.","['rwy32 ']","['1 NM ']","[]","6/22/2018","5:09","2018-06-22T05:09Z","CASH11","DEN","UAS",NA,"MQY",NA,NA,NA,NA,NA,NA,NA,NA,NA,NA,NA,NA,NA,NA,NA,"RWY 32","MQY","RUNWAY"
"Reported a UAS 100 feet below aircraft while WSW bound at 2,400 feet, on an 8 NM final to RWY 25L. No evasive action taken. LAX airport operations notified at.","['rwy25l']","['8 NM ']","['LAX']","6/23/2018","4:46","2018-06-23T04:46Z","NAX7091","DEN","UAS",NA,"LAX",NA,NA,NA,NA,NA,NA,NA,NA,NA,NA,NA,NA,NA,NA,NA,"RWY 25L","LAX","RUNWAY"
"Reported a black and red UAS 200 feet above aircraft while SSE bound at 1,600 feet on a 5 NM final to RWY 15. No evasive action taken. Charleston Aviation Authority notified at.","['rwy15 ']","['5 NM ']","[]","6/24/2018","0:21","2018-06-24T00:21Z","AAL2646","DEN","UAS",NA,"CHS",NA,NA,NA,NA,NA,NA,NA,NA,NA,NA,NA,NA,NA,NA,NA,"RWY 15","CHS","RUNWAY"
"PIC reported a white quad-copter below and to the right while on a 5 NM final to RWY 25L at 1,200 feet. No evasive action reported. LA County Sheriff notified at.","['rwy25l']","['5 NM ']","[]","6/24/2018","7:30","2018-06-24T07:30Z","VOI924","DEN","UAS",NA,"LAX",NA,NA,NA,NA,NA,NA,NA,NA,NA,NA,NA,NA,NA,NA,NA,"RWY 25L","LAX","RUNWAY"
"Aircraftreported UASwhile from 2,600 to 5,000 feet on a 15 NM final for RWY 24RtoLAX. No evasive action taken. LAPD Air Unitnotified. Multiple Aircraft reported the UAS.","['rwy24r']","['15 NM ']","['24R', 'LAX']","7/3/2018","9:31","2018-07-03T09:31Z","CPZ5847","DEN","UAS",NA,"NCT",NA,NA,NA,NA,NA,NA,NA,NA,NA,NA,NA,NA,NA,NA,NA,"RWY 24R","NCT","RUNWAY"
"Reported a UAS at 300 feet on final to RWY 13L. No evasive action taken. San Antonio PD notified at.","['rwy13l']","[]","[]","7/3/2018","23:21","2018-07-03T23:21Z","N101HL","DEN","UAS",NA,"SAT",NA,NA,NA,NA,NA,NA,NA,NA,NA,NA,NA,NA,NA,NA,NA,"RWY 13L","SAT","RUNWAY"
"PIC observed a UAS on the left side of aircraft while on 1.5 NM final RWY 10L. The UAS was operating over the Columbia river at 500FT. Law enforcement notification not reported. ","['rwy10l']","['5 NM ']","['00F']","7/5/2018","5:42","2018-07-05T05:42Z","DAL37","DEN","UAS",NA,"PDX",NA,NA,NA,NA,NA,NA,NA,NA,NA,NA,NA,NA,NA,NA,NA,"RWY 10L","PDX","RUNWAY"
"PIC reported a UAS 100 feet from Aircraft while SW bound at 50 feet on short final to RWY 22. No evasive action taken. NYPD Aviation Unit notified at.","['rwy22 ']","[]","[]","7/5/2018","21:41","2018-07-05T21:41Z","DAL1929","DEN","UAS",NA,"LGA",NA,NA,NA,NA,NA,NA,NA,NA,NA,NA,NA,NA,NA,NA,NA,"RWY 22","LGA","RUNWAY"
"Reported observing a gold UAS operating 200 feet below and off of the left side while at 500 feet on a 2.5 NM final to RWY 22L. No evasive action taken. NYPD Aviation notified at. ","['rwy22l']","[]","[]","7/6/2018","4:51","2018-07-06T04:51Z","UAE205","DEN","UAS",NA,"JFK",NA,NA,NA,NA,NA,NA,NA,NA,NA,NA,NA,NA,NA,NA,NA,"RWY 22L","JFK","RUNWAY"
"Reported observing a UAS at 2,000 feet while on a 6 NM final to RWY 25L. No evasive action taken. LAX Airport PD notified at.","['rwy25l']","[]","['LAX']","7/6/2018","5:40","2018-07-06T05:40Z","CPZ6079","DEN","UAS",NA,"LAX",NA,NA,NA,NA,NA,NA,NA,NA,NA,NA,NA,NA,NA,NA,NA,"RWY 25L","LAX","RUNWAY"
"Reported observing a UAS operating 100 feet below while Ebound at 1,200 feet in a turn to downwind for base to RWY 28R. No evasive action taken. LEO was notified. ","['rwy28r']","[]","[]","7/6/2018","5:50","2018-07-06T05:50Z","N4922D","DEN","UAS",NA,"MGM",NA,NA,NA,NA,NA,NA,NA,NA,NA,NA,NA,NA,NA,NA,NA,"RWY 28R","MGM","RUNWAY"
"PIC reported passing two quad copter UAS at approx. 800FT on 5 NM final RWY 16. Closest proximity 700FT vertical. No evasive action taken. Buffalo grove police notified at.","['rwy16 ']","[]","['00F', '00F']","7/7/2018","5:41","2018-07-07T05:41Z","N80BL","DEN","UAS",NA,"PWK",NA,NA,NA,NA,NA,NA,NA,NA,NA,NA,NA,NA,NA,NA,NA,"RWY 16","PWK","RUNWAY"
"Reported observing a red UAS operating 200 feet below off of the right side while WSW bound at 2,600 feet on an 8 NM final to RWY 24R. No evasive action taken. LAX Airport Operations Division notified at. ","['rwy24r']","[]","['24R', 'LAX']","7/7/2018","5:48","2018-07-07T05:48Z","VIR7B","DEN","UAS",NA,"LAX",NA,NA,NA,NA,NA,NA,NA,NA,NA,NA,NA,NA,NA,NA,NA,"RWY 24R","LAX","RUNWAY"
"PIC reported a UAS 2 NM from Aircraft while on final to RWY 12R. No evasive action taken. LEO not notified. No additional INFO provided.","['rwy12r']","['2 NM ']","['INF']","7/7/2018","7:52","2018-07-07T07:52Z","BMJ51","DEN","UAS",NA,"MSP",NA,NA,NA,NA,NA,NA,NA,NA,NA,NA,NA,NA,NA,NA,NA,"RWY 12R","MSP","RUNWAY"
"PIC reported a UAS while NE bound at 1800FT on final for RWY 04 to LGA. No evasive action taken. LEO not notified. ","['rwy04 ']","[]","['00F', 'LGA']","7/8/2018","0:13","2018-07-08T00:13Z","EDV5083","DEN","UAS",NA,"LGA",NA,NA,NA,NA,NA,NA,NA,NA,NA,NA,NA,NA,NA,NA,NA,"RWY 04","LGA","RUNWAY"
"PIC reported a blue UAS 1000FT below while SE bound at 3000FT on final to RWY 13L to JFK. No evasive action taken. NYPD notified at.","['rwy13l']","[]","['00F', '00F', 'JFK']","7/8/2018","1:37","2018-07-08T01:37Z","JBU224","DEN","UAS",NA,"JFK",NA,NA,NA,NA,NA,NA,NA,NA,NA,NA,NA,NA,NA,NA,NA,"RWY 13L","JFK","RUNWAY"
"PIC reported a small black UAS while on short final RWY 12L at 500FT. Closest proximity to aircraft not reported. No evasive action was taken. Saint Louis PD notified at. ","['rwy12l']","[]","['00F']","7/8/2018","5:11","2018-07-08T05:11Z","CTO924","DEN","UAS",NA,"STL",NA,NA,NA,NA,NA,NA,NA,NA,NA,NA,NA,NA,NA,NA,NA,"RWY 12L","STL","RUNWAY"
"PIC reported a UAS 200-300 feet below while turning base legto RWY 11. No evasive action taken. LEO notification not reported. ","['rwy11 ']","[]","[]","7/9/2018","7:05","2018-07-09T07:05Z","N1107D","DEN","UAS",NA,"BED",NA,NA,NA,NA,NA,NA,NA,NA,NA,NA,NA,NA,NA,NA,NA,"RWY 11","BED","RUNWAY"
"PIC reported a UAS while SW bound at 2,000 feet after departing RWY 24. No evasive action taken. N Shore Police notified at.","['rwy24 ']","[]","[]","7/9/2018","7:34","2018-07-09T07:34Z","C6560","DEN","UAS",NA,"MKG",NA,NA,NA,NA,NA,NA,NA,NA,NA,NA,NA,NA,NA,NA,NA,"RWY 24","MKG","RUNWAY"
"Reported observing a black UAS off of the left side while Nbound at 600 feet on a 2 NM final to RWY 02. No evasive action taken. Jefferson County Parrish notified at. ","['rwy02 ']","[]","[]","7/10/2018","21:56","2018-07-10T21:56Z","NKS815","DEN","UAS",NA,"MSY",NA,NA,NA,NA,NA,NA,NA,NA,NA,NA,NA,NA,NA,NA,NA,"RWY 02","MSY","RUNWAY"
"PIC reported a white UAS off left side at 1,500-1,600FT on final to RWY 28R. No evasive action taken. Pittsburgh police were notified. No phone number provided.","['rwy28r']","[]","['00F']","7/11/2018","3:26","2018-07-11T03:26Z","FDY757","DEN","UAS",NA,"PIT",NA,NA,NA,NA,NA,NA,NA,NA,NA,NA,NA,NA,NA,NA,NA,"RWY 28R","PIT","RUNWAY"
"Law enforcement helicopter was on acall holding on a 2 NM final to RWY 02 at 1,300 feet. PIC noticed a UAS operating 100 feet below their Aircraft and watched the UAS operator land the UAS and go intoan apartment. Ground units were dispatched to the apartment, Concord PD confiscated the UAS and have the operator's info.","['rwy02 ']","['2 NM ']","[]","7/12/2018","7:55","2018-07-12T07:55Z","SNOOPY1","DEN","UAS",NA,"JQF",NA,NA,NA,NA,NA,NA,NA,NA,NA,NA,NA,NA,NA,NA,NA,"RWY 02","JQF","RUNWAY"
"Aircraft reported two black quad-copter UAS off the right side, 200 feet above,while at 2,500 on 6 NMfinal RWY 04R to EWR. No evasive action taken. NJ State PDnotified at.","['rwy04r']","[]","['EWR']","7/13/2018","0:17","2018-07-13T00:17Z","MTN8313","DEN","UAS",NA,"EWR",NA,NA,NA,NA,NA,NA,NA,NA,NA,NA,NA,NA,NA,NA,NA,"RWY 04R","EWR","RUNWAY"
"Aircraft reporteda 2 foot diameter, white quadcopter, UASapproximately 200 feetoff left side while at 1700 feet on 5 NM final RWY 28C at ORD.City Command Center notified at. PIC advised ORD ATCT he intended to file ASAP and NM AC report. ","['rwy28c']","['5 NM ']","['ORD', 'ORD', 'TCT']","7/13/2018","3:47","2018-07-13T03:47Z","SKW3115","DEN","UAS",NA,"ORD",NA,NA,NA,NA,NA,NA,NA,NA,NA,NA,NA,NA,NA,NA,NA,"RWY 28C","ORD","RUNWAY"
"LATE NOTIFICATION: SFO ATCTfiled MOR advising the Airfield Safety Officers found a drone on the N end of RWY 01Ron 7/11/2018 during a monthly engineering material arresting system inspection.The ATCT was not notifiedon 7/11/2018.","['rwy01r']","[]","['TIF', 'SFO', 'TCT', 'MOR', 'TCT']","7/13/2018","4:03","2018-07-13T04:03Z",NA,"DEN","UAS",NA,"WOC",NA,NA,NA,NA,NA,NA,NA,NA,NA,NA,NA,NA,NA,NA,NA,"RWY 01R","WOC","RUNWAY"
"PIC reported a white UAS 300 feet below off right side while N bound at 1,000 on a 3.5 NM final to RWY 35R. No evasive action taken. Orange County Sheriff notified at.","['rwy35r']","['5 NM ']","[]","7/13/2018","22:56","2018-07-13T22:56Z","JBU730","DEN","UAS",NA,"MCO",NA,NA,NA,NA,NA,NA,NA,NA,NA,NA,NA,NA,NA,NA,NA,"RWY 35R","MCO","RUNWAY"
"PIC reported 4 rotor UAS 100FT off the 12 o'clock position heading to their 3 o'clock at 3,200FT while on final RWY 24 at Wings Field ARPT. No evasive actionreported. LEO notification not reported.","['rwy24 ']","[]","['00F', '00F']","7/14/2018","23:58","2018-07-14T23:58Z","N914AS","DEN","UAS",NA,"PHL",NA,NA,NA,NA,NA,NA,NA,NA,NA,NA,NA,NA,NA,NA,NA,"RWY 24","PHL","RUNWAY"
"PIC reported a white quad-copter UAS off right side at 1,500 feet on 5 NM final to RWY 24R. No evasive action taken. LEO notified, phone number not provided.","['rwy24r']","['5 NM ']","['24R']","7/15/2018","2:01","2018-07-15T02:01Z","WJA1510","DEN","UAS",NA,"LAX",NA,NA,NA,NA,NA,NA,NA,NA,NA,NA,NA,NA,NA,NA,NA,"RWY 24R","LAX","RUNWAY"
"PIC reported a black quad-copter UAS while SE bound at 2,200 feet on a 6 NM final to RWY 13R. No evasive action taken. DFW Airport DPS notified at.","['rwy13r']","['6 NM ']","['13R', 'DFW']","7/15/2018","4:18","2018-07-15T04:18Z","GAJ854","DEN","UAS",NA,"DFW",NA,NA,NA,NA,NA,NA,NA,NA,NA,NA,NA,NA,NA,NA,NA,"RWY 13R","DFW","RUNWAY"
"PIC reported a black quad-copter UAS while W bound at 2,700 feet on a 6 NM final to RWY 27L. No evasive action taken. LEO not notified. ","['rwy27l']","['6 NM ']","[]","7/15/2018","4:56","2018-07-15T04:56Z","SKW5567","DEN","UAS",NA,"ORD",NA,NA,NA,NA,NA,NA,NA,NA,NA,NA,NA,NA,NA,NA,NA,"RWY 27L","ORD","RUNWAY"
"PIC reported a UAS 1 NM off left side at 1,200 feet while on 1 NM final to RWY 18. No evasive action taken. LEO not notified.","['rwy18 ']","['1 NM ', '1 NM ']","[]","7/15/2018","23:38","2018-07-15T23:38Z","N2260M","DEN","UAS",NA,"DTO",NA,NA,NA,NA,NA,NA,NA,NA,NA,NA,NA,NA,NA,NA,NA,"RWY 18","DTO","RUNWAY"
"PIC reported a large white UAS while SE bound at 500 feet on short final to RWY 21L. No evasive action taken. DTW Airport Police notified at.","['rwy21l']","[]","['DTW']","7/16/2018","0:08","2018-07-16T00:08Z","GJS6206","DEN","UAS",NA,"DTW",NA,NA,NA,NA,NA,NA,NA,NA,NA,NA,NA,NA,NA,NA,NA,"RWY 21L","DTW","RUNWAY"
"PIC reported a black UAS 500 feet below while on a 3 NM final to RWY 06. No evasive action taken. LEO not notified.","['rwy06 ']","['3 NM ']","[]","7/16/2018","0:20","2018-07-16T00:20Z","N335RJ","DEN","UAS",NA,"BHM",NA,NA,NA,NA,NA,NA,NA,NA,NA,NA,NA,NA,NA,NA,NA,"RWY 06","BHM","RUNWAY"
"PIC reported a silver UAS 100 feet above while E bound at 5,000 feet on downwind for RWY 07R. No evasive action taken. FBI notified at.","['rwy07r']","[]","['07R']","7/16/2018","0:29","2018-07-16T00:29Z","SKW5775","DEN","UAS",NA,"C90",NA,NA,NA,NA,NA,NA,NA,NA,NA,NA,NA,NA,NA,NA,NA,"RWY 07R","C90","RUNWAY"
"PIC reported a black quad-copter at 1,800 feet while W bound on final to RWY 25L. No evasive action taken. LAX Airport OPS notified at.","['rwy25l']","[]","['LAX']","7/16/2018","5:44","2018-07-16T05:44Z","SUN425","DEN","UAS",NA,"LAX",NA,NA,NA,NA,NA,NA,NA,NA,NA,NA,NA,NA,NA,NA,NA,"RWY 25L","LAX","RUNWAY"
"Reported observing a UAS operating 200 feet below while NE bound at 1,400 feet on downwind to RWY 05. No evasive action taken. Waukegan PD notified at. ","['rwy05 ']","[]","[]","7/19/2018","8:53","2018-07-19T08:53Z","N4335K","DEN","UAS",NA,"UGN",NA,NA,NA,NA,NA,NA,NA,NA,NA,NA,NA,NA,NA,NA,NA,"RWY 05","UGN","RUNWAY"
"Reported observing a UAS off of the left side while Wbound at 1,900 feet on a 3 NM final to RWY 27. No evasive action taken. Willow Run Airport PD notified at. ","['rwy27 ']","[]","[]","7/19/2018","9:22","2018-07-19T09:22Z","N719HG","DEN","UAS",NA,"YIP",NA,NA,NA,NA,NA,NA,NA,NA,NA,NA,NA,NA,NA,NA,NA,"RWY 27","YIP","RUNWAY"
"PIC reported a UAS pass overhead while ENE bound at 700FT on 1 NM final RWY 06 to Vineyard Haven. No evasive action reported. LEO notification not reported.","['rwy06 ']","['1 NM ']","['00F']","7/20/2018","1:33","2018-07-20T01:33Z","KAP53","DEN","UAS",NA,"MVY",NA,NA,NA,NA,NA,NA,NA,NA,NA,NA,NA,NA,NA,NA,NA,"RWY 06","MVY","RUNWAY"
"PIC reported UAS above Aircraft while descending through 1,300FT on 2 NM final to RWY 36. No evasive action taken. ARPT manager was notified.","['rwy36 ']","['2 NM ']","['00F']","7/22/2018","3:03","2018-07-22T03:03Z","N5095G","DEN","UAS",NA,"MSN",NA,NA,NA,NA,NA,NA,NA,NA,NA,NA,NA,NA,NA,NA,NA,"RWY 36","MSN","RUNWAY"
"PIC reported a 4 rotor white UAS with black markings. Passed 500FT off left side of Aircraft at same altitude while N bound at 1,500FT on 2.5 NM final for RWY 36L at MEM. No evasive action taken. S Haven PD notified at.","['rwy36l']","['5 NM ']","['00F', '00F', 'MEM']","7/22/2018","5:31","2018-07-22T05:31Z","DAL713","DEN","UAS",NA,"MEM",NA,NA,NA,NA,NA,NA,NA,NA,NA,NA,NA,NA,NA,NA,NA,"RWY 36L","MEM","RUNWAY"
"Reported observing a large black UAS operating within 25 feet of the aircraft while on a five NM final to RWY 22 at 2,000 feet. No evasive action taken. Houston PD notified at. ","['rwy22 ']","[]","[]","7/23/2018","1:00","2018-07-23T01:00Z","N525KY","DEN","UAS",NA,"HOU",NA,NA,NA,NA,NA,NA,NA,NA,NA,NA,NA,NA,NA,NA,NA,"RWY 22","HOU","RUNWAY"
"Pilot reported a possible UAS off right side 1 NM NM off the departure end of RWY 34R. UASwas not visible from the Tower. BFI ATCTwas notified and no subsequent departures reported the UAS. No evasive action taken. Law enforcement notification was not reported. ","['rwy34r']","['1 NM ']","['34R', 'BFI', 'TCT']","7/23/2018","6:19","2018-07-23T06:19Z","DAL198","DEN","UAS",NA,"WOC",NA,NA,NA,NA,NA,NA,NA,NA,NA,NA,NA,NA,NA,NA,NA,"RWY 34R","WOC","RUNWAY"
"Reported sighting a black UAS operating at 1,000 feet while on a 4 NM final to RWY 33. No evasive action taken. Mobile PD notified. ","['rwy33 ']","[]","[]","7/24/2018","0:22","2018-07-24T00:22Z","TEXN200","DEN","UAS",NA,"MOB",NA,NA,NA,NA,NA,NA,NA,NA,NA,NA,NA,NA,NA,NA,NA,"RWY 33","MOB","RUNWAY"
"PIC reported a UAS in close proximity while on a 4 NM final descent to RWY 36. Pilot made slight deviation to avoid UAS. Collin County Sheriff notified at.","['rwy36 ']","['4 NM ']","[]","7/25/2018","3:23","2018-07-25T03:23Z","N1414P","DEN","UAS",NA,"DFW",NA,NA,NA,NA,NA,NA,NA,NA,NA,NA,NA,NA,NA,NA,NA,"RWY 36","DFW","RUNWAY"
"PIC reported a single rotor gray UAS, 2-3FT diameter, at 12 o'clock position, 3,000FT while E bound on 5 NM final RWY 08 PHX. No evasive action taken. PHX PD notified at.","['rwy08 ']","['5 NM ']","['00F', 'PHX', 'PHX']","7/25/2018","21:00","2018-07-25T21:00Z","ASH5835","DEN","UAS",NA,"P50",NA,NA,NA,NA,NA,NA,NA,NA,NA,NA,NA,NA,NA,NA,NA,"RWY 08","P50","RUNWAY"
"Reported observing a black and white Quad-copter UAS while NW bound at 3,100 feet on a 6 NM final to RWY 32R. No evasive action taken. DTW Airport PD notified at. ","['rwy32r']","[]","['DTW']","7/26/2018","6:39","2018-07-26T06:39Z","GJS6244","DEN","UAS",NA,"D21",NA,NA,NA,NA,NA,NA,NA,NA,NA,NA,NA,NA,NA,NA,NA,"RWY 32R","D21","RUNWAY"
"Reported observing a UAS near the approach lights to RWY 24 prior to departure. No evasive action taken. Yarmouth PD notified at. ","['rwy24 ']","[]","[]","7/27/2018","4:35","2018-07-27T04:35Z","N21AU","DEN","UAS",NA,"ZBW",NA,NA,NA,NA,NA,NA,NA,NA,NA,NA,NA,NA,NA,NA,NA,"RWY 24","ZBW","RUNWAY"
"Reported a UAS at 1,000 feet on a 1 NM final to RWY 29. No evasive action taken. LEO notification not reported. ","['rwy29 ']","['1 NM ']","[]","7/30/2018","1:25","2018-07-30T01:25Z","LXJ415","DEN","UAS",NA,"ZBW",NA,NA,NA,NA,NA,NA,NA,NA,NA,NA,NA,NA,NA,NA,NA,"RWY 29","ZBW","RUNWAY"
"Reported observing a small white UAS operating 500 feet below while at 1,000 feet on approach to RWY 13R. No evasive action taken. NYPD Aviation Unit notified. ","['rwy13r']","[]","['13R']","7/30/2018","5:37","2018-07-30T05:37Z","DAL409","DEN","UAS",NA,"N90",NA,NA,NA,NA,NA,NA,NA,NA,NA,NA,NA,NA,NA,NA,NA,"RWY 13R","N90","RUNWAY"
"Reported observing a white UAS while on final to RWY 16R. Evasive action not reported. LAPD Air Support Unit notified and a PD HELO was dispatched to the vicinity. ","['rwy16r']","[]","['ELO']","8/6/2018","6:39","2018-08-06T06:39Z","N555DH","DEN","UAS",NA,"VNY",NA,NA,NA,NA,NA,NA,NA,NA,NA,NA,NA,NA,NA,NA,NA,"RWY 16R","VNY","RUNWAY"
"PIC reported a black UAS at 800 feet on their left side while on approach to RWY 08. No evasive action taken. LEO notification not reported. ","['rwy08 ']","[]","[]","8/6/2018","22:30","2018-08-06T22:30Z","JBU1347","DEN","UAS",NA,"SJU",NA,NA,NA,NA,NA,NA,NA,NA,NA,NA,NA,NA,NA,NA,NA,"RWY 08","SJU","RUNWAY"
"Pilot reported a black UAS at 1,200 feet, 100-200 feet W of the RDW for RWY 34. No evasive action. LEO notification not reported.","['rwy34 ']","[]","[]","8/6/2018","23:31","2018-08-06T23:31Z","N950LL","DEN","UAS",NA,"WOC",NA,NA,NA,NA,NA,NA,NA,NA,NA,NA,NA,NA,NA,NA,NA,"RWY 34","WOC","RUNWAY"
"Pilot reported on departure from RWY 24L of being over-flown by a red UAS. No evasive action taken. LEO notified (no phone number provided). ","['rwy24l']","[]","[]","8/8/2018","0:19","2018-08-08T00:19Z","WJA1701","DEN","UAS",NA,"WOC",NA,NA,NA,NA,NA,NA,NA,NA,NA,NA,NA,NA,NA,NA,NA,"RWY 24L","WOC","RUNWAY"
"Ground personnel reported a gray UAS maneuvering at approximately 20 feetin the VCNTY of the departure end of RWY 08. No impact to operations. LEOnotification not reported. ","['rwy08 ']","[]","[]","8/9/2018","5:48","2018-08-09T05:48Z",NA,"DEN","UAS",NA,"SJU",NA,NA,NA,NA,NA,NA,NA,NA,NA,NA,NA,NA,NA,NA,NA,"RWY 08","SJU","RUNWAY"
"PIC reported a UAS was following Aircraft while W bound at 4,000 feet on 10 NM final to RWY 27. No evasive action taken. San Diego Harbor Police notified at. ","['rwy27 ']","['10 NM ']","[]","8/11/2018","4:07","2018-08-11T04:07Z","SWA2130","DEN","UAS",NA,"SAN",NA,NA,NA,NA,NA,NA,NA,NA,NA,NA,NA,NA,NA,NA,NA,"RWY 27","SAN","RUNWAY"
"PIC reported passing a UAS while on final to RWY 23R. No other details reported. No evasive action reported.Guillford County Police notified, phone number not provided. ","['rwy23r']","[]","['23R']","8/12/2018","1:21","2018-08-12T01:21Z","ENY3619","DEN","UAS",NA,"GSO",NA,NA,NA,NA,NA,NA,NA,NA,NA,NA,NA,NA,NA,NA,NA,"RWY 23R","GSO","RUNWAY"
"Aircraft reporteda UAS passing off the right side while on a 10 NM final RWY 04 at 2,000 feet. No evasive action was taken. New Jersey State Police notified at.","['rwy04 ']","[]","[]","8/13/2018","4:38","2018-08-13T04:38Z","ASA8","DEN","UAS",NA,"N90",NA,NA,NA,NA,NA,NA,NA,NA,NA,NA,NA,NA,NA,NA,NA,"RWY 04","N90","RUNWAY"
"PIC reported a small quad copter UAS 50FT above Aircraft while ENE bound at 150FT on final RWY 06L. No evasive action taken. Cleveland city operations law enforcement notified at.","['rwy06l']","[]","['50F', '50F']","8/14/2018","2:49","2018-08-14T02:49Z","GAJ874","DEN","UAS",NA,"CLE",NA,NA,NA,NA,NA,NA,NA,NA,NA,NA,NA,NA,NA,NA,NA,"RWY 06L","CLE","RUNWAY"
"Klamath ATCT advised the airport managerof unidentified UAS operating near the approach end of RWY 14. Multiple aircraft operating in the pattern but no impact to operations. No evasive action taken. Klamath Sheriff office notified.","['rwy14 ']","[]","['TCT']","8/14/2018","3:37","2018-08-14T03:37Z",NA,"DEN","UAS",NA,"LMT",NA,NA,NA,NA,NA,NA,NA,NA,NA,NA,NA,NA,NA,NA,NA,"RWY 14","LMT","RUNWAY"
"PIC reported a white quad copter UAS pass 300FT below Aircraft while on 7 NM Final RWY 19. No evasive action taken. The Ponya PD was notified.","['rwy19 ']","['7 NM ']","['00F']","8/15/2018","0:55","2018-08-15T00:55Z","N250AK","DEN","UAS",NA,"TEB",NA,NA,NA,NA,NA,NA,NA,NA,NA,NA,NA,NA,NA,NA,NA,"RWY 19","TEB","RUNWAY"
"PIC reported a UAS pass 10 feet off the left side on 10 NM final to RWY 28R. Evasive action not reported. LEO notification not reported.","['rwy28r']","['10 NM ']","[]","8/15/2018","22:38","2018-08-15T22:38Z","EIN147","DEN","UAS",NA,"SFO",NA,NA,NA,NA,NA,NA,NA,NA,NA,NA,NA,NA,NA,NA,NA,"RWY 28R","SFO","RUNWAY"
"PIC reported a UAS at same altitude while W bound on 6 NM final RWY 27L to ATL. No evasive action taken. ATL PD notified at.","['rwy27l']","['6 NM ']","['ATL', 'ATL']","8/15/2018","23:27","2018-08-15T23:27Z","DAL1235","DEN","UAS",NA,"ATL",NA,NA,NA,NA,NA,NA,NA,NA,NA,NA,NA,NA,NA,NA,NA,"RWY 27L","ATL","RUNWAY"
"PIC reported a small white quad-copter UAS with orange parachute falling from 1,000 feet while ESE bound at 1,000 feet on 5 NM final to RWY 15. No evasive action taken. Osceola County Sheriff notified at. ","['rwy15 ']","['5 NM ']","[]","8/16/2018","19:33","2018-08-16T19:33Z","N12SA","DEN","UAS",NA,"ISM",NA,NA,NA,NA,NA,NA,NA,NA,NA,NA,NA,NA,NA,NA,NA,"RWY 15","ISM","RUNWAY"
"PIC reported a black quad copter UAS pass below and off the left side while W bound at 500FT on departure RWY 27. No evasive action taken. Wilmington PD notified at.","['rwy27 ']","[]","['00F']","8/17/2018","1:45","2018-08-17T01:45Z","N803SC","DEN","UAS",NA,"ILM",NA,NA,NA,NA,NA,NA,NA,NA,NA,NA,NA,NA,NA,NA,NA,"RWY 27","ILM","RUNWAY"
"Pilot reported a black 3-4 foot UAS at same ALT while on a 3 NM final to RWY 09L. No Evasive action reported. Chicago PD notified. ","['rwy09l']","['3 NM ']","[]","8/19/2018","5:08","2018-08-19T05:08Z","SKW5747","DEN","UAS",NA,"ORD",NA,NA,NA,NA,NA,NA,NA,NA,NA,NA,NA,NA,NA,NA,NA,"RWY 09L","ORD","RUNWAY"
"Pilot reported UAS 50 feet below Aircraft on departure from RWY 15. No evasive action taken. LEO not notified. ","['rwy15 ']","[]","[]","8/19/2018","23:30","2018-08-19T23:30Z","N888KY","DEN","UAS",NA,"IND",NA,NA,NA,NA,NA,NA,NA,NA,NA,NA,NA,NA,NA,NA,NA,"RWY 15","IND","RUNWAY"
"Reported observing a UAS while WSW bound on an 8 NM final to RWY 24. No evasive action taken. LEO was not notified. ","['rwy24 ']","[]","[]","8/20/2018","5:13","2018-08-20T05:13Z","SBE600","DEN","UAS",NA,"TEB",NA,NA,NA,NA,NA,NA,NA,NA,NA,NA,NA,NA,NA,NA,NA,"RWY 24","TEB","RUNWAY"
"PIC reported a blinking red light UAS approximately 80 feet below Aircraft while NEbound at 300 feet while on short final RWY 04 at BOS. No evasive action taken. Massachusetts State PDnotified at.","['rwy04 ']","[]","['BOS']","8/22/2018","2:27","2018-08-22T02:27Z","AFR343","DEN","UAS",NA,"BOS",NA,NA,NA,NA,NA,NA,NA,NA,NA,NA,NA,NA,NA,NA,NA,"RWY 04","BOS","RUNWAY"
"Reported UAS at 1000 feet while on a 5 NM final to RWY 14. Evasive action not reported. L/E notification was not reported.","['rwy14 ']","[]","[]","8/22/2018","8:21","2018-08-22T08:21Z","N600FS","DEN","UAS",NA,"FRG",NA,NA,NA,NA,NA,NA,NA,NA,NA,NA,NA,NA,NA,NA,NA,"RWY 14","FRG","RUNWAY"
"PIC reported a UAS 600 feet above while on final to RWY 34. No evasive action taken. LEO notified, agency and phone number not provided. ","['rwy34 ']","[]","[]","8/24/2018","0:39","2018-08-24T00:39Z","N5384L","DEN","UAS",NA,"ZBW",NA,NA,NA,NA,NA,NA,NA,NA,NA,NA,NA,NA,NA,NA,NA,"RWY 34","ZBW","RUNWAY"
"PIC reported a UAS 300 feet below while E bound at 2,700 feet on 10 NM final to RWY 08R. No evasive action taken. Houston Police notified at.","['rwy08r']","['10 NM ']","['08R']","8/25/2018","6:13","2018-08-25T06:13Z","ASQ4445","DEN","UAS",NA,"IAH",NA,NA,NA,NA,NA,NA,NA,NA,NA,NA,NA,NA,NA,NA,NA,"RWY 08R","IAH","RUNWAY"
"IAB, McConnell AFB ATCT observed a white UAS with red and green flashing lights SE of RWY 01L/19R at 1,000 feet. No impact to operations. IAB Base Security notified. ","['rwy01l']","[]","['IAB', 'TCT', '01L', 'IAB']","8/25/2018","16:59","2018-08-25T16:59Z",NA,"DEN","UAS",NA,"WOC",NA,NA,NA,NA,NA,NA,NA,NA,NA,NA,NA,NA,NA,NA,NA,"RWY 01L","WOC","RUNWAY"
"Pilot reported a UAS inbound on a 2 NM final to RWY 34L at 4,500 feet. No evasive action taken. SLC Airport PD notified at. ","['rwy34l']","['2 NM ']","['SLC']","8/28/2018","21:43","2018-08-28T21:43Z","SKW4603","DEN","UAS",NA,"SLC",NA,NA,NA,NA,NA,NA,NA,NA,NA,NA,NA,NA,NA,NA,NA,"RWY 34L","SLC","RUNWAY"
"Pilot reported a black and silver UAS pass 50-100 feet below aircraft, while NE bound at 1,800 feet, on 5 NM final to RWY 04R. No evasive action taken. LEO notification not reported. ","['rwy04r']","['5 NM ']","[]","9/4/2018","17:09","2018-09-04T17:09Z","UCA4894","DEN","UAS",NA,"EWR",NA,NA,NA,NA,NA,NA,NA,NA,NA,NA,NA,NA,NA,NA,NA,"RWY 04R","EWR","RUNWAY"
"Pilot reported a white UAS hovering at 500 feet while departing RWY 10L, E bound at 1,000 feet in vicinity of Palm Beach Airport. No evasive action taken. Palm Beach Sheriff notified at. ","['rwy10l']","[]","[]","9/4/2018","20:05","2018-09-04T20:05Z","C6NIX","DEN","UAS",NA,"PBI",NA,NA,NA,NA,NA,NA,NA,NA,NA,NA,NA,NA,NA,NA,NA,"RWY 10L","PBI","RUNWAY"
"PIC reported a quad-copter UAS at 1,500 feet while on 7 NM final to RWY 09. No evasive action reported. LEO notification not reported.","['rwy09 ']","['7 NM ']","[]","9/5/2018","0:53","2018-09-05T00:53Z","AVA002","DEN","UAS",NA,"MIA",NA,NA,NA,NA,NA,NA,NA,NA,NA,NA,NA,NA,NA,NA,NA,"RWY 09","MIA","RUNWAY"
"Aircraft reported that their Dispatch had received a report of a UAS that appeared to have originated from a silver truck E of the ONT airport. PD10 on scene but unable to locate the UAS. SWA6003 reported the UAS while holding short of RWY 26R.","['rwy26r']","[]","['ONT', 'WA60', '26R']","9/5/2018","8:23","2018-09-05T08:23Z","PD10","DEN","UAS",NA,"ONT",NA,NA,NA,NA,NA,NA,NA,NA,NA,NA,NA,NA,NA,NA,NA,"RWY 26R","ONT","RUNWAY"
"PIC reported a yellow UAS at 1,500 feet while on 5 NM final to RWY 13R. No evasive action taken. Houston Police notified, phone number not provided.","['rwy13r']","['5 NM ']","['13R']","9/13/2018","22:55","2018-09-13T22:55Z","N100JH","DEN","UAS",NA,"HOU",NA,NA,NA,NA,NA,NA,NA,NA,NA,NA,NA,NA,NA,NA,NA,"RWY 13R","HOU","RUNWAY"
"PIC reported a black and white UAS at 2,600 feet while on 6 NM final to RWY 14. No evasive action reported. LEO notification not reported. ","['rwy14 ']","['6 NM ']","[]","9/14/2018","3:21","2018-09-14T03:21Z","QXE2399","DEN","UAS",NA,"STS",NA,NA,NA,NA,NA,NA,NA,NA,NA,NA,NA,NA,NA,NA,NA,"RWY 14","STS","RUNWAY"
"Reported sighting a UAS while at 1,800 feet on a 4 NM final to RWY 04. No evasive actionreported. NYPD Aviation Unitwas notified. ","['rwy04 ']","[]","[]","9/15/2018","0:57","2018-09-15T00:57Z","RPA5957","DEN","UAS",NA,"LGA",NA,NA,NA,NA,NA,NA,NA,NA,NA,NA,NA,NA,NA,NA,NA,"RWY 04","LGA","RUNWAY"
"Reported a UAS off the right side while NW bound at 2,000 feet 8 NM final to RWY 31R. No evasive action taken. Port authority PD notified at.","['rwy31r']","[]","[]","9/16/2018","20:01","2018-09-16T20:01Z","DAL2464","DEN","UAS",NA,"JFK",NA,NA,NA,NA,NA,NA,NA,NA,NA,NA,NA,NA,NA,NA,NA,"RWY 31R","JFK","RUNWAY"
"Reported sighting a UAS operation 500 feet above and off of the left side while at 500 feet on a 1 NM final to RWY 22R. No evasive action taken. NYPD Aviation notified at. ","['rwy22r']","[]","[]","9/18/2018","8:08","2018-09-18T08:08Z","JBU1042","DEN","UAS",NA,"JFK",NA,NA,NA,NA,NA,NA,NA,NA,NA,NA,NA,NA,NA,NA,NA,"RWY 22R","JFK","RUNWAY"
"PIC reported a UAS while on short final RWY 25L at 2,500FT. Color and size of UAS not reported. No evasive action taken. LAX airport PD notified at.","['rwy25l']","[]","['00F', 'LAX']","9/18/2018","23:02","2018-09-18T23:02Z","CGYMC","DEN","UAS",NA,"LAX",NA,NA,NA,NA,NA,NA,NA,NA,NA,NA,NA,NA,NA,NA,NA,"RWY 25L","LAX","RUNWAY"
"Pilot reported UAS while departing RWY 13. No description given. No evasive action taken. LEO not notified due to lack of information . ","['rwy13 ']","[]","[]","9/23/2018","23:02","2018-09-23T23:02Z","N2444H","DEN","UAS",NA,"SGJ",NA,NA,NA,NA,NA,NA,NA,NA,NA,NA,NA,NA,NA,NA,NA,"RWY 13","SGJ","RUNWAY"
"Pilot reported a white twin-rotor UAS on a 5 NM final to RWY 09L, at 1,3000 feet. No evasive action taken. Local aviation PD notified. Local Aviation PD phone numbernot provided. ","['rwy09l']","['5 NM ']","[]","9/26/2018","1:19","2018-09-26T01:19Z","C2304","DEN","UAS",NA,"WOC",NA,NA,NA,NA,NA,NA,NA,NA,NA,NA,NA,NA,NA,NA,NA,"RWY 09L","WOC","RUNWAY"
"Reported observing a UAS off his 1 o'clock position operating 500 feet above whileSbound toRWY 10L at 2,500 feet.Evasive action not reported. Palm Beach Sheriff notified. ","['rwy10l']","[]","[]","9/30/2018","3:29","2018-09-30T03:29Z","HRT924","DEN","UAS",NA,"PBI",NA,NA,NA,NA,NA,NA,NA,NA,NA,NA,NA,NA,NA,NA,NA,"RWY 10L","PBI","RUNWAY"
"Reported observing a 2 foot diameter UAS while on 2 NM final to RWY 05. No evasive action taken. Norfolk International Airport Authority notified. ","['rwy05 ']","[]","[]","9/30/2018","5:26","2018-09-30T05:26Z","DAL1685","DEN","UAS",NA,"ORF",NA,NA,NA,NA,NA,NA,NA,NA,NA,NA,NA,NA,NA,NA,NA,"RWY 05","ORF","RUNWAY"
"Pilot reported an orange, red and black UAS below aircraft while on 6 NM final to RWY 19 at 2,000 feet. No evasive action taken. LEO notification unknowndue to ATCT shift change.","['rwy19 ']","['6 NM ']","['TCT']","10/3/2018","1:48","2018-10-03T01:48Z","GAJ834","DEN","UAS",NA,"TEB",NA,NA,NA,NA,NA,NA,NA,NA,NA,NA,NA,NA,NA,NA,NA,"RWY 19","TEB","RUNWAY"
"Aircraft reported 2 black UAS off the right side between 1,000 and 1,300 feet while W bound on a 2 NM final RWY 24R at LAX. No evasive action taken. LAX Airport Police notified at.","['rwy24r']","[]","['24R', 'LAX', 'LAX']","10/4/2018","3:29","2018-10-04T03:29Z","SWA1156","DEN","UAS",NA,"LAX",NA,NA,NA,NA,NA,NA,NA,NA,NA,NA,NA,NA,NA,NA,NA,"RWY 24R","LAX","RUNWAY"
"Aircraftobserved a UAS within 200FT on final to RWY 09. No evasive action taken. FBI notified at.","['rwy09 ']","[]","['00F']","10/7/2018","0:39","2018-10-07T00:39Z","ASH6217","DEN","UAS",NA,"I90",NA,NA,NA,NA,NA,NA,NA,NA,NA,NA,NA,NA,NA,NA,NA,"RWY 09","I90","RUNWAY"
"Pilot reported a black and silver UAS off right side of aircraft at 2,500 feet on final for RWY 36R. No evasive action reported. LEO notified. (no number provided) ","['rwy36r']","[]","[]","10/8/2018","18:55","2018-10-08T18:55Z","PDT4788","DEN","UAS",NA,"CLT",NA,NA,NA,NA,NA,NA,NA,NA,NA,NA,NA,NA,NA,NA,NA,"RWY 36R","CLT","RUNWAY"
"PIC reported evasive action to avoid 2 UAS while N bound at 1,600 feet while on short final to RWY 36. Aircraftaborted approach andheld in the airto wait for UAS to clear the area. Aircraft landed at 2253. TIK AFB Security Force notified at. ","['rwy36 ']","[]","['TIK']","10/11/2018","3:56","2018-10-11T03:56Z","SNTRY60","DEN","UAS",NA,"WOC",NA,NA,NA,NA,NA,NA,NA,NA,NA,NA,NA,NA,NA,NA,NA,"RWY 36","WOC","RUNWAY"
"Reported observing a black UAS operating off of the right side at 2,200 feet while on finalto RWY 36.No evasive action taken. Birmingham PD notified at. ","['rwy36 ']","[]","[]","10/14/2018","3:50","2018-10-14T03:50Z","CGAJS","DEN","UAS",NA,"BHM",NA,NA,NA,NA,NA,NA,NA,NA,NA,NA,NA,NA,NA,NA,NA,"RWY 36","BHM","RUNWAY"
"PIC reported a lighted UAS 200 feet below off right side while on 6 NM final to RWY 27 at 3,000 feet. No evasive action taken. PA State Police notified at.","['rwy27 ']","['6 NM ']","[]","10/14/2018","11:21","2018-10-14T11:21Z","N418DL","DEN","UAS",NA,"PIT",NA,NA,NA,NA,NA,NA,NA,NA,NA,NA,NA,NA,NA,NA,NA,"RWY 27","PIT","RUNWAY"
"PIC reported a blue rotorcraft style UAS orbiting above the NARCO final approach to RWY 30L at 4,000FT. No evasive action taken. Minneapolis PD notified at.","['rwy30l']","[]","['ARC', '00F']","10/17/2018","23:57","2018-10-17T23:57Z","EDV5523","DEN","UAS",NA,"ZMP",NA,NA,NA,NA,NA,NA,NA,NA,NA,NA,NA,NA,NA,NA,NA,"RWY 30L","ZMP","RUNWAY"
"PIC reported a black UAS at 1,200FT while on 3.5 NM final RWY 31L to Portland-Hillsboro airport. No evasive action taken. Law enforcement not notified because pilot did not give ground reference.","['rwy31l']","['5 NM ']","['00F']","10/18/2018","1:38","2018-10-18T01:38Z","N62407","DEN","UAS",NA,"PDX",NA,NA,NA,NA,NA,NA,NA,NA,NA,NA,NA,NA,NA,NA,NA,"RWY 31L","PDX","RUNWAY"
"PIC reported a UAS while on a 2.5 NM final to RWY 01L. No evasive action taken. Dulles Airport PD notified at. ","['rwy01l']","['5 NM ']","['01L']","10/18/2018","23:11","2018-10-18T23:11Z","SJE78","DEN","UAS",NA,"ZDC",NA,NA,NA,NA,NA,NA,NA,NA,NA,NA,NA,NA,NA,NA,NA,"RWY 01L","ZDC","RUNWAY"
"PIC reported a silver UAS while NE bound at 2,300 feet on .5 NM final to RWY 04R. No evasive action taken. LEO notification not reported. ","['rwy04r']","['5 NM ']","[]","10/22/2018","2:13","2018-10-22T02:13Z","N8771C","DEN","UAS",NA,"FFZ",NA,NA,NA,NA,NA,NA,NA,NA,NA,NA,NA,NA,NA,NA,NA,"RWY 04R","FFZ","RUNWAY"
"PIC reported a UAS while on final for OCFRWY 36. No evasive action taken. Leon County Sheriff notified at. ","['rwy36 ']","[]","['OCF']","10/22/2018","2:50","2018-10-22T02:50Z","N5172W","DEN","UAS",NA,"TLH",NA,NA,NA,NA,NA,NA,NA,NA,NA,NA,NA,NA,NA,NA,NA,"RWY 36","TLH","RUNWAY"
"PIC reported a UAS flew under Aircraft while on 5 NM final to RWY 18R. No evasive action taken. LEO not notified.","['rwy18r']","['5 NM ']","[]","10/22/2018","5:06","2018-10-22T05:06Z","AAL2500","DEN","UAS",NA,"D10",NA,NA,NA,NA,NA,NA,NA,NA,NA,NA,NA,NA,NA,NA,NA,"RWY 18R","D10","RUNWAY"
"Reported a UAS 500 feet below the front of the aircraft while on a 7 NM final to RWY 30L at 3,000 feet. No evasive action reported. Airport PD notified at.","['rwy30l']","['7 NM ']","[]","10/22/2018","23:57","2018-10-22T23:57Z","SWA2489","DEN","UAS",NA,"MSP",NA,NA,NA,NA,NA,NA,NA,NA,NA,NA,NA,NA,NA,NA,NA,"RWY 30L","MSP","RUNWAY"
"PIC reported a quadcopter UAS operating at 4,000FT while on 10 NM final for RWY 27L. No evasive action reported. FBI notified at.","['rwy27l']","['10 NM ']","['00F']","10/23/2018","19:30","2018-10-23T19:30Z","UAL2731","DEN","UAS",NA,"ORD",NA,NA,NA,NA,NA,NA,NA,NA,NA,NA,NA,NA,NA,NA,NA,"RWY 27L","ORD","RUNWAY"
"Pilot reported a white UAS with four rotors at the 3 o'clock position near RWY 25L, while WSW bound at 2,300 feet in the vicinity of Phoenix. No evasive action taken. Phoenix PD notified at. ","['rwy25l']","[]","[]","10/25/2018","4:15","2018-10-25T04:15Z","BTQ817","DEN","UAS",NA,"P50",NA,NA,NA,NA,NA,NA,NA,NA,NA,NA,NA,NA,NA,NA,NA,"RWY 25L","P50","RUNWAY"
"Pilot reported a small white UAS at7,200 feet on 5 NM final to RWY 35L. No evasive action reported. LEO not notified by ATC. ","['rwy35l']","['5 NM ']","[]","10/27/2018","1:49","2018-10-27T01:49Z","BTQ575","DEN","UAS",NA,"WOC",NA,NA,NA,NA,NA,NA,NA,NA,NA,NA,NA,NA,NA,NA,NA,"RWY 35L","WOC","RUNWAY"
"Pilot reported a black and red UAS at 1,000 feet while on 2 NM final for RWY 31C. No evasive action taken. Chicago notified at. ","['rwy31c']","['2 NM ']","[]","10/28/2018","1:21","2018-10-28T01:21Z","SWA3839","DEN","UAS",NA,"WOC",NA,NA,NA,NA,NA,NA,NA,NA,NA,NA,NA,NA,NA,NA,NA,"RWY 31C","WOC","RUNWAY"
"Pilot reported a black UAS 40 feet above aircraft while on final for RWY 27L at 1,700 feet. No evasive action taken. Clayton County PD notified at. ","['rwy27l']","[]","[]","10/28/2018","5:49","2018-10-28T05:49Z","DAL1971","DEN","UAS",NA,"A80",NA,NA,NA,NA,NA,NA,NA,NA,NA,NA,NA,NA,NA,NA,NA,"RWY 27L","A80","RUNWAY"
"PIC reported a red UAS at 1,700FT 8FT off left side while N bound to RWY 28L. No evasive action taken. Minneapolis PD notified at.","['rwy28l']","[]","['00F']","10/29/2018","5:27","2018-10-29T05:27Z","N4380Y","DEN","UAS",NA,"ZMP",NA,NA,NA,NA,NA,NA,NA,NA,NA,NA,NA,NA,NA,NA,NA,"RWY 28L","ZMP","RUNWAY"
"Reported a black UAS off the right side while on a 5 NM final to RWY 20 at 2,000 feet. No evasive action taken. Orange County Sheriff notified at","['rwy20 ']","['5 NM ']","[]","11/2/2018","5:52","2018-11-02T05:52Z","GDS2","DEN","UAS",NA,"SMO",NA,NA,NA,NA,NA,NA,NA,NA,NA,NA,NA,NA,NA,NA,NA,"RWY 20","SMO","RUNWAY"
"PIC reported a UAS off the right side while on short final for RWY 04R at 500FT. No evasive action taken. Local PD notified.","['rwy04r']","[]","['00F']","11/6/2018","2:18","2018-11-06T02:18Z","HAL341","DEN","UAS",NA,"HCF",NA,NA,NA,NA,NA,NA,NA,NA,NA,NA,NA,NA,NA,NA,NA,"RWY 04R","HCF","RUNWAY"
"PIC reported a large remote controlled (R/C)plane near the approach end of RWY 36. The remote operator was outside the perimeter fence and when the aircraft was about 200FT off the ground the R/C plane pitched up toward the Aircraft and came within 100FT of the left engine. The Aircraft had toabortthe approachto avoid the R/C plane. Del Norte Sheriff notified at.","['rwy36 ']","[]","['00F', '00F']","11/6/2018","4:01","2018-11-06T04:01Z","N121MF","DEN","UAS",NA,"WOC",NA,NA,NA,NA,NA,NA,NA,NA,NA,NA,NA,NA,NA,NA,NA,"RWY 36","WOC","RUNWAY"
"Pilot reported a UAS at 2,500 feet on final to RWY 22. No evasive action taken. NYPD Aviation Unit notified. ","['rwy22 ']","[]","[]","11/8/2018","2:37","2018-11-08T02:37Z","UAL1254","DEN","UAS",NA,"WOC",NA,NA,NA,NA,NA,NA,NA,NA,NA,NA,NA,NA,NA,NA,NA,"RWY 22","WOC","RUNWAY"
"PIC reported a white quad-copter UAS pass 300FT below Aircraft while N bound at 1,700FT on 3 NM final RWY 36R. No evasive action taken. Charlotte Airport PD notified via 911.","['rwy36r']","['3 NM ']","['00F', '00F']","11/8/2018","21:36","2018-11-08T21:36Z","JIA5269","DEN","UAS",NA,"CLT",NA,NA,NA,NA,NA,NA,NA,NA,NA,NA,NA,NA,NA,NA,NA,"RWY 36R","CLT","RUNWAY"
"Pilot reported a white quad-copter UAS while W bound on final for RWY 06. No evasive action taken. Kissimmee PD notified at. ","['rwy06 ']","[]","[]","11/9/2018","0:55","2018-11-09T00:55Z","N559MK","DEN","UAS",NA,"ISM",NA,NA,NA,NA,NA,NA,NA,NA,NA,NA,NA,NA,NA,NA,NA,"RWY 06","ISM","RUNWAY"
"Pilot reported a quad UAS 100 feet below, off left side, while SW bound on final for RWY 22 at 1,100 feet. No evasive action taken. NYPD Aviation notified at. ","['rwy22 ']","[]","[]","11/9/2018","1:30","2018-11-09T01:30Z","JBU362","DEN","UAS",NA,"LGA",NA,NA,NA,NA,NA,NA,NA,NA,NA,NA,NA,NA,NA,NA,NA,"RWY 22","LGA","RUNWAY"
"Pilot reportedasmall white UAS off right side, 500 feet below while NW bound at 1,000 feeton a 3 NM final RWY 31R.No evasive action taken. NYPD Aviation notified at. ","['rwy31r']","['3 NM ']","[]","11/9/2018","1:32","2018-11-09T01:32Z","JBU1202","DEN","UAS",NA,"JFK",NA,NA,NA,NA,NA,NA,NA,NA,NA,NA,NA,NA,NA,NA,NA,"RWY 31R","JFK","RUNWAY"
"Aircraftreported white UAS at 800 FT 2 S ELP after departing RWY 26L. No evasive action taken. LEO were not notified. ","['rwy26l']","[]","['ELP']","11/9/2018","23:30","2018-11-09T23:30Z","N7354Q","CONR","UAS",NA,"ELP",NA,NA,NA,NA,NA,NA,NA,NA,NA,NA,NA,NA,NA,NA,NA,"RWY 26L","ELP","RUNWAY"
"At approximately 1850, ARPT Ops observeda UAShovering about 500 feet abeam and E of RWY 31R.ARPT OPS coordinated with the tower to close the RWYs. UASdeparted to the Eand ARPT OPS reopened the RWYs at approximately 1901. ARPT OPS and San Jose PDlocated the UASand operatorat alocal park.UNKN if charges were filed.No impact tooperations.  ","['rwy31r']","[]","['UNK']","11/11/2018","3:04","2018-11-11T03:04Z",NA,"DEN","UAS",NA,"RHV",NA,NA,NA,NA,NA,NA,NA,NA,NA,NA,NA,NA,NA,NA,NA,"RWY 31R","RHV","RUNWAY"
"On departure from RWY 34R, PIC reported a drone over the bus terminal at approximately 1,200 ft.","['rwy34r']","[]","['34R']","11/11/2018","7:35","2018-11-11T07:35Z","N2SV","DEN","UAS",NA,"PAE",NA,NA,NA,NA,NA,NA,NA,NA,NA,NA,NA,NA,NA,NA,NA,"RWY 34R","PAE","RUNWAY"
"Reported a UASat approximately 1600 feet while on 5 NM final RWY 35 at CRP.No evasive action taken. Corpus Christi PDnotified at.","['rwy35 ']","['5 NM ']","['CRP']","11/14/2018","9:18","2018-11-14T09:18Z","STGRY16","DEN","UAS",NA,"CRP",NA,NA,NA,NA,NA,NA,NA,NA,NA,NA,NA,NA,NA,NA,NA,"RWY 35","CRP","RUNWAY"
"Reported a square shaped UAS below Aircraft while at 6800 feet,4 NM final RWY 17R at APA. No evasive action taken. Arapahoe County Sheriff notified at.","['rwy17r']","['4 NM ']","['APA']","11/15/2018","9:18","2018-11-15T09:18Z","N1832E","DEN","UAS",NA,"APA",NA,NA,NA,NA,NA,NA,NA,NA,NA,NA,NA,NA,NA,NA,NA,"RWY 17R","APA","RUNWAY"
"Pilot reported a UAS 100 feet below aircraft 2,000 to 2,300 feet on a 6 NM final for RWY 24R. LEO not notified. ","['rwy24r']","['6 NM ']","['24R']","11/17/2018","22:31","2018-11-17T22:31Z","SKW4480","DEN","UAS",NA,"LAX",NA,NA,NA,NA,NA,NA,NA,NA,NA,NA,NA,NA,NA,NA,NA,"RWY 24R","LAX","RUNWAY"
"Pilot reported a white UAS on a 2 NM final for RWY 27.Altitude not reported. Genesee County Sheriff notified at. ","['rwy27 ']","['2 NM ']","[]","11/17/2018","22:53","2018-11-17T22:53Z","EDV5377","DEN","UAS",NA,"FNT",NA,NA,NA,NA,NA,NA,NA,NA,NA,NA,NA,NA,NA,NA,NA,"RWY 27","FNT","RUNWAY"
"BIX reported security personnel on the field observed a UAS with red flashing lights over RWY 03/21. The UAS moved to an area near the hospital when the security personnel lost sight of the UAS.","['rwy03']","[]","['BIX']","11/19/2018","10:13","2018-11-19T10:13Z",NA,"DEN","UAS",NA,"SW1",NA,NA,NA,NA,NA,NA,NA,NA,NA,NA,NA,NA,NA,NA,NA,"RWY 03","SW1","RUNWAY"
"Pilot reported a UAS overflew aircraft 300 feet above from left to right while on a 5 NM final to RWY 09R at 1,000 feet. No evasive action taken. No description of UAS reported. Miami-Dade PD Aviation Unit notified at. ","['rwy09r']","['5 NM ']","['09R']","11/24/2018","1:59","2018-11-24T01:59Z","N8961","DEN","UAS",NA,"TMB",NA,NA,NA,NA,NA,NA,NA,NA,NA,NA,NA,NA,NA,NA,NA,"RWY 09R","TMB","RUNWAY"
"PIC reported a large UAS off the right side at 5,000FT while on 2 NM final to RWY 27R Miami-Opa Locka Executive Airport. No evasive action taken. LEOs were not notified. ","['rwy27r']","['2 NM ']","['00F', '27R']","11/26/2018","3:46","2018-11-26T03:46Z","DCM1341","DEN","UAS",NA,"MIA",NA,NA,NA,NA,NA,NA,NA,NA,NA,NA,NA,NA,NA,NA,NA,"RWY 27R","MIA","RUNWAY"
"Pilot reported a 3 to 4foot whiteUAS with black trim pass 25 feet of the left wing while on base turn to RWY 05L, Battle Creek. UAS was over Ft. Custer Military Reservation. No evasive action reported. Ft. Custer Securitynotified at. ","['rwy05l']","[]","[]","11/30/2018","2:21","2018-11-30T02:21Z","N191JG","DEN","UAS",NA,"BTL",NA,NA,NA,NA,NA,NA,NA,NA,NA,NA,NA,NA,NA,NA,NA,"RWY 05L","BTL","RUNWAY"
"Pilot reported a UAS while SSE boundat 500 feet on a 1 NM final to RWY 15. No evasive action taken. Charlotte County Sheriff notified at. ","['rwy15 ']","['1 NM ']","[]","11/30/2018","21:13","2018-11-30T21:13Z","N5522S","DEN","UAS",NA,"WOC",NA,NA,NA,NA,NA,NA,NA,NA,NA,NA,NA,NA,NA,NA,NA,"RWY 15","WOC","RUNWAY"
"Pilot reported a white UAS or RCaircraft 100 feet below aircraft off theleft side while at 600 feet on a 2 NM finalto RWY 31. No evasive action taken. Atlantic City PD notification not reported. ","['rwy31 ']","['2 NM ']","[]","11/30/2018","21:24","2018-11-30T21:24Z","UJC609","DEN","UAS",NA,"ACY",NA,NA,NA,NA,NA,NA,NA,NA,NA,NA,NA,NA,NA,NA,NA,"RWY 31","ACY","RUNWAY"
"Pilot reported a black UAS passed below aircraft on departure off RWY 18Lat 1,500. Evasive action not reported. Charlotte Metro PD notified at. ","['rwy18l']","[]","[]","11/30/2018","22:46","2018-11-30T22:46Z","AAL659","DEN","UAS",NA,"CLT",NA,NA,NA,NA,NA,NA,NA,NA,NA,NA,NA,NA,NA,NA,NA,"RWY 18L","CLT","RUNWAY"
"Reported a black UAS carrying a balloon off his left side while on a 5 NM final for RWY 24R. No evasive action taken. LAPD Airport PD notified at.","['rwy24r']","[]","['24R']","12/4/2018","3:52","2018-12-04T03:52Z","DAL2469","CONR","UAS",NA,"LAX",NA,NA,NA,NA,NA,NA,NA,NA,NA,NA,NA,NA,NA,NA,NA,"RWY 24R","LAX","RUNWAY"
"Personnelreported a small UAS approximately 500 feet W of Signature Flight FBO over TXY A and RWY 35R, flying S bound. FTH934 was advised of the UAS location while on a 3 NM final to RWY 35R. UAS landed in the XJET parking lot, airport authority was notified and spoke with the UAS operator. Arapahoe County Sheriff was notified at.","['rwy35r', 'rwy35r']","['3 NM ']","[]","12/4/2018","10:25","2018-12-04T10:25Z","FTH934","DEN","UAS",NA,"DEN",NA,NA,NA,NA,NA,NA,NA,NA,NA,NA,NA,NA,NA,NA,NA,"RWY 35R","DEN","RUNWAY"
"Reporteda black UAS pass 700-800 feet off the right side,300 feet above, while N bound at 1,600 feet on final RWY 35 to PHL. No evasive action taken. Law enforcement notification not reported.","['rwy35 ']","[]","['PHL']","12/8/2018","4:07","2018-12-08T04:07Z","N792JR","DEN","UAS",NA,"PHL",NA,NA,NA,NA,NA,NA,NA,NA,NA,NA,NA,NA,NA,NA,NA,"RWY 35","PHL","RUNWAY"
"Pilot reported a UAS on a 3 NM final to RWY 19R off the right side at 1,000 feet below aircraft while N bound at 2,300 feet. The UAS appeared to be hovering over a pond. Evasive action not reported. Wichita PD notified at. ","['rwy19r']","['3 NM ']","[]","12/12/2018","20:19","2018-12-12T20:19Z","HOOK44","DEN","UAS",NA,"ICT",NA,NA,NA,NA,NA,NA,NA,NA,NA,NA,NA,NA,NA,NA,NA,"RWY 19R","ICT","RUNWAY"
"PIC reported a UAS at UNKN altitude while on final to RWY 12. No evasive action reported. No additional information reported. Las Cruces PD notified at.","['rwy12 ']","[]","['UNK']","12/13/2018","2:38","2018-12-13T02:38Z","N6849M","DEN","UAS",NA,"ZAB",NA,NA,NA,NA,NA,NA,NA,NA,NA,NA,NA,NA,NA,NA,NA,"RWY 12","ZAB","RUNWAY"
"Aircraftreported a black and yellow UAS with two rotors off right wingat same altitude of200 feetwhile on 2 NM final RWY 04R. No evasive action taken. NYPD Aviation Unit notified at. ","['rwy04r']","['2 NM ']","[]","12/14/2018","2:22","2018-12-14T02:22Z","DAL372","DEN","UAS",NA,"JFK",NA,NA,NA,NA,NA,NA,NA,NA,NA,NA,NA,NA,NA,NA,NA,"RWY 04R","JFK","RUNWAY"
"PIC reported a UAS while on a 4 NM final to RWY 26R at 1,300 feet. No evasive action taken. Miami-Dade PD notified at 3.","['rwy26r']","['4 NM ']","['26R']","12/18/2018","0:49","2018-12-18T00:49Z","ENY3941","DEN","UAS",NA,"ZMA",NA,NA,NA,NA,NA,NA,NA,NA,NA,NA,NA,NA,NA,NA,NA,"RWY 26R","ZMA","RUNWAY"
"Multiplearrivalson 3-4 NM finalRWY 06Lat CLE reporteda UASoperating between 1,500 and 3,000. Pilots reported it was lighted and very large. No evasive action reported.Local LEO and Cleveland FBIField Office notified at.","['rwy06l']","['4 NM ']","['CLE', 'BIF']","12/19/2018","5:22","2018-12-19T05:22Z","AAL2480","DEN","UAS",NA,"CLE",NA,NA,NA,NA,NA,NA,NA,NA,NA,NA,NA,NA,NA,NA,NA,"RWY 06L","CLE","RUNWAY"
"PIC reported rotorcraft with lights 300 feet above ground between RWY 35 and RWY 34R. No further information provided. SLC ARPT PDnotified at.","['rwy35 ', 'rwy34r']","[]","['34R', 'SLC']","12/19/2018","7:44","2018-12-19T07:44Z",NA,"DEN","UAS",NA,"SLC",NA,NA,NA,NA,NA,NA,NA,NA,NA,NA,NA,NA,NA,NA,NA,"RWY 35","SLC","RUNWAY"
"Aircraft reporteda black UAS at 2,600 feet while on5 NM final RWY 31R at JFK.No evasive action was taken. NYPDwas notified at. ","['rwy31r']","['5 NM ']","['JFK']","12/22/2018","23:00","2018-12-22T23:00Z","SVA021","DEN","UAS",NA,"JFK",NA,NA,NA,NA,NA,NA,NA,NA,NA,NA,NA,NA,NA,NA,NA,"RWY 31R","JFK","RUNWAY"
"PIC reported a UAS with green flashing lights 100FT above Aircraft while WSW bound at 600FT 1 NM final RWY 25L. No evasive action taken. LAX ARPT PD notified.","['rwy25l']","['1 NM ']","['00F', '00F', 'LAX']","12/25/2018","7:21","2018-12-25T07:21Z","SWA1747","DEN","UAS",NA,"LAX",NA,NA,NA,NA,NA,NA,NA,NA,NA,NA,NA,NA,NA,NA,NA,"RWY 25L","LAX","RUNWAY"
"Reported observing a black UAS directly below while at 1,000 feet on final to RWY 04R along the Rockaway Inner Shoreline. No evasive action reported. Port Authority PD notified at. ","['rwy04r']","[]","[]","12/28/2018","0:07","2018-12-28T00:07Z","SCX243","DEN","UAS",NA,"JFK",NA,NA,NA,NA,NA,NA,NA,NA,NA,NA,NA,NA,NA,NA,NA,"RWY 04R","JFK","RUNWAY"
"Reported observing a black UAS cross 300 feet across their path while at 1,000 feet on a 1 NM final for RWY 13. No evasive action taken. MiamiDade PD notified at. ","['rwy13 ']","['1 NM ']","[]","12/28/2018","21:52","2018-12-28T21:52Z","N46487","DEN","UAS",NA,"TMB",NA,NA,NA,NA,NA,NA,NA,NA,NA,NA,NA,NA,NA,NA,NA,"RWY 13","TMB","RUNWAY"
"Reported observing a white UAS at 200 feet off of his 12 o'clock position while on a 1 NM final to RWY 24. No evasive action taken. Lee County Sheriff notified at. ","['rwy24 ']","['1 NM ']","[]","12/28/2018","21:57","2018-12-28T21:57Z","JBU1251","DEN","UAS",NA,"RSW",NA,NA,NA,NA,NA,NA,NA,NA,NA,NA,NA,NA,NA,NA,NA,"RWY 24","RSW","RUNWAY"
"Reported observing a UAS off of the left side moving E to W while climbing through 200 to 1,500 feet after departing RWY 05R. No evasive action taken. Van Buren PDand Airport PD notified. ","['rwy05r']","[]","[]","1/14/2019","2:37","2019-01-14T02:37Z","LXJ592","DEN","UAS",NA,"YIP",NA,NA,NA,NA,NA,NA,NA,NA,NA,NA,NA,NA,NA,NA,NA,"RWY 05R","YIP","RUNWAY"
"Aircraft reported UAS off right side at 3500 over TEB ARPT while on 9 NM final RWY 22L to EWR. EWR arrivals have been suspendedtemporarily. TEBTWR notified. NJ State PD notified. 2210 UPDATE: N90 reports EWR changed arrivals toRWY 11, normal departures on RWY 22. TEB ARPT Authority, NJ State PD and FBI have been notified and responding. 2230 CLOSEOUT: N90 reports out of hold toresume normal arrival operations toRWY 22R/L at 2219.NJ State PD Aviation Unit investigated scene and reports noUAS activityin VCNTY of TEB or EWR final approach course. NFA. NB notified. ATCSCC, AWO notified. ","['rwy22l', 'rwy11', 'rwy22 ', 'rwy22r']","['9 NM ']","['TEB', 'EWR', 'EWR', 'TEB', 'EWR', 'TEB', 'TEB', 'EWR', 'TCS', 'AWO']","1/23/2019","2:49","2019-01-23T02:49Z","SWA476","DEN","UAS","PAGED","N90",NA,NA,NA,NA,NA,NA,NA,NA,NA,NA,NA,NA,NA,NA,NA,"RWY 22L","N90","RUNWAY"
"Upon entering aleft downwind to RWY 33 at MTN, the PICreported a UASwithin 100 feet of the aircraft while at 2,000 feet.No direction of flight given and no evasive action taken. Baltimore County PD notified.","['rwy33 ']","[]","['MTN']","1/26/2019","4:00","2019-01-26T04:00Z","N4414Z","NCRCC","UAS",NA,"MTN",NA,NA,NA,NA,NA,NA,NA,NA,NA,NA,NA,NA,NA,NA,NA,"RWY 33","MTN","RUNWAY"
"Reported UAS while WSW bound at 1,000 feet 1 NM final to RWY 24R. No evasive action reported. Los Angeles Airport PD notified at. ","['rwy24r']","[]","['24R']","1/26/2019","6:41","2019-01-26T06:41Z","ASA1932","DEN","UAS",NA,"LAX",NA,NA,NA,NA,NA,NA,NA,NA,NA,NA,NA,NA,NA,NA,NA,"RWY 24R","LAX","RUNWAY"
"An off airport security officer reported a commercial sized quadcopter with red, blue and green lights operating over the E side of field and on the approach to RWY 21 between 100-200FT. The field was closed (outside of operational hours) during the incident. No conflicts with Aircraft reported. Roswell Police notified.","['rwy21 ']","[]","['00F']","1/27/2019","22:46","2019-01-27T22:46Z",NA,"DEN","UAS","NOTIFICATION-LATE","ROW",NA,NA,NA,NA,NA,NA,NA,NA,NA,NA,NA,NA,NA,NA,NA,"RWY 21","ROW","RUNWAY"
"PIC reported a black UAS at 6 o'clock position 600FT while W bound 0.75 NM from approach end of RWY 35R. Taylor County Sheriff notified at.","['rwy35r']","['75 NM ']","['00F']","1/28/2019","3:50","2019-01-28T03:50Z","HOUND91","DEN","UAS",NA,"ABI",NA,NA,NA,NA,NA,NA,NA,NA,NA,NA,NA,NA,NA,NA,NA,"RWY 35R","ABI","RUNWAY"
"INITIAL AND CLOSEOUT: DFW airport OPS detectedUAS activity at the approach end of RWY 13R. The airport authority visually confirmed the sighting. DFW stoppedoperations to that runway for approximately 5 minutes and the UAS landed and the operator could not be located. More to follow. 2309 HQ DEN contacted DFW WEST tower and got the UAS registration number. HQ DEN was unable to find a way to match the number to an owner. ","['rwy13r']","[]","['AND', 'DFW', '13R', 'DFW', 'DEN', 'DFW', 'EST', 'DEN']","1/30/2019","3:26","2019-01-30T03:26Z",NA,"DEN","UAS","PAGED","WOC",NA,NA,NA,NA,NA,NA,NA,NA,NA,NA,NA,NA,NA,NA,NA,"RWY 13R","WOC","RUNWAY"
"While utilizing night vision goggles, Aircraft was making a VFR approach to RWY 15 at 21W (Ranger Creek Airport, WA) when they saw 2-4 white lights ahead and to their left. The PIC elected to break off their approach and identified the lights as a UAS that was hovering approximately at 4,500 AGL. PICelected todepart the area and reported the UAS followed themand was able to maintain90 knots. Pierce County Sheriff notified at.","['rwy15 ']","[]","['21W']","2/1/2019","8:26","2019-02-01T08:26Z","R20892","DEN","UAS",NA,"S46",NA,NA,NA,NA,NA,NA,NA,NA,NA,NA,NA,NA,NA,NA,NA,"RWY 15","S46","RUNWAY"
"Reported a UAS while SE boundon1.5 NMfinal to RWY 13R. No altitude or descriptionreported. No evasive action taken. San Antonio PD notified at. ","['rwy13r']","[]","['13R']","2/4/2019","1:39","2019-02-04T01:39Z","JTL10","DEN","UAS",NA,"SAT",NA,NA,NA,NA,NA,NA,NA,NA,NA,NA,NA,NA,NA,NA,NA,"RWY 13R","SAT","RUNWAY"
"Reportingobservinga UAS pass 100 to 200 feet below the aircraftfrom the twelve o'clock position while NNE boundat 1,800 feet on a 4 NM NM final to RWY 04L. Evasive action not reported. Detroit Airport PD notified.  ","['rwy04l']","['4 NM ']","[]","2/6/2019","7:09","2019-02-06T07:09Z","GJS6241","DEN","UAS",NA,"DTW",NA,NA,NA,NA,NA,NA,NA,NA,NA,NA,NA,NA,NA,NA,NA,"RWY 04L","DTW","RUNWAY"
"Reported sighting a UAS whileWbound at 2,500 feet, 9.5 NM final to RWY 24R. No evasive action taken. LAX Airport Authority notified at. ","['rwy24r']","['5 NM ']","['24R', 'LAX']","2/7/2019","7:01","2019-02-07T07:01Z","VIR23J","DEN","UAS",NA,"LAX",NA,NA,NA,NA,NA,NA,NA,NA,NA,NA,NA,NA,NA,NA,NA,"RWY 24R","LAX","RUNWAY"
"Reported sighting a black and white UASwhile SW bound at 1,100 feet on a 4 NM final to RWY 24R. No evasive action taken. LEO notified through City Operations. ","['rwy24r']","['4 NM ']","['24R']","2/8/2019","4:33","2019-02-08T04:33Z","SWA4546","DEN","UAS",NA,"LAX",NA,NA,NA,NA,NA,NA,NA,NA,NA,NA,NA,NA,NA,NA,NA,"RWY 24R","LAX","RUNWAY"
"PIC reported a UAS 50 feet from their aircraft at 1,600 feet while on 5 NM final to RWY 09L at OPF. No evasive action taken. Miami-Dade PD notified. ","['rwy09l']","['5 NM ']","['OPF']","2/11/2019","7:27","2019-02-11T07:27Z","YV3430","DEN","UAS",NA,"MIA",NA,NA,NA,NA,NA,NA,NA,NA,NA,NA,NA,NA,NA,NA,NA,"RWY 09L","MIA","RUNWAY"
"PIC reported a UAS heading E bound off their left side while on final to RWY 24R at 2,300 feet. No evasive action reported. LEO Helicopter was notified on frequency with negative findings.","['rwy24r']","[]","['24R']","2/12/2019","4:14","2019-02-12T04:14Z","BAW283","DEN","UAS",NA,"LAX",NA,NA,NA,NA,NA,NA,NA,NA,NA,NA,NA,NA,NA,NA,NA,"RWY 24R","LAX","RUNWAY"
"PIC reported a black and white quad copter UAS at 400 feet while on final to RWY 10L. No evasive action taken. LEO notification not reported.","['rwy10l']","[]","[]","2/12/2019","21:38","2019-02-12T21:38Z","IBK4906","DEN","UAS",NA,"FLL",NA,NA,NA,NA,NA,NA,NA,NA,NA,NA,NA,NA,NA,NA,NA,"RWY 10L","FLL","RUNWAY"
"PIC reported a silver fixed wing UAS 400 feet below their Aircraft off the left side while E bound at 2,300 feet 1.5 NM final to RWY 07R. No evasive action reported. Phoenix PD notified at. ","['rwy07r']","['5 NM ']","['07R']","2/24/2019","1:37","2019-02-24T01:37Z","MSQT40","DEN","UAS",NA,"P50",NA,NA,NA,NA,NA,NA,NA,NA,NA,NA,NA,NA,NA,NA,NA,"RWY 07R","P50","RUNWAY"
"ATCT observed a UAS operating W of RWY 31L at or below 1,000 feet for approximately 25 minutes. San Jose PD)and Airfield OPS called and responded, unable to locate operator. No aircraft or ATC services impacted. ","['rwy31l']","[]","['TCT']","2/25/2019","3:02","2019-02-25T03:02Z",NA,"DEN","UAS",NA,"RHV",NA,NA,NA,NA,NA,NA,NA,NA,NA,NA,NA,NA,NA,NA,NA,"RWY 31L","RHV","RUNWAY"
"Reported observing a UAS with amber lightingpass under theright side wing while Sbound at 5,500 feet on a 2 NM final for RWY 16L. No evasive action taken. LEO notified via 911.  ","['rwy16l']","['2 NM ']","[]","2/25/2019","8:32","2019-02-25T08:32Z","VTE599","DEN","UAS",NA,"RNO",NA,NA,NA,NA,NA,NA,NA,NA,NA,NA,NA,NA,NA,NA,NA,"RWY 16L","RNO","RUNWAY"
"PIC reported a large UAS on his left side at 500 feet while on final to RWY 04 at IXD. No evasive action taken. Johnson County Sheriff notified at.","['rwy04 ']","[]","['IXD']","2/26/2019","7:44","2019-02-26T07:44Z","N8199U","DEN","UAS",NA,"IXD",NA,NA,NA,NA,NA,NA,NA,NA,NA,NA,NA,NA,NA,NA,NA,"RWY 04","IXD","RUNWAY"
"Aircraftreported a UAS,approximately1/4 NM off right side,while at 5800 feet on 4 NM final to RWY 34R to SLC.No evasive action taken. SLC ARPT PDnotified at.","['rwy34r']","['4 NM ']","['34R', 'SLC', 'SLC']","3/1/2019","10:12","2019-03-01T10:12Z","SWA1017","DEN","UAS",NA,"SLC",NA,NA,NA,NA,NA,NA,NA,NA,NA,NA,NA,NA,NA,NA,NA,"RWY 34R","SLC","RUNWAY"
"Reported sighting a black UAS off of the APCH end of RWY 19R while holding short of RWY 19R. The UAS landed in the parking lot N of RWY 19R. Las Vegas Metro PD notified via Dispatch. ","['rwy19r', 'rwy19r', 'rwy19r']","[]","['APC']","3/5/2019","3:11","2019-03-05T03:11Z","N606TJ","DEN","UAS",NA,"LAS",NA,NA,NA,NA,NA,NA,NA,NA,NA,NA,NA,NA,NA,NA,NA,"RWY 19R","LAS","RUNWAY"
"Reported observing a UAS pass 100 feet above the aircraft from the one o'clock position while at 1,100 feet on a 2.5 NM final to RWY 27. No evasive action taken. Lakeland PD notified at. ","['rwy27 ']","['5 NM ']","[]","3/5/2019","4:53","2019-03-05T04:53Z","N9210B","DEN","UAS",NA,"LAL",NA,NA,NA,NA,NA,NA,NA,NA,NA,NA,NA,NA,NA,NA,NA,"RWY 27","LAL","RUNWAY"
"Aircraft in pattern at for RWY 31L reported UAS over TV highway at 800 MSL. Pilot then reported the UAS between 1 and 1.5 NM final to RWY 31L at 800 MSL. UAS was grey and white double rotor. No evasive action taken. Hilsboro PD notified at.","['rwy31l', 'rwy31l']","[]","['MSL', 'MSL']","3/5/2019","22:24","2019-03-05T22:24Z","N2227H","DEN","UAS",NA,"HIO",NA,NA,NA,NA,NA,NA,NA,NA,NA,NA,NA,NA,NA,NA,NA,"RWY 31L","HIO","RUNWAY"
"Pilot reported a UAS, similar to a DJI-Phantom, 300 feet below aircraft whileNboundat 1,000 feet on final approach to RWY 33. No evasive action taken.LEO notification not reported. ","['rwy33 ']","[]","[]","3/5/2019","23:33","2019-03-05T23:33Z","N6833T","DEN","UAS",NA,"LCH",NA,NA,NA,NA,NA,NA,NA,NA,NA,NA,NA,NA,NA,NA,NA,"RWY 33","LCH","RUNWAY"
"Reported observingfour, four rotor UAS' pass150 beneath the aircraft whileESE bound at 1,500feet on a 3 NMfinal to RWY 12R. No evasive action taken. San Jose PD notified at.  ","['rwy12r']","[]","[]","3/6/2019","5:50","2019-03-06T05:50Z","ASA1215","DEN","UAS",NA,"SJC",NA,NA,NA,NA,NA,NA,NA,NA,NA,NA,NA,NA,NA,NA,NA,"RWY 12R","SJC","RUNWAY"
"VFR aircraft reported sighting a Quad-copter at the same altitude while SW bound at 1,300 feet, 1.5 NM from SMO RWY 21. No evasive action taken. Santa Monica PD notified at. ","['rwy21 ']","['5 NM ']","['SMO']","3/16/2019","2:54","2019-03-16T02:54Z","N195PS","DEN","UAS",NA,"SMO",NA,NA,NA,NA,NA,NA,NA,NA,NA,NA,NA,NA,NA,NA,NA,"RWY 21","SMO","RUNWAY"
"Reported sighting a white UAS 100 feet below while at 700 feet on a 1 NM final to RWY 35R. No evasive action taken. Orange County Sheriff notified at.","['rwy35r']","['1 NM ']","[]","3/17/2019","23:22","2019-03-17T23:22Z","JBU199","DEN","UAS",NA,"MCO",NA,NA,NA,NA,NA,NA,NA,NA,NA,NA,NA,NA,NA,NA,NA,"RWY 35R","MCO","RUNWAY"
"PIC reported a UAS while on final to RWY 01. No evasive action reported. Prince George County PD notified at.","['rwy01 ']","[]","[]","3/20/2019","1:54","2019-03-20T01:54Z","JBU1734","DEN","UAS",NA,"DCA",NA,NA,NA,NA,NA,NA,NA,NA,NA,NA,NA,NA,NA,NA,NA,"RWY 01","DCA","RUNWAY"
"Tower advised unknown type UAS crashed under unknown circumstances RWY 15/33. UAS operator was on scene and had authorization to fly the UAS at the airport. No damage to runway. Substantial damage to UAS. LEO not notified.","['rwy15']","[]","[]","3/27/2019","2:30","2019-03-27T02:30Z","CHAINSAW40","DEN","UAS",NA,"RME",NA,NA,NA,NA,NA,NA,NA,NA,NA,NA,NA,NA,NA,NA,NA,"RWY 15","RME","RUNWAY"
"Aircraft reported 2 UAS while on final approach to RWY 19C at 2,000 feet. No evasive action taken. Loudon County Sheriff notified. ","['rwy19c']","[]","[]","3/28/2019","23:58","2019-03-28T23:58Z","AAL359","DEN","UAS",NA,"IAD",NA,NA,NA,NA,NA,NA,NA,NA,NA,NA,NA,NA,NA,NA,NA,"RWY 19C","IAD","RUNWAY"
"Reported observing a blue and red UAS from the 12 o'clock position while ENE bound at 1,500 feet on final for RWY 07. No evasive action reported. Chase County Sheriff notified at.","['rwy07 ']","[]","[]","3/30/2019","2:47","2019-03-30T02:47Z","N24658","DEN","UAS",NA,"ORL",NA,NA,NA,NA,NA,NA,NA,NA,NA,NA,NA,NA,NA,NA,NA,"RWY 07","ORL","RUNWAY"
"Reported sighting a red UAS while at 100 feet on final to RWY 26R. No evasive action taken. Houston PD Air Unit notified at. ","['rwy26r']","[]","['26R']","3/31/2019","0:10","2019-03-31T00:10Z","RPA3437","DEN","UAS",NA,"IAH",NA,NA,NA,NA,NA,NA,NA,NA,NA,NA,NA,NA,NA,NA,NA,"RWY 26R","IAH","RUNWAY"
"Pilot reported a quad-copter UAS from the 12 o'clock position while on a 1 NM final to RWY 07L. No evasive action taken. Phoenix PD notified at. ","['rwy07l']","['1 NM ']","[]","4/1/2019","23:00","2019-04-01T23:00Z","PAT045A","DEN","UAS",NA,"P50",NA,NA,NA,NA,NA,NA,NA,NA,NA,NA,NA,NA,NA,NA,NA,"RWY 07L","P50","RUNWAY"
"After departingRWY 07L, reported a UASover Campbell airstrip at 2,000 feet. No evasive action taken. LEOwas not notified.","['rwy07l']","[]","[]","4/3/2019","3:13","2019-04-03T03:13Z","RYA219","DEN","UAS",NA,"WOC",NA,NA,NA,NA,NA,NA,NA,NA,NA,NA,NA,NA,NA,NA,NA,"RWY 07L","WOC","RUNWAY"
"Pilot reported a black and silver four-rotor type UAS off left side of aircraft at 900-1,000 feet on 2 NMfinal to RWY 36L. No evasive action taken. Orange County Sheriff Air Division notified at. ","['rwy36l']","[]","[]","4/4/2019","20:54","2019-04-04T20:54Z","NKS902","DEN","UAS",NA,"MCO",NA,NA,NA,NA,NA,NA,NA,NA,NA,NA,NA,NA,NA,NA,NA,"RWY 36L","MCO","RUNWAY"
"Pilot reported a black quad-copterUAS at 3,000 feet while SE boundon a 6 NMfinal to RWY 13R. Evasive action taken. Texas DPS notified. ","['rwy13r']","[]","['13R']","4/5/2019","21:40","2019-04-05T21:40Z","LIMO73","DEN","UAS",NA,"SAT",NA,NA,NA,NA,NA,NA,NA,NA,NA,NA,NA,NA,NA,NA,NA,"RWY 13R","SAT","RUNWAY"
"Aircraft reported two red and white UAS whileat 1500 feet on 4 NMfinal RWY 09 to MIA.No evasive action taken. LEOnotified.","['rwy09 ']","[]","['MIA']","4/6/2019","5:37","2019-04-06T05:37Z","RPA4385","DEN","UAS",NA,"WOC",NA,NA,NA,NA,NA,NA,NA,NA,NA,NA,NA,NA,NA,NA,NA,"RWY 09","WOC","RUNWAY"
"PIC reported two white UAS while on final to RWY 24R. First UAS sighted while on a 5 NM final at 1,500 feet. Second UAS sighted on 1 NM final at 800 feet. No evasive action taken. LEO notification not reported.","['rwy24r']","['5 NM ', '1 NM ']","['24R']","4/7/2019","4:40","2019-04-07T04:40Z","SWA293","DEN","UAS",NA,"LAX",NA,NA,NA,NA,NA,NA,NA,NA,NA,NA,NA,NA,NA,NA,NA,"RWY 24R","LAX","RUNWAY"
"A90 reports via MOR, PIC reported a UAS in the vicinity of COHAS while on the final to RWY 33L. No evasive action reported. Massachusetts State Police notified at and they are investigating.Multiple Aircraft reported same activity prompting BOS to change arrival runway to RWY 27. ATC operations and arrival rate not impacted. No further reports of UAS activity after runway change. 1535 HQ DEN contacted A90 and explained the requirement to report future similar events that impact operations/runway usage needs to be relayed over the DEN. NB/NW advised.","['rwy33l', 'rwy27 ']","[]","['MOR', 'BOS', 'DEN', 'DEN']","4/11/2019","20:38","2019-04-11T20:38Z","UAL2310","DEN","UAS","PAGED","A90",NA,NA,NA,NA,NA,NA,NA,NA,NA,NA,NA,NA,NA,NA,NA,"RWY 33L","A90","RUNWAY"
"Reported a black 6 rotor UAS operating off of the left side at 3,500 feet while NNE bound at 5,000 feet on left base for RWY 29L. Evasive action not reported. TAA Dispatch notified at. ","['rwy29l']","[]","[]","4/14/2019","1:15","2019-04-14T01:15Z","N6918H","DEN","UAS",NA,"TUS",NA,NA,NA,NA,NA,NA,NA,NA,NA,NA,NA,NA,NA,NA,NA,"RWY 29L","TUS","RUNWAY"
"Aircraft reporteda white UAS pass 300 feet belowwhile W bound at 2,600 feet on a 5 NM final to RWY 26R. No evasive action taken. Houston PD notified at. ","['rwy26r']","['5 NM ']","['26R']","4/14/2019","23:33","2019-04-14T23:33Z","UAL1638","DEN","UAS",NA,"IAH",NA,NA,NA,NA,NA,NA,NA,NA,NA,NA,NA,NA,NA,NA,NA,"RWY 26R","IAH","RUNWAY"
"Aircraft reported UAS at 5,500 feet while on final for RWY 36L. No evasive action taken. LEO notification not reported. ","['rwy36l']","[]","[]","4/16/2019","20:01","2019-04-16T20:01Z","JIA5237","DEN","UAS",NA,"CLT",NA,NA,NA,NA,NA,NA,NA,NA,NA,NA,NA,NA,NA,NA,NA,"RWY 36L","CLT","RUNWAY"
"Aircraft observed one, possibly two UAS off the left side after departing RWY 09L at 3,500 feet in the vicinity of PHL. No evasive action taken. PHL PD notified at. ","['rwy09l']","[]","['PHL', 'PHL']","4/22/2019","20:56","2019-04-22T20:56Z","JIA5581","DEN","UAS",NA,"PHL",NA,NA,NA,NA,NA,NA,NA,NA,NA,NA,NA,NA,NA,NA,NA,"RWY 09L","PHL","RUNWAY"
"Aircraft reported UAS at 3,500 after departing PHL RWY 09L. No evasive action reported. PHL PD notified at unknown number.","['rwy09l']","[]","['PHL', 'PHL']","4/23/2019","17:46","2019-04-23T17:46Z","AAL540","DEN","UAS",NA,"PHL",NA,NA,NA,NA,NA,NA,NA,NA,NA,NA,NA,NA,NA,NA,NA,"RWY 09L","PHL","RUNWAY"
"Reported a UAS while SW bound at 2,000feet on 5 NM final RWY 22 LGA. No evasive action taken. No description, altitude, or location of UAS given. NYPD Aviation unit notified at.","['rwy22 ']","['5 NM ']","['LGA']","4/24/2019","1:53","2019-04-24T01:53Z","DAL867","DEN","UAS",NA,"LGA",NA,NA,NA,NA,NA,NA,NA,NA,NA,NA,NA,NA,NA,NA,NA,"RWY 22","LGA","RUNWAY"
"Reported observing a fixed-wing, white UAS with 4 props and a camera underneath itwhile descending through 800feet on final forRWY 34R at SMF. UAS was hovering 100-200feet ahead and to the right of aircraft. No evasive action reported. No report if LEO notified. ","['rwy34r']","[]","['34R', 'SMF']","4/24/2019","6:28","2019-04-24T06:28Z","N222LX","DEN","UAS",NA,"SMF",NA,NA,NA,NA,NA,NA,NA,NA,NA,NA,NA,NA,NA,NA,NA,"RWY 34R","SMF","RUNWAY"
"Observed a black drone with yellow and green trimwhile on downwind to RWY 24 and abeam RWY 34 at 1,000feet 20-30 feetoff aircraft's left wing.  ","['rwy24 ', 'rwy34 ']","[]","[]","4/26/2019","3:27","2019-04-26T03:27Z","N571SP","DEN","UAS",NA,"TTN",NA,NA,NA,NA,NA,NA,NA,NA,NA,NA,NA,NA,NA,NA,NA,"RWY 24","TTN","RUNWAY"
"Reported a yellow UAS operating at approximately 500 feet whileNW bound at 600 feet on a 2 NM final for RWY 31L. Noevasive action taken. LEO notified at. ","['rwy31l']","['2 NM ']","[]","4/27/2019","23:50","2019-04-27T23:50Z","IBE6251","DEN","UAS",NA,"JFK",NA,NA,NA,NA,NA,NA,NA,NA,NA,NA,NA,NA,NA,NA,NA,"RWY 31L","JFK","RUNWAY"
"Reported a black UAS off of the rightwhile W bound at 700 feet on a 4 NM final for RWY 28L. Evasive action not reported. SF PD notified at. ","['rwy28l']","['4 NM ']","[]","4/28/2019","5:16","2019-04-28T05:16Z","AAR212","DEN","UAS",NA,"SFO",NA,NA,NA,NA,NA,NA,NA,NA,NA,NA,NA,NA,NA,NA,NA,"RWY 28L","SFO","RUNWAY"
"Reported an RCoperating near the approach end of RWY 28L as they were taxiing for departure. LEOnotified at.","['rwy28l']","[]","[]","4/29/2019","1:43","2019-04-29T01:43Z","LOF4764","DEN","UAS",NA,"MRY",NA,NA,NA,NA,NA,NA,NA,NA,NA,NA,NA,NA,NA,NA,NA,"RWY 28L","MRY","RUNWAY"
"Reported a black and orange 4 rotor UAS300 feet lowwhile E bound at 2,600 feet on a 7 NM final to RWY 08R. No evasive action reported. Houston PD notified at. ","['rwy08r']","['7 NM ']","['S30', '08R']","4/29/2019","4:14","2019-04-29T04:14Z","ASQ4291","DEN","UAS",NA,"IAH",NA,NA,NA,NA,NA,NA,NA,NA,NA,NA,NA,NA,NA,NA,NA,"RWY 08R","IAH","RUNWAY"
"Airport personnel reported the discovery of awhite, 4 rotor UAS in the grass S of the approach end of RWY 34Rwhile conducting awalkinginspection of theRWY 34R RSA. NoUAS activity reported. ","['rwy34r', 'rwy34r']","[]","['34R', '34R']","4/30/2019","2:31","2019-04-30T02:31Z",NA,"DEN","UAS",NA,"PAE",NA,NA,NA,NA,NA,NA,NA,NA,NA,NA,NA,NA,NA,NA,NA,"RWY 34R","PAE","RUNWAY"
"PIC reported a UAS pass 200 feetabove them off their right side while at 500 feet on a 1 NM final to RWY 31. No evasive action taken. Washington County Sheriff notified.","['rwy31 ']","['1 NM ']","[]","5/2/2019","3:48","2019-05-02T03:48Z","N6286M","DEN","UAS",NA,"HIO",NA,NA,NA,NA,NA,NA,NA,NA,NA,NA,NA,NA,NA,NA,NA,"RWY 31","HIO","RUNWAY"
"Aircraft reported UAS on 2 NM final forRWY 26R at 900 feet. LEO notification not reported. ","['rwy26r']","['2 NM ']","['26R']","5/4/2019","5:38","2019-05-04T05:38Z","N33001","DEN","UAS",NA,"LGB",NA,NA,NA,NA,NA,NA,NA,NA,NA,NA,NA,NA,NA,NA,NA,"RWY 26R","LGB","RUNWAY"
"Reported having to descend below a UAS operating at approximately200AGL over the final for RWY 28R while Wbound at 200 feet on final. Yellowstone County Sheriff notified. ","['rwy28r']","[]","['00A']","5/4/2019","8:52","2019-05-04T08:52Z","N416BK","DEN","UAS",NA,"BIL",NA,NA,NA,NA,NA,NA,NA,NA,NA,NA,NA,NA,NA,NA,NA,"RWY 28R","BIL","RUNWAY"
"PIC reported a drone on a 3 NM final forRWY 16 at 1,600 feet. No evasive action taken. LEO not notified. ","['rwy16 ']","['3 NM ']","[]","5/9/2019","21:44","2019-05-09T21:44Z","N666TR","DEN","UAS",NA,"ROC",NA,NA,NA,NA,NA,NA,NA,NA,NA,NA,NA,NA,NA,NA,NA,"RWY 16","ROC","RUNWAY"
"Reported a UAS off left side while SW bound at 1,000 feet 1.5 NM final approach to RWY 22L. No evasive action taken. Massachusetts State PD notified at. ","['rwy22l']","['5 NM ']","[]","5/10/2019","20:21","2019-05-10T20:21Z","POE939","DEN","UAS",NA,"BOS",NA,NA,NA,NA,NA,NA,NA,NA,NA,NA,NA,NA,NA,NA,NA,"RWY 22L","BOS","RUNWAY"
"PIC reported a red and black UAS that passed overhead.Aircraft was at 1,500feet on a4 NM final to RWY 04R. No evasive action taken. Port Authority PD notified at.","['rwy04r']","['4 NM ']","[]","5/11/2019","17:56","2019-05-11T17:56Z","UAL2165","DEN","UAS",NA,"EWR",NA,NA,NA,NA,NA,NA,NA,NA,NA,NA,NA,NA,NA,NA,NA,"RWY 04R","EWR","RUNWAY"
"Reported observing a 4 rotor UAS operating approximately 50 feet AGL while Sbound at 200 feet on a 1 NM final to RWY 19. No evasive action taken. McLennan County Sheriff notified and investigated finding no individual operators. ","['rwy19 ']","['1 NM ']","[]","5/13/2019","4:37","2019-05-13T04:37Z","N222UH","DEN","UAS",NA,"ACT",NA,NA,NA,NA,NA,NA,NA,NA,NA,NA,NA,NA,NA,NA,NA,"RWY 19","ACT","RUNWAY"
"BAD AFB reported 2 UAS' maneuvering over RWY 15/33 at 500 feet and 1,500 feet. One UAS flew out of sightto the E, the other continued to maneuver over the RWY. Unknown LEO notification.","['rwy15']","[]","['BAD']","5/13/2019","9:23","2019-05-13T09:23Z",NA,"DEN","UAS",NA,"SHV",NA,NA,NA,NA,NA,NA,NA,NA,NA,NA,NA,NA,NA,NA,NA,"RWY 15","SHV","RUNWAY"
"PIC reported a silver UAS with a camera attached while on crosswind turn to RWY 24 while at 1,200 feet. The UAS was reported within 5 feet of their Aircraft. No evasive action reported. LEO notification not reported.","['rwy24 ']","[]","[]","5/18/2019","6:49","2019-05-18T06:49Z","N2866W","DEN","UAS",NA,"LOU",NA,NA,NA,NA,NA,NA,NA,NA,NA,NA,NA,NA,NA,NA,NA,"RWY 24","LOU","RUNWAY"
"Reported a UAS at 300 feet in VCNTY to final approach courseto RWY 35. No evasive action taken. Kent County Sheriff notified at. ","['rwy35 ']","[]","[]","5/23/2019","19:37","2019-05-23T19:37Z","N65TH","DEN","UAS",NA,"GRR",NA,NA,NA,NA,NA,NA,NA,NA,NA,NA,NA,NA,NA,NA,NA,"RWY 35","GRR","RUNWAY"
"Reported observing two UAS's operating S of RWY 09 while Ebound at 300 feet on short final to RWY 09. No evasive action reported. LEO notification not reported. ","['rwy09 ', 'rwy09 ']","[]","[]","5/24/2019","2:10","2019-05-24T02:10Z","N907JW","DEN","UAS",NA,"FXE",NA,NA,NA,NA,NA,NA,NA,NA,NA,NA,NA,NA,NA,NA,NA,"RWY 09","FXE","RUNWAY"
"Reported observing aUAS pass 50 yards, opposite directionoff of the left side while climbing through 6,000 feet off of the departure end of RWY 21. No evasive action taken. Idaho Falls PD notified. ","['rwy21 ']","[]","[]","5/25/2019","0:46","2019-05-25T00:46Z","LN481HC","DEN","UAS",NA,"IDA",NA,NA,NA,NA,NA,NA,NA,NA,NA,NA,NA,NA,NA,NA,NA,"RWY 21","IDA","RUNWAY"
"PIC reported an RC fixed wing aircraft flying at or below 300 feet, 200 feet off of his right side while ENE bound at 300 feet on final to RWY 07. Evasive action not reported. Santa Barbara County Sheriff notified. ","['rwy07 ']","[]","[]","5/26/2019","4:07","2019-05-26T04:07Z","VTE3606","DEN","UAS",NA,"SBA",NA,NA,NA,NA,NA,NA,NA,NA,NA,NA,NA,NA,NA,NA,NA,"RWY 07","SBA","RUNWAY"
"Aircraft reported red and white UAS while at 700 feet on final to RWY 22. No evasive action taken. NYPD notified at. ","['rwy22 ']","[]","[]","5/29/2019","3:25","2019-05-29T03:25Z","RPA4329","DEN","UAS",NA,"LGA",NA,NA,NA,NA,NA,NA,NA,NA,NA,NA,NA,NA,NA,NA,NA,"RWY 22","LGA","RUNWAY"
"After departure, aircraft reported a UASoperating at approximately 100' off left side of departure end RWY 24.ARFFresponded to search area for the UAS operator. Nantucket PDwas notified at.","['rwy24 ']","[]","[]","5/31/2019","2:28","2019-05-31T02:28Z","N2043A","DEN","UAS",NA,"ACK",NA,NA,NA,NA,NA,NA,NA,NA,NA,NA,NA,NA,NA,NA,NA,"RWY 24","ACK","RUNWAY"
"PIC reported a white UAS off their right side while S bound at 5,000 feet on base to RWY 27R. No evasive action taken.Philadelphia PDnotified at. ","['rwy27r']","[]","['27R']","6/4/2019","2:25","2019-06-04T02:25Z","AAL2113","DEN","UAS",NA,"PHL",NA,NA,NA,NA,NA,NA,NA,NA,NA,NA,NA,NA,NA,NA,NA,"RWY 27R","PHL","RUNWAY"
"Reported a white UAS on 1.5 NM final to RWY 01C (approximately theAML180001)at 1,000 feet, Wbound. No evasive action taken. Louden County PD notified at. ","['rwy01c']","['5 NM ']","['L18']","6/4/2019","22:33","2019-06-04T22:33Z","DLH416","NCRCC","UAS",NA,"IAD",NA,NA,NA,NA,NA,NA,NA,NA,NA,NA,NA,NA,NA,NA,NA,"RWY 01C","IAD","RUNWAY"
"PIC reported a dark blue quad copter UAS on their left side while at 1,000 feet 2 NM final to RWY 25L. No evasive action taken. Los Angeles Airport PD notified at.","['rwy25l']","['2 NM ']","[]","6/10/2019","4:11","2019-06-10T04:11Z","AAL2850","DEN","UAS",NA,"LAX",NA,NA,NA,NA,NA,NA,NA,NA,NA,NA,NA,NA,NA,NA,NA,"RWY 25L","LAX","RUNWAY"
"Reported a black and white quad-copter UAS moving form E to W at 300 feet below aircraft from the 12 o'clock position whileSE bound at 2,000 feet on 5 NM final to RWY 17L. Orange County Sheriff notified at. ","['rwy17l']","['5 NM ']","[]","6/11/2019","0:08","2019-06-11T00:08Z","SWA273","DEN","UAS",NA,"MCO",NA,NA,NA,NA,NA,NA,NA,NA,NA,NA,NA,NA,NA,NA,NA,"RWY 17L","MCO","RUNWAY"
"Reported a green and whiteUAS on left downwind for RWY 21L at 8,000 feetDetroit airport PDnotified at. ","['rwy21l']","[]","[]","6/12/2019","3:58","2019-06-12T03:58Z","EDV5132","DEN","UAS",NA,"D21",NA,NA,NA,NA,NA,NA,NA,NA,NA,NA,NA,NA,NA,NA,NA,"RWY 21L","D21","RUNWAY"
"Reported observing a UAS operating at 1,400 feet off of the departure RWY 13L end. Evasive action not reported. NYPD Aviation Unit notified at.","['rwy13l']","[]","[]","6/12/2019","18:37","2019-06-12T18:37Z","JBU2359","DEN","UAS",NA,"JFK",NA,NA,NA,NA,NA,NA,NA,NA,NA,NA,NA,NA,NA,NA,NA,"RWY 13L","JFK","RUNWAY"
"Reported observing a UAS 500 feet off of the left side while Sbound at 5,000 feet while on a 4 NM final to RWY 17. No evasive action taken. LEO notified at.","['rwy17 ']","['4 NM ']","[]","6/12/2019","19:12","2019-06-12T19:12Z","DAL","DEN","UAS",NA,"SLC",NA,NA,NA,NA,NA,NA,NA,NA,NA,NA,NA,NA,NA,NA,NA,"RWY 17","SLC","RUNWAY"
"Reported a UAS at 300 feet below aircraft while doing pattern work to RWY 16L at 5,200 feet. No evasive action taken. LEO notification not reported. ","['rwy16l']","[]","[]","6/13/2019","22:44","2019-06-13T22:44Z","N818KA","DEN","UAS",NA,"RNO",NA,NA,NA,NA,NA,NA,NA,NA,NA,NA,NA,NA,NA,NA,NA,"RWY 16L","RNO","RUNWAY"
"Reported an orange and red UAS at their 12 o'clock. Aircraft was at 1700 ft. departing RWY 27L. No evasive action taken. PHL ARPT PD notified at.","['rwy27l']","[]","['PHL']","6/15/2019","0:32","2019-06-15T00:32Z","PDT4913","DEN","UAS",NA,"PHL",NA,NA,NA,NA,NA,NA,NA,NA,NA,NA,NA,NA,NA,NA,NA,"RWY 27L","PHL","RUNWAY"
"Reported a UAS passed 1,000 ft. below while NNW bound at 3,500 ft. Aircraft was on 8 NM final to RWY 34L. No evasive action taken. LEO notified via 911. ","['rwy34l']","['8 NM ']","[]","6/17/2019","4:00","2019-06-17T04:00Z","CPZ5753","DEN","UAS",NA,"SEA",NA,NA,NA,NA,NA,NA,NA,NA,NA,NA,NA,NA,NA,NA,NA,"RWY 34L","SEA","RUNWAY"
"Reported a UAS while on 6 NM final to RWY 22L at 2,000 ft. No evasive action reported. LEO notified at.","['rwy22l']","['6 NM ']","[]","6/21/2019","1:25","2019-06-21T01:25Z","ASA628","DEN","UAS",NA,"JFK",NA,NA,NA,NA,NA,NA,NA,NA,NA,NA,NA,NA,NA,NA,NA,"RWY 22L","JFK","RUNWAY"
"Reported observing a red and white UAS from the left side while NE bound at 1,000 feet, while midfield right down-wind RWY 23. No evasive action taken. Airborne JSO Aviation Helicopter AIRHAWK4 pursued the UAS until returning to CRG being unable to locate the operator. ","['rwy23 ']","[]","['JSO', 'CRG']","6/21/2019","6:07","2019-06-21T06:07Z","N586MA","DEN","UAS",NA,"CRG",NA,NA,NA,NA,NA,NA,NA,NA,NA,NA,NA,NA,NA,NA,NA,"RWY 23","CRG","RUNWAY"
"Reported sighting a UAS at same altitude while Wbound at 2,000 feet on a 7 NM final to RWY 27R. Evasive action not reported. Philadelphia PD notified at.","['rwy27r']","['7 NM ']","['27R']","6/22/2019","5:08","2019-06-22T05:08Z","RPA4532","DEN","UAS",NA,"PHL",NA,NA,NA,NA,NA,NA,NA,NA,NA,NA,NA,NA,NA,NA,NA,"RWY 27R","PHL","RUNWAY"
"Reported a UAS while on final for RWY 28. The UAS was 200 ft. above while at an altitude of 3,200 ft. No evasive action taken. Crayton County PD was notified at. ","['rwy28 ']","[]","[]","6/22/2019","23:20","2019-06-22T23:20Z","SKW3621","DEN","UAS",NA,"ATL",NA,NA,NA,NA,NA,NA,NA,NA,NA,NA,NA,NA,NA,NA,NA,"RWY 28","ATL","RUNWAY"
"Reported sighting a white Quad-copter UAS 300 feet off of the right side while WNW bound out of 6,000 feet and descending on final to RWY 29L. No evasive action taken. LEO was not notified. ","['rwy29l']","[]","[]","6/24/2019","5:45","2019-06-24T05:45Z","N63NM","DEN","UAS",NA,"FAT",NA,NA,NA,NA,NA,NA,NA,NA,NA,NA,NA,NA,NA,NA,NA,"RWY 29L","FAT","RUNWAY"
"Black quadcopter, operating 400 feet off their left side while on .5 final for RWY 22L. No evasive action taken. Chicago Police notified at.","['rwy22l']","[]","[]","6/26/2019","19:48","2019-06-26T19:48Z","JTL887","DEN","UAS",NA,"MDW",NA,NA,NA,NA,NA,NA,NA,NA,NA,NA,NA,NA,NA,NA,NA,"RWY 22L","MDW","RUNWAY"
"Reported a black and blue UAS at 50 FT while on two NM final to RWY 32. No evasive action taken SCPD was notified. ","['rwy32 ']","[]","[]","6/27/2019","0:11","2019-06-27T00:11Z","N621PF","DEN","UAS",NA,"FRG",NA,NA,NA,NA,NA,NA,NA,NA,NA,NA,NA,NA,NA,NA,NA,"RWY 32","FRG","RUNWAY"
"Black and white UAS while on a RWY 18 7 mi final at 1500 ft. No evasive action taken. No LEO report made. ","['rwy18 ']","[]","[]","6/27/2019","20:32","2019-06-27T20:32Z","NKS1407","DEN","UAS",NA,"MYR",NA,NA,NA,NA,NA,NA,NA,NA,NA,NA,NA,NA,NA,NA,NA,"RWY 18","MYR","RUNWAY"
"Reported sighting a UAS operating at 1,900 feet while Nbound at 1,900 feet on an 8 NM final to RWY 34. Evasive action not reported. LEO notification was not provided. ","['rwy34 ']","['8 NM ']","[]","6/27/2019","22:55","2019-06-27T22:55Z","OPT361","DEN","UAS",NA,"HPN",NA,NA,NA,NA,NA,NA,NA,NA,NA,NA,NA,NA,NA,NA,NA,"RWY 34","HPN","RUNWAY"
"Tinker AFB reported sighting a UAS off of the left side while Sbound at500 feet on a 2.5 NM final to RWY 18. No evasive action taken. Base Security and MidW City PD notified. ","['rwy18 ']","[]","[]","6/28/2019","4:22","2019-06-28T04:22Z","BOXED14","DEN","UAS",NA,"OKC",NA,NA,NA,NA,NA,NA,NA,NA,NA,NA,NA,NA,NA,NA,NA,"RWY 18","OKC","RUNWAY"
"Aircraft reports a white quad copter at 2,200 feet while in closed traffic for RWY 19L. No evasive action taken.Tulsa PDnotified. ","['rwy19l']","[]","[]","7/1/2019","5:05","2019-07-01T05:05Z","N919SC","DEN","UAS",NA,"RVS",NA,NA,NA,NA,NA,NA,NA,NA,NA,NA,NA,NA,NA,NA,NA,"RWY 19L","RVS","RUNWAY"
"Reported a drone at 1100 feet on a 3 mi base to final RWY 24. No evasive action reported. Nantucket PD notified. ","['rwy24 ']","[]","[]","7/4/2019","0:06","2019-07-04T00:06Z","N949SA","DEN","UAS",NA,"ACK",NA,NA,NA,NA,NA,NA,NA,NA,NA,NA,NA,NA,NA,NA,NA,"RWY 24","ACK","RUNWAY"
"8 rotor UAS at 150 feet while W bound at 800 feet, 1/2 NM off the departure end of RWY 28L. No evasive action taken. Columbus PD notified. ","['rwy28l']","[]","[]","7/4/2019","22:33","2019-07-04T22:33Z","SWA267","DEN","UAS",NA,"CMH",NA,NA,NA,NA,NA,NA,NA,NA,NA,NA,NA,NA,NA,NA,NA,"RWY 28L","CMH","RUNWAY"
"Reported a orangeUAS off theright side while W bound at 1,500 feet on a3 NM final toRWY 27.No evasive action. Houston PD Air Unit notified at. ","['rwy27 ']","['3 NM ']","[]","7/5/2019","23:15","2019-07-05T23:15Z","UAL567","DEN","UAS",NA,"IAH",NA,NA,NA,NA,NA,NA,NA,NA,NA,NA,NA,NA,NA,NA,NA,"RWY 27","IAH","RUNWAY"
"After departure, PIC reported a quad copter UAS at 1,500 feet hovering off the departure end of RWY 10. No evasive action taken. ","['rwy10 ']","[]","[]","7/9/2019","4:37","2019-07-09T04:37Z","N12442","DEN","UAS",NA,"DPA",NA,NA,NA,NA,NA,NA,NA,NA,NA,NA,NA,NA,NA,NA,NA,"RWY 10","DPA","RUNWAY"
"Aircraft reports a UAS while on 4.8 NM final to RWY 04R at 1,200 ft. No evasive action taken. Mass. State Police notified at.","['rwy04r']","['8 NM ']","[]","7/10/2019","2:05","2019-07-10T02:05Z","AAL1239","DEN","UAS",NA,"BOS",NA,NA,NA,NA,NA,NA,NA,NA,NA,NA,NA,NA,NA,NA,NA,"RWY 04R","BOS","RUNWAY"
"PIC reported a white UAS in front of them and 500 feet below them while SE bound at 6,500 feet 6 NM final to RWY 16L. No evasive action reported. Salt Lake City Airport PD notified at.","['rwy16l']","['6 NM ']","[]","7/12/2019","6:05","2019-07-12T06:05Z","AMF7788","DEN","UAS",NA,"SLC",NA,NA,NA,NA,NA,NA,NA,NA,NA,NA,NA,NA,NA,NA,NA,"RWY 16L","SLC","RUNWAY"
"While on rotation to RWY 26L, aircraft reported to the Tower what was possibly a UAS flying opposite direction overhead the aircraft at approximately 20 feet above the aircraft. No other description was received at the time the ramp called for a RWY inspection. MDAD Aviation PD notified. Tower personnel reported no sighting and ramp vehicle's reported the same. All aircraft inventory for RWY 26 were advised of the possible sighting and offered alternative departure actions.","['rwy26l', 'rwy26 ']","[]","['MDA']","7/28/2019","2:30","2019-07-28T02:30Z","RPA4441","DEN","UAS",NA,"MIA",NA,NA,NA,NA,NA,NA,NA,NA,NA,NA,NA,NA,NA,NA,NA,"RWY 26L","MIA","RUNWAY"
"California Air National Guard reported a UAS off the departure end of RWY 29 near the 168 freeway. UAS was spotted visually by FAT ATCT. Airport Operations attempted to search for the UAS with no findings. FAT ATCT lost visual contact at 0330.","['rwy29 ']","[]","['FAT', 'TCT', 'FAT', 'TCT']","8/1/2019","3:15","2019-08-01T03:15Z",NA,"DEN","UAS",NA,"FAT",NA,NA,NA,NA,NA,NA,NA,NA,NA,NA,NA,NA,NA,NA,NA,"RWY 29","FAT","RUNWAY"
"Unidentified aircraft observed a UAS operating 500 feet off of the approach end of RWY 20 at JWN. No evasive action was taken. Nashville Airport PD notified at.","['rwy20 ']","[]","['JWN']","9/9/2019","20:05","2019-09-09T20:05Z",NA,"DEN","UAS",NA,"BNA",NA,NA,NA,NA,NA,NA,NA,NA,NA,NA,NA,NA,NA,NA,NA,"RWY 20","BNA","RUNWAY"
"PIC observed 2 quad copter UAS with orange lights off the right side while SW bound at 900 feet while on final to RWY 22. No evasive action was taken. NYPD Aviation Unit notified.","['rwy22 ']","[]","[]","9/22/2019","2:01","2019-09-22T02:01Z","AAL1942","DEN","UAS",NA,"LGA",NA,NA,NA,NA,NA,NA,NA,NA,NA,NA,NA,NA,NA,NA,NA,"RWY 22","LGA","RUNWAY"
"Aircraft observed two white UAS while W bound at 700 feet 3 NM final to RWY 26L. No evasive action was taken. LGB Airport PD notified at.","['rwy26l']","['3 NM ']","['LGB']","9/27/2019","20:08","2019-09-27T20:08Z","N4390S","DEN","UAS",NA,"LGB",NA,NA,NA,NA,NA,NA,NA,NA,NA,NA,NA,NA,NA,NA,NA,"RWY 26L","LGB","RUNWAY"
"Columbus Airport PD received reports of an individual operating a UAS off the departure end of RWY 28L within 5 NM of the airport. LEO interviewed an individual with a drone in the area but did not observe the UAS airborne. Investigation ongoing. No aircraft were involved in this incident.","['rwy28l']","['5 NM ']","[]","9/28/2019","17:23","2019-09-28T17:23Z",NA,"DEN","UAS",NA,"CMH",NA,NA,NA,NA,NA,NA,NA,NA,NA,NA,NA,NA,NA,NA,NA,"RWY 28L","CMH","RUNWAY"
"SIG ATCT reports aircraft reported a grey quad-copter UAS while on left base at 400 feet, RWY 09 to SIG. Pilot took an evasive climb to avoid collision with UAS. Puerto Rico PD notified at. No further sightings reported. No impact to operations.  ","['rwy09 ']","[]","['SIG', 'TCT', 'SIG']","10/11/2019","20:05","2019-10-11T20:05Z","N4400T","DEN","UAS",NA,"HQ DEN",NA,NA,NA,NA,NA,NA,NA,NA,NA,NA,NA,NA,NA,NA,NA,"RWY 09","HQ DEN","RUNWAY"
"Aircraft and tower personnel observed a black quad-copter UAS with green and blue lights at 300 feet on short final to RWY 28L. No evasive action was taken. Columbus airport PD notified at. ","['rwy28l']","[]","[]","10/24/2019","13:56","2019-10-24T13:56Z","N501LS","DEN","UAS",NA,"CMH",NA,NA,NA,NA,NA,NA,NA,NA,NA,NA,NA,NA,NA,NA,NA,"RWY 28L","CMH","RUNWAY"
"Airport ground personnel observed a UAS with green and red lights approximately 300 feet AGL off the departure end of RWY 31R. No aircraft in the vicinity. LEO notified.","['rwy31r']","[]","[]","11/2/2019","1:34","2019-11-02T01:34Z",NA,"DEN","UAS",NA,"RHV",NA,NA,NA,NA,NA,NA,NA,NA,NA,NA,NA,NA,NA,NA,NA,"RWY 31R","RHV","RUNWAY"
"POSSIBLE MEDIA EVENT: Aircraft impacted a UAS on the front of the aircraft while NE bound at 5,000 feet, damage unknown, UAS description unknown, no injuries reported. Landed RWY 27L at 0104. 0108 TSOC reports UAL Dispatch reports incident was a bird strike. 0122 PIC confirms incident was a bird strike, small dent on the nose. No injuries. AWO/ATCSCC/MR/SAFETY notified. NFA.","['rwy27l']","[]","['SSI', 'TSO', 'AWO', 'TCS', 'SAF']","11/6/2019","1:02","2019-11-06T01:02Z","UAL1070","DEN","UAS","COD, EMERGENCY","ZAU",NA,NA,NA,NA,NA,NA,NA,NA,NA,NA,NA,NA,NA,NA,NA,"RWY 27L","ZAU","RUNWAY"
"Anonymous call received at the Hillsboro Country Aviation Authority of a UAS operating at 2,000 feet over the S portion of RWY 01R at TPA. No evasive action reported. LEO notification not reported. ","['rwy01r']","[]","['TPA']","12/6/2019","19:36","2019-12-06T19:36Z",NA,"DEN","UAS",NA,"TSOC",NA,NA,NA,NA,NA,NA,NA,NA,NA,NA,NA,NA,NA,NA,NA,"RWY 01R","TSOC","RUNWAY"
"Aircraft reported multiple UAS off the right side, while at 500 feet, short final to RWY 30 OAK. No evasive action taken. Alameda County Sferiff notified at. 
","['rwy30 ']","[]","['OAK']","12/27/2019","5:05","2019-12-27T05:05Z","SWA2451","DEN","UAS",NA,"OAK",NA,NA,NA,NA,NA,NA,NA,NA,NA,NA,NA,NA,NA,NA,NA,"RWY 30","OAK","RUNWAY"
"0242 BUF ATCT observed a UAS overfly RWY 14/32 and the terminal area. No Aircraft involved. HQ DEN was not notified at the time of the event. NFTA notified at 630-6150.","['rwy14']","[]","['BUF', 'TCT', 'DEN']","1/2/2020","3:00","2020-01-02T03:00Z",NA,"DEN","UAS",NA,"WOC",NA,NA,NA,NA,NA,NA,NA,NA,NA,NA,NA,NA,NA,NA,NA,"RWY 14","WOC","RUNWAY"
"PBI County Department of Airports Operations Manager reported a UAS found in the grass S of RWY 28R extended centerline, E of TWYL7. No aircraft involved.  Palm Beach County Sheriff notified at. 1625 Airport Manager provided case number #20031712.","['rwy28r']","[]","['PBI']","1/29/2020","16:15","2020-01-29T16:15Z",NA,"DEN","UAS",NA,"PBI",NA,NA,NA,NA,NA,NA,NA,NA,NA,NA,NA,NA,NA,NA,NA,"RWY 28R","PBI","RUNWAY"
"COS observed two UAS overflying the terminal, Airport Operations notified local law enforcement, currently no impact to operations. HQ DEN reached out to COS Military Operations, Sandy Creek Airport PD investigating, currently one drone visible between 100 and 200 feet E of RWY 35R within Class C airspace. 0427 COS Airport Operations reports no sightings in the last 40 minutes, investigation ongoing.","['rwy35r']","[]","['COS', 'DEN', 'COS', 'COS']","2/1/2020","2:55","2020-02-01T02:55Z",NA,"DEN","UAS",NA,"COS",NA,NA,NA,NA,NA,NA,NA,NA,NA,NA,NA,NA,NA,NA,NA,"RWY 35R","COS","RUNWAY"
"Local control observed a UAS operating in VCNTY of RWY 08 approach end. PIC confirmed a large UAS was operating at approximately 500 feet. No evasive action taken. Local PD and ARPT Security notified. ","['rwy08 ']","[]","[]","2/8/2020","6:12","2020-02-08T06:12Z","HAL552","DEN","UAS",NA,"ITO",NA,NA,NA,NA,NA,NA,NA,NA,NA,NA,NA,NA,NA,NA,NA,"RWY 08","ITO","RUNWAY"
"MOR stated aircraft observed a fixed wing remote control aircraft operating at approximately at 800 feet, 1/4 NM off approach end RWY 04L. No evasive action was taken. Mesa PD notified and dispatch to location of sighting. 2145 HQ DEN contacted FFZ ATCT who states RC did not impact operations and Mesa PD was unable to locate the pilot. No further sightings have been reported or observed from ATCT. ","['rwy04l']","['4 NM ']","['MOR', 'DEN', 'FFZ', 'TCT', 'TCT']","2/24/2020","20:30","2020-02-24T20:30Z","N21329","DEN","UAS","MOR","FFZ",NA,NA,NA,NA,NA,NA,NA,NA,NA,NA,NA,NA,NA,NA,NA,"RWY 04L","FFZ","RUNWAY"
"(via MOR) Airport OPS observed a UAS off the N side of the airport, approach end of RWY 13L at approximately 100 feet. No Aircraft involved. No impact to operations reported. Dallas DPS notified at. HQ DEN contacted DAL ATCT informing them of the need to report UAS activity to the DEN.","['rwy13l']","[]","['MOR', 'DEN', 'DAL', 'TCT', 'DEN']","2/29/2020","19:22","2020-02-29T19:22Z",NA,"DEN","UAS",NA,"DAL",NA,NA,NA,NA,NA,NA,NA,NA,NA,NA,NA,NA,NA,NA,NA,"RWY 13L","DAL","RUNWAY"
"Employee of HSV observed a UAS around RWY 36L approach lights at HSV. HSV ATCT controllers amended the landing clearance of an arriving aircraft to land on RWY 36R. HSV airport authority was notified and made contact with the UAS operator. UAS was not part 107. UAS operator has not been arrested and no charges are pending at this time. ","['rwy36l', 'rwy36r']","[]","['HSV', 'HSV', 'HSV', 'TCT', 'HSV']","3/7/2020","21:00","2020-03-07T21:00Z",NA,"DEN","UAS",NA,"HSV",NA,NA,NA,NA,NA,NA,NA,NA,NA,NA,NA,NA,NA,NA,NA,"RWY 36L","HSV","RUNWAY"
"Passengers observed a white quadcopter at 2,000 feet off the left wing of the aircraft while the aircraft was approximately 4 NM off the departure end of RWY 12R. No evasive action taken. Local law enforcement notified.","['rwy12r']","[]","[]","3/8/2020","17:45","2020-03-08T17:45Z","EJM194","DEN","UAS",NA,"VRB",NA,NA,NA,NA,NA,NA,NA,NA,NA,NA,NA,NA,NA,NA,NA,"RWY 12R","VRB","RUNWAY"
"San Diego Harbor PD notified Tower personnel that a UAS with white lights had been spotted operating near the W end of the airport at departure end of RWY 27 traveling E bound . A departure delay of less than 5 minutes affected a few departures. AWO notified. ","['rwy27 ']","[]","['AWO']","4/4/2020","4:07","2020-04-04T04:07Z",NA,"DEN","UAS",NA,"SAN",NA,NA,NA,NA,NA,NA,NA,NA,NA,NA,NA,NA,NA,NA,NA,"RWY 27","SAN","RUNWAY"
"ATCT personnel observed a yellow UAS off the departure end of RWY 21R at 200 feet AGL. No impact to operations reported. LE notification not reported. ","['rwy21r']","[]","['TCT']","4/25/2020","15:45","2020-04-25T15:45Z",NA,"DEN","UAS",NA,"PDK",NA,NA,NA,NA,NA,NA,NA,NA,NA,NA,NA,NA,NA,NA,NA,"RWY 21R","PDK","RUNWAY"
"Local LE reported a suspicious package on the ground at 1 NM final to RWY 21 at GEG. LE using a UAS to investigate. RWY 21 operations terminated UFN. RWY 26 in use. No impact expected. AWO advised. 1544 TSOC reports suspicious package identified as a propane tank with flares taped to the outside. Package has been transported off the site for investigation and disposal. 1604 SOSC reports local LE reports device moved 15 feet into an adjacent parking lot for easier access. 1650 GEG reports local LE cleared the package and removed it from the RWY 21 final. Normal operations resumed. No impact reported. 1700 SOSC verified with local LE that device was deactivated and removed by EOD. NFA. AWO advised. ","['rwy21 ', 'rwy21 ', 'rwy26 ', 'rwy21 ']","['1 NM ']","['GEG', 'AWO', 'TSO', 'OSC', 'GEG', 'OSC', 'EOD', 'AWO']","4/30/2020","14:03","2020-04-30T14:03Z",NA,"DEN","SUSPICIOUS ACTIVITY","LAW ENFORCEMENT, UAS","GEG",NA,NA,NA,NA,NA,NA,NA,NA,NA,NA,NA,NA,NA,NA,NA,"RWY 21","GEG","RUNWAY"
"Tower observed a UAS maneuvering on final to RWY 10L between 0 to 100 feet  .25 to 2 NM  W of FLL. No evasive action was taken, information broadcast on ATIS. Broward County Sheriff notified at. 1837 FLL reports no other observations of UAS or impact to operations. ","['rwy10l']","['2 NM ']","['FLL', 'FLL']","6/20/2020","18:05","2020-06-20T18:05Z",NA,"DEN","UAS","MOR","FLL",NA,NA,NA,NA,NA,NA,NA,NA,NA,NA,NA,NA,NA,NA,NA,"RWY 10L","FLL","RUNWAY"
"An employee reported sighting a UAS operating between I-215 and the approach end of RWY 35 at approximately 100 to 200 feet. Salt Lake City Airport PD notified. ","['rwy35 ']","[]","[]","7/5/2020","4:30","2020-07-05T04:30Z",NA,"DEN","UAS",NA,"SLC",NA,NA,NA,NA,NA,NA,NA,NA,NA,NA,NA,NA,NA,NA,NA,"RWY 35","SLC","RUNWAY"
"SAN PD reported a civilian reported sighting a UAS S of 1 NM final RWY 27 operating below 400 feet, no aircraft sightings, no impact to operations.","['rwy27 ']","['1 NM ']","['SAN']","7/23/2020","4:55","2020-07-23T04:55Z",NA,"DEN","UAS",NA,"SAN",NA,NA,NA,NA,NA,NA,NA,NA,NA,NA,NA,NA,NA,NA,NA,"RWY 27","SAN","RUNWAY"
"HLGN21 a UAS at 2,100 feet on base to RWY 18 full stop when it lost link, UAS started a climbing right turn to the lost link holding area. Operator regained control 1 minute after incident and UAS landed without incident. NFA.","['rwy18 ']","[]","['HLG', 'N21']","7/24/2020","1:55","2020-07-24T01:55Z","HLGN21","DEN","UAS",NA,"FAR",NA,NA,NA,NA,NA,NA,NA,NA,NA,NA,NA,NA,NA,NA,NA,"RWY 18","FAR","RUNWAY"
"SWA1106 and JBU1712 observed a 3 foot wide brown and tan quad-copter UAS off the front while NW bound turning base to final at 2,000 feet 7.5 NE of BOS. Both flight crews reported the UAS was within 300 feet of their aircraft. A90 reports that they had to change from a RWY 22L operation to a RWY 33L operation with no effect to airport capacity. Massachusetts State Police were notified at and Revere Police were notified at. AWO/MR notified. ","['rwy22l', 'rwy33l']","[]","['WA11', 'BOS', 'AWO']","7/26/2020","19:20","2020-07-26T19:20Z","SWA1106","DEN","UAS",NA,"A90",NA,NA,NA,NA,NA,NA,NA,NA,NA,NA,NA,NA,NA,NA,NA,"RWY 22L","A90","RUNWAY"
"San Diego PD advised ATCT that a UAS was observed operating 1/2 W RWY 27 SAN. No visual sighting from SAN ATCT. ","['rwy27 ']","[]","['TCT', 'SAN', 'SAN', 'TCT']","8/16/2020","3:37","2020-08-16T03:37Z",NA,"DEN","UAS","MOR","SAN",NA,NA,NA,NA,NA,NA,NA,NA,NA,NA,NA,NA,NA,NA,NA,"RWY 27","SAN","RUNWAY"
"Airport Police observed a UAS on airport property S of RWY 26 while conducting rounds. Airport OPS later contacted the construction company doing work on the airport and discovered it was the construction supervisor. Supervisor was was unaware he could not fly the drone around airport grounds. No impact to OPS. ","['rwy26 ']","[]","[]","8/20/2020","7:13","2020-08-20T07:13Z",NA,"DEN","UAS",NA,"LBB",NA,NA,NA,NA,NA,NA,NA,NA,NA,NA,NA,NA,NA,NA,NA,"RWY 26","LBB","RUNWAY"
"Passenger observed a UAS off the left side while E bound at 2,000 feet over James Campbell HS on final for RWY 08L. No evasive action was taken. Honolulu PD notified at. ","['rwy08l']","[]","[]","9/12/2020","2:00","2020-09-12T02:00Z","AAL143","DEN","UAS",NA,"HCF",NA,NA,NA,NA,NA,NA,NA,NA,NA,NA,NA,NA,NA,NA,NA,"RWY 08L","HCF","RUNWAY"
"Tug driver advised ATCT of UAS over airport vicinity of SE Hangars. White/black UAS observed by ATCT 150 feet in the area, approach end RWY 21. Santa Monica Police notified. Police located operator, who then landed and retrieved the UAS.","['rwy21 ']","[]","['TCT', 'TCT']","9/28/2020","21:45","2020-09-28T21:45Z",NA,"DEN","UAS",NA,"SMO",NA,NA,NA,NA,NA,NA,NA,NA,NA,NA,NA,NA,NA,NA,NA,"RWY 21","SMO","RUNWAY"
"Multiple aircraft have observed a UAS while NE bound at 700 feet 3 NM final RWY 04. No evasive action was taken. Airport Sheriff Department notified at.","['rwy04 ']","['3 NM ']","[]","10/26/2020","15:55","2020-10-26T15:55Z","AAY969","DEN","UAS",NA,"PIE",NA,NA,NA,NA,NA,NA,NA,NA,NA,NA,NA,NA,NA,NA,NA,"RWY 04","PIE","RUNWAY"
"FCM ATCT observed a small orange and white UAS off the approach end of RWY 36. No impact to operations. Eden Prairie PD notified at and located UAS operator.","['rwy36 ']","[]","['FCM', 'TCT']","11/6/2020","15:15","2020-11-06T15:15Z",NA,"DEN","UAS","MOR","FCM",NA,NA,NA,NA,NA,NA,NA,NA,NA,NA,NA,NA,NA,NA,NA,"RWY 36","FCM","RUNWAY"
"DFW DPS observed a UAS E of the departure end of RWY 35R. LEO contacted UAS operator who is authorized to operate in the area under an approved CSA COA but had not followed notification protocols. No impact to operations. DFW DPS notified at.","['rwy35r']","[]","['DFW', 'DFW']","11/27/2020","19:15","2020-11-27T19:15Z",NA,"DEN","UAS",NA,"DFW",NA,NA,NA,NA,NA,NA,NA,NA,NA,NA,NA,NA,NA,NA,NA,"RWY 35R","DFW","RUNWAY"
"1730-1800: PIC observed a quad-copter UAS operating in the vcty of TWY B3, B4, B Hangars, and RWY 02. UAS then departed the airfield to the SW. ATCT was unable to locate the UAS, but switched operations to a right pattern for RWY 33 as a precaution. Wfield Police Department, and Air National Guard Security were advised and conducted a search with negative results. AWO/JH notified.","['rwy02 ', 'rwy33 ']","[]","['TCT', 'AWO']","12/26/2020","18:15","2020-12-26T18:15Z","N15538","DEN","UAS","NOTIFICATION-LATE","BAF",NA,NA,NA,NA,NA,NA,NA,NA,NA,NA,NA,NA,NA,NA,NA,"RWY 02","BAF","RUNWAY"
"PIC reported a UAS on taxiway D short of RWY 02, no impact to operations, Airport PD retrieved the UAS. AWO/WOC notified. ","['rwy02']","[]","['AWO']","1/10/2021","16:54","2021-01-10T16:54Z","CAP4512","DEN","UAS",NA,"PHF",NA,NA,NA,NA,NA,NA,NA,NA,NA,NA,NA,NA,NA,NA,NA,"RWY 02","PHF","RUNWAY"
"Airport Wildlife Officier observed a UAS off the approach end of RWY 31 and then exited the area ""over the Tech Center"". No aircraft were involved, no impact to ATC operations. ANG Security was notified at.","['rwy31 ']","[]","[]","1/11/2021","16:40","2021-01-11T16:40Z",NA,"DEN","UAS",NA,"ACY",NA,NA,NA,NA,NA,NA,NA,NA,NA,NA,NA,NA,NA,NA,NA,"RWY 31","ACY","RUNWAY"
"After N9331W landed RWY 36R the ASDE/ASSC triggered for a go around RWY 36R.  It was reported as a nuisance alert and reported to the CVG automation team.  Upon investigation, the team determined that the reason was a UAS on a UAT squawk code  that was directly behind the aircraft by 2946ft.  It is unknown if the pilot noticed a UAS. LEO notification not reported due to late report. ","['rwy36r', 'rwy36r']","[]","['ASD', 'SSC', 'CVG']","1/20/2021","16:22","2021-01-20T16:22Z","N9331W","DEN","UAS","MOR, NOTIFICATION-LATE","CVG",NA,NA,NA,NA,NA,NA,NA,NA,NA,NA,NA,NA,NA,NA,NA,"RWY 36R","CVG","RUNWAY"
"Aircraft observed 2 small UAS off the left side while NE bound at 2,300 feet, 5 NM final RWY 04. No evasive action was taken. Houston Police notified at.","['rwy04 ']","['5 NM ']","[]","3/23/2021","23:19","2021-03-23T23:19Z","ASH5749","DEN","UAS",NA,"HOU",NA,NA,NA,NA,NA,NA,NA,NA,NA,NA,NA,NA,NA,NA,NA,"RWY 04","HOU","RUNWAY"
"Tower observed a UAS off the approach end of RWY 12 about a half a NM at approximately 3,000. Lewiston PD notified at. ","['rwy12 ']","[]","[]","3/27/2021","17:45","2021-03-27T17:45Z",NA,"DEN","UAS",NA,"LWS",NA,NA,NA,NA,NA,NA,NA,NA,NA,NA,NA,NA,NA,NA,NA,"RWY 12","LWS","RUNWAY"
"OMA Airport PD observed a drone circling OMA Airport Rd. and RWY 14L during routine patrol. UAS was reported as palm sized by LEO and not observed by any aircraft or ATCT. No impact to air traffic. OMAHA PD notified at. AWO/TSOC notified.","['rwy14l']","[]","['OMA', 'OMA', '14L', 'TCT', 'OMA', 'AWO', 'TSO']","3/28/2021","19:20","2021-03-28T19:20Z",NA,"DEN","UAS",NA,"OMA",NA,NA,NA,NA,NA,NA,NA,NA,NA,NA,NA,NA,NA,NA,NA,"RWY 14L","OMA","RUNWAY"
"Aircraft observed 3 silver and round UAS while W bound at 1,700 feet on 3 NM final for RWY 28C. No evasive action was taken. Chicago PD notified at.","['rwy28c']","['3 NM ']","[]","4/5/2021","12:58","2021-04-05T12:58Z","AWI3806","DEN","UAS",NA,"ORD",NA,NA,NA,NA,NA,NA,NA,NA,NA,NA,NA,NA,NA,NA,NA,"RWY 28C","ORD","RUNWAY"
"Airport operations found a UAS on the AOA near the W end of RWY 24R/24L. No impact to operations, LAX had no knowledge. LEO confiscated UAS. ","['rwy24r']","[]","['24R', 'LAX']","5/12/2021","0:35","2021-05-12T00:35Z",NA,"DEN","UAS",NA,"TSOC",NA,NA,NA,NA,NA,NA,NA,NA,NA,NA,NA,NA,NA,NA,NA,"RWY 24R","TSOC","RUNWAY"
"ATCT observed a UAS off the N side of RWY 10 at approximately 300 feet operating E to W and W to E. No disruption to present airport operations. St Thomas PD and UVI Campus Security notified at. UVI Campus Security located the operator at the UVI soccer field and issued the operator a warning. AWO notified. ","['rwy10 ']","[]","['TCT', 'AWO']","5/17/2021","23:12","2021-05-17T23:12Z",NA,"DEN","UAS",NA,"STT",NA,NA,NA,NA,NA,NA,NA,NA,NA,NA,NA,NA,NA,NA,NA,"RWY 10","STT","RUNWAY"
"At approximately 1831, aircraft observed 4 silver colored UAS pass below while on 6 NM final to RWY 30L at SJC. No evasive action was taken. San Jose PD notified at. ","['rwy30l']","['6 NM ']","['SJC']","6/10/2021","18:59","2021-06-10T18:59Z","SWA116","DEN","UAS",NA,"SJC",NA,NA,NA,NA,NA,NA,NA,NA,NA,NA,NA,NA,NA,NA,NA,"RWY 30L","SJC","RUNWAY"
"1740 EDT / 2140 UTC 6/14/2021
Vista Jet (VJT796) /GLEX observed a UAS off the left side while Wbound at 1,000 feet on a 3 NM final to RWY 25L. Evasive action was taken with a 60 degree right turn. No impact to airport operations. LAPD 3 HELO dispatched to the area with negative results.","['rwy25l']","[]","['T79', 'GLE', 'ELO']","6/14/2021","21:31","2021-06-14T21:31Z",NA,"JATOC","UAS",NA,"LAX",NA,NA,NA,NA,NA,NA,NA,NA,NA,NA,NA,NA,NA,NA,NA,"RWY 25L","LAX","RUNWAY"
"1345 EDT / 1745 UTC 06/15/2021
Multiple aircraft observed a UAS off the approach end of RWY 15 at 1000', RWY 15 was closed to approaches. Operations continued using RWY 21. No evasive action was taken. LEO was notified.  ","['rwy15 ', 'rwy15 ', 'rwy21 ']","[]","[]","6/16/2021","16:45","2021-06-16T16:45Z",NA,"JATOC","UAS",NA,"CHS",NA,NA,NA,NA,NA,NA,NA,NA,NA,NA,NA,NA,NA,NA,NA,"RWY 15","CHS","RUNWAY"
"UAS observed from the ground operating at 100 feet within .5 NM of the approach end of RWY 31. The ATCT did not observe the UAS. N6375D was issued alternate instructions due to location of the UAS. LEO notified at.","['rwy31 ']","[]","['TCT', 'N63']","6/16/2021","17:31","2021-06-16T17:31Z","N6375D","DEN","UAS",NA,"MER",NA,NA,NA,NA,NA,NA,NA,NA,NA,NA,NA,NA,NA,NA,NA,"RWY 31","MER","RUNWAY"
"OKC advised that TIK AFB ATCT reported seeing a UAS 100 feet and 1 NM from the approach end of RWY 13 at TIK. Airport 1 aircraft was notified on frequency.","['rwy13 ']","['1 NM ']","['OKC', 'TIK', 'TCT', 'TIK']","6/19/2021","6:34","2021-06-19T06:34Z",NA,"DEN","UAS",NA,"OKC",NA,NA,NA,NA,NA,NA,NA,NA,NA,NA,NA,NA,NA,NA,NA,"RWY 13","OKC","RUNWAY"
"1950 EDT / 2350 UTC 6/20/2021
LN485AE requested transition from Albany, GA ATCT (ABY) to the Phoebe Hospital Helipad. The PIC reported having a close encounter with a drone and requested to divert to  ABY instead. The helicopter landed RWY 23. An ambulance picked up the patient at the airport Fixed Base Operator (FBO).","['rwy23 ']","[]","['N48', 'TCT', 'ABY', 'ABY']","6/20/2021","23:44","2021-06-20T23:44Z","LN485AE","JATOC","UAS",NA,"ABY",NA,NA,NA,NA,NA,NA,NA,NA,NA,NA,NA,NA,NA,NA,NA,"RWY 23","ABY","RUNWAY"
"Tulsa Airport Authority reported a UAS operating on the approach end of RWY 18L. No impact to airport operations. UAS operator identified and Tulsa Airport Police notified. ","['rwy18l']","[]","[]","6/23/2021","16:30","2021-06-23T16:30Z",NA,"DEN","UAS","MOR","TUL",NA,NA,NA,NA,NA,NA,NA,NA,NA,NA,NA,NA,NA,NA,NA,"RWY 18L","TUL","RUNWAY"
"1822 EDT / 2222 UTC 7/21/2021
N524DS/DA40 observed a UAS 100 feet ahead and 100 feet below while on a right base for RWY 34 at 2300 feet. N524DS deviated to the right to avoid UAS. LEO notified at 1715 EDT / 2115 UTC.","['rwy34 ']","[]","['N52', 'N52']","7/21/2021","22:14","2021-07-21T22:14Z","N524DS","JATOC","UAS",NA,"ROA",1828906047,"ROA","9:10","21:10","21-Jul-21","KROA","C","ROA098007",25,220,12,NA,NA,"N524DS WAS INBOUND TO ROA ENTERING A RIGHT BASE TO RUNWAY 34 WHEN THEY OBSERVED A LARGE 6 BLADED DRONE AT THEIR 12 O'CLOCK, 100 FEET AHEAD AND 100 FEET BELOW. THE A/C TOOK EVASIVE MANEUVER AND DEVIATED TO THE RIGHT.  THE A/C LANDED SAFELY. ","Facility summary, weather and falcon bookmark reviewed. N524DS was inbound to ROA from the east at 2,500ft when the pilot reported a drone passing underneath the aircraft. The pilot reported evasive maneuvers to the right to evade the object and estimated it was 100ft below the aircraft when spotted. Airport operations vehicle was sent to the east end of the airport to search for the object but was unable to see it. Other aircraft in the area were vectored to keep them clear of the reported location. N524DS landed safely and there was no further impact to operations at ROA. DEN, ROC and law enforcement were notified. Preliminary NMAC filed. ","RWY 34","ROA","RUNWAY"
"0627 INITIAL/CLOSEOUT: Aircraft observed 2 small yellow UASs while in the left traffic pattern for RWY 12L at 2,600 feet. UASs were operating at 3,000-4,000 feet. IWA ATCT moved Aircraft to RWY 12R in right closed traffic and was able to observe UAS operating in Nern portion of airspace. Mesa PD notified at. At 0645 all UAS activity exited airspace to the N.","['rwy12l', 'rwy12r']","[]","['IWA', 'TCT']","8/5/2021","6:43","2021-08-05T06:43Z","NDU752","DEN","UAS",NA,"IWA",9819795,"IWA","6:27","6:27","5-Aug-21","KIWA","D","IWA05001",26,300,3,NA,NA,"NDU752 WAS IN THE LEFT DOWNWIND FOR RWY 12L AND REPORTED A DRONE MANUEVERING NORTH-NORTHEAST OF THE AIRSPACE AT 3000 FEET. LOCAL CONTROL WAS ABLE TO INDENTIFY AN ADDITIONAL DRONE IN THE AIRSPACE TO THE NORTH THAT APPEARED AT 4000 FEET. NDU752 REPORTED TAKING NO EVASIVE ACTION AND COMPLETED THEIR APPROACH TO RWY 12L. LOCAL CONTROL CHANGED NDU752 TO THE RIGHT TRAFFIC PATTER FOR RWY 12R ON THE GO. BOTH DRONES APPEARED SMALL, WITH A STEADY YELLOW LIGHT, AND FLASHING RED AND GREEN LIGHTS. THE DRONES APPEARED TO ORBIT TO THE NORTH-NORTHEAST BEFORE DEPARTING THE AIRSPACE TO THE NORTH. ","QA reviewed.  ","RWY 12L","IWA","RUNWAY"
"Aircraft reported nearly colliding with a red colored drone with lights while at 1,100 feet on left downwind RWY 31. HQ DEN contacted PAO CIC who reports LEO was not notified and there have been no further UAS sightings. The CIC was advised of DEN UAS reporting requirements and recommended  requesting an updated UAS checklist from management. AWO notified. ","['rwy31 ']","[]","['DEN', 'PAO', 'CIC', 'CIC', 'DEN', 'AWO']","8/7/2021","21:55","2021-08-07T21:55Z","N879HZ","DEN","UAS","MOR, NOTIFICATION-NONE, SUSPICIOUS ACTIVITY","PAO",75401729,"PAO","9:55","21:55","7-Aug-21","KPAO","D","LEFT DOWNWIND RWY 31",11,130,NA,-122.12,37.45,"The pilot of N879HZ, a Cessna Skyhawk, reported he nearly collided with a drone in the Left Downwind of RWY 31 at approximately 012ft. He reported the drone to be red in color with lights headed possibly northwest bound. 

The LC announced to all aircraft the location and report of the drone. At this time of this, no other aircraft reported seeing the drone. N879HZ landed without issue and continued pattern work.","Reviewed MOR Summary and Falcon for a UAS report. UAS Lat Long position entered by QA is approximate based on either/or time/altitude event was reported by PAO tower. P Roberts  8/9/2021","RWY 31","PAO","RUNWAY"
"2110 EDT / 0110 UTC  8/26/2021
MASS State PD personnel observed a UAS on the RWY 15R final. Airport operations were then changed to RWY 27. Operator and UAS was secured at 2056 EDT / 0056 UTC. No further updates. 

2055 EDT / 0055 UTC  8/26/2021
BOS reported changing operations to RWY 27 due to a UAS in the vicinity of the airport. LEO found the operator and the UAS has been secured. Operations to remain on RWY 27 UFN.  Expect updates. ","['rwy15r', 'rwy27 ', 'rwy27 ', 'rwy27 ']","[]","['BOS']","8/26/2021","0:50","2021-08-26T00:50Z",NA,"JATOC","UAS",NA,"BOS",NA,NA,NA,NA,NA,NA,NA,NA,NA,NA,NA,NA,NA,NA,NA,"RWY 15R","BOS","RUNWAY"
