"REMARKS","dateonly","timeonly","DATE","CALLSIGN","POD","PRIMARYCODE","SECONDARYCODES","REPORTINGFACILITY","MORID.CEDAR","FACILITY.CEDAR","UTCTIME.CEDAR","UTCTIME24.CEDAR","CALENDARDATE.CEDAR","NEARESTAIRPORT.CEDAR","AIRSPACECLASS.CEDAR","ACLOCATION.CEDAR","ACALTITUDE.CEDAR","ACHEADING.CEDAR","RELATIVECLOCKPOSITION.CEDAR","UASLONG.CEDAR","UASLAT.CEDAR","SUMMARY.CEDAR","QAFINDINGS.CEDAR","RWYLOCATION","UASLOCATION","DATASET"
"Reported a red and white UAS passed helicopter at 2,400 FT over Lake Murray 5 E of MYF. No evasive action taken. LEO notification not reported. ","1/4/2018","8:31","2018-01-04T08:31Z","REH9","DEN","UAS",NA,"SAN",NA,NA,NA,NA,NA,NA,NA,NA,NA,NA,NA,NA,NA,NA,NA,NA,"SAN","EXCEPTION"
"Reported observing a UAS operating over downtown Tulsa. The UAS came within 1 NM of the aircraft. No evasive action taken. The incident was not reported to LEO. ","1/6/2018","9:13","2018-01-06T09:13Z","N31197","DEN","UAS",NA,"TUL",NA,NA,NA,NA,NA,NA,NA,NA,NA,NA,NA,NA,NA,NA,NA,NA,"TUL","EXCEPTION"
"UAS crashed in the vicinity of Harvard Coliseum.","1/8/2018","4:41","2018-01-08T04:41Z",NA,"DEN","UAS",NA,"WOC",NA,NA,NA,NA,NA,NA,NA,NA,NA,NA,NA,NA,NA,NA,NA,NA,"WOC","EXCEPTION"
"Reported a 4-rotor UAS 10 NW of FLL at 2,500 feet. No evasive action reported. LEO notified UNKN.","1/9/2018","21:09","2018-01-09T21:09Z","JBU1145","DEN","UAS",NA,"FLL",NA,NA,NA,NA,NA,NA,NA,NA,NA,NA,NA,NA,NA,NA,NA,NA,"FLL","EXCEPTION"
"Aircraft at 3,000 feet reported a red blinking UAS hovering at 2,500 feet. No evasive action taken. Lee County Sheriff notified at.","1/11/2018","6:44","2018-01-11T06:44Z","N361PE","DEN","UAS",NA,"RSW",NA,NA,NA,NA,NA,NA,NA,NA,NA,NA,NA,NA,NA,NA,NA,NA,"RSW","EXCEPTION"
"Reported a red and black UAS 1,000 feet below aircraft while at 9,000 feet NNW bound over HWO. No evasive action taken. Hollywood PD notified at.","1/12/2018","3:34","2018-01-12T03:34Z","RPA4603","DEN","UAS",NA,"MIA",NA,NA,NA,NA,NA,NA,NA,NA,NA,NA,NA,NA,NA,NA,NA,NA,"MIA","EXCEPTION"
"While on taxiway B awaiting departure, observed a UAS climb and immediately descend 300 feet N of the airport. Burbank Airport PD notified at.","1/14/2018","3:32","2018-01-14T03:32Z","EJA200","NCRCC","UAS",NA,"BUR",NA,NA,NA,NA,NA,NA,NA,NA,NA,NA,NA,NA,NA,NA,NA,NA,"BUR","EXCEPTION"
"Reported passing a red and white UAS while inbound to ATL. Altitude and location not reported. No evasive action taken. DeKalb County Sheriff notified at.","1/14/2018","3:39","2018-01-14T03:39Z","DAL2169","NCRCC","UAS",NA,"A80",NA,NA,NA,NA,NA,NA,NA,NA,NA,NA,NA,NA,NA,NA,NA,NA,"A80","EXCEPTION"
"While N bound at 1,200 feet, the PIC reported a white and blue fixed wing RC aircraft operating at 300 feet 2 N SAT. No evasive action reported. San Antonio PD notified at. ","1/14/2018","3:57","2018-01-14T03:57Z","TOUR1","NCRCC","UAS",NA,"SAT",NA,NA,NA,NA,NA,NA,NA,NA,NA,NA,NA,NA,NA,NA,NA,NA,"SAT","EXCEPTION"
"Reported a UAS at 9,500 feet hovering 2 W Arlington Municipal Airport. No evasive action taken. Arlington PD notified at.","1/14/2018","6:07","2018-01-14T06:07Z","N732CD","NCRCC","UAS",NA,"GKY",NA,NA,NA,NA,NA,NA,NA,NA,NA,NA,NA,NA,NA,NA,NA,NA,"GKY","EXCEPTION"
"Reported a UAS with a red light at thesame altitude while E bound at 500 feet 5 w of Santa Monica. Airport Police notified on frequency.","1/14/2018","7:40","2018-01-14T07:40Z","N112JJ","NCRCC","UAS",NA,"SMO",NA,NA,NA,NA,NA,NA,NA,NA,NA,NA,NA,NA,NA,NA,NA,NA,"SMO","EXCEPTION"
"Reported a UAS while NE bound at 4,500 feet 5 N Sacramento. No evasive action taken. Sacramento County Sheriff notified at.","1/16/2018","3:14","2018-01-16T03:14Z","N4905S","NCRCC","UAS",NA,"NCT",NA,NA,NA,NA,NA,NA,NA,NA,NA,NA,NA,NA,NA,NA,NA,NA,"NCT","EXCEPTION"
"USSS conducting UAS operations at the RTC until 1600L. 2207: Operations terminated.","1/19/2018","20:00","2018-01-19T20:00Z",NA,"NCRCC","UAS",NA,"USSS",NA,NA,NA,NA,NA,NA,NA,NA,NA,NA,NA,NA,NA,NA,NA,NA,"USSS","EXCEPTION"
"Aircraftreported a NM AC with a UAS at 500 feet while on a 1 NM final to Miami-Opa Locka Airport. Evasive action was not taken. LEO was not notified. ","1/20/2018","0:17","2018-01-20T00:17Z","N2604Z","DEN","UAS",NA,"MIA",NA,NA,NA,NA,NA,NA,NA,NA,NA,NA,NA,NA,NA,NA,NA,NA,"MIA","EXCEPTION"
"While inbound to the PNSS MOA observed an unidentified UAS at 11,000 feet 28W Pensacola Airport. No evasive action taken. LE notification unknown. ","1/20/2018","0:43","2018-01-20T00:43Z","TRIBE81","NCRCC","UAS",NA,"P31",NA,NA,NA,NA,NA,NA,NA,NA,NA,NA,NA,NA,NA,NA,NA,NA,"P31","EXCEPTION"
"Small UAS on the BWI185025, 7,500 feet, heading SW bound.No evasive action taken. Sighting was not in the FRZ. Notified Anne Arundel County Police at (410) 222-8610 ","1/21/2018","0:39","2018-01-21T00:39Z","SWA3876","NCRCC","UAS",NA,"NCRCC",NA,NA,NA,NA,NA,NA,NA,NA,NA,NA,NA,NA,NA,NA,NA,NA,"NCRCC","EXCEPTION"
"Reported a white circular 3 foot in diameter UAS at 2,000 feet 6 S PIE. Pilot turned right to avoid collision. Pinellas Aviation Unit notified AT.","1/21/2018","3:29","2018-01-21T03:29Z","N217EP","NCRCC","UAS",NA,"PIE",NA,NA,NA,NA,NA,NA,NA,NA,NA,NA,NA,NA,NA,NA,NA,NA,"PIE","EXCEPTION"
"A UAS passed beneath the aircraft while climbing to 1,500 feet in the vicinity of Fort Lauderdale. No evasive action taken. Unknown is LEO was notified. ","1/21/2018","3:30","2018-01-21T03:30Z","NKS664","DEN","UAS",NA,"FLL",NA,NA,NA,NA,NA,NA,NA,NA,NA,NA,NA,NA,NA,NA,NA,NA,"FLL","EXCEPTION"
"Reported a UAS passed 100 feet below the aircraft from the 3 o'clock position while W bound at 2,700 feet 5 W LGA (in the vicinity of the Freedom Tower). No evasive action reported. NT PD Aviation Unit notified at.","1/21/2018","4:05","2018-01-21T04:05Z","NY35","NCRCC","UAS",NA,"LGA",NA,NA,NA,NA,NA,NA,NA,NA,NA,NA,NA,NA,NA,NA,NA,NA,"LGA","EXCEPTION"
"Reported a white four rotor UAS operating between 150 and 200 feet. Aircraft was SSW bound at 600 feet 2 NE MSY. No evasive action taken. Jefferson Parish notified at.","1/21/2018","4:51","2018-01-21T04:51Z","NKS1987","NCRCC","UAS",NA,"MSY",NA,NA,NA,NA,NA,NA,NA,NA,NA,NA,NA,NA,NA,NA,NA,NA,"MSY","EXCEPTION"
"Reported a UAS 200 feet off the ground near the UVM Medical Center, 1 W Burlington Airport. No evasive action was taken, LE notification unknown.","1/21/2018","6:24","2018-01-21T06:24Z","GRY61","NCRCC","UAS",NA,"BTV",NA,NA,NA,NA,NA,NA,NA,NA,NA,NA,NA,NA,NA,NA,NA,NA,"BTV","EXCEPTION"
"Kings Bay reported possible P-50 Prohibited Areaviolation byUAS.HQ DEN conducted a playbackand no aircraft were observed in the vicinity.Kings Bay advised. ","1/22/2018","21:57","2018-01-22T21:57Z",NA,"DEN","TOI-PA","PAGED, TOI, UAS","HQ DEN",NA,NA,NA,NA,NA,NA,NA,NA,NA,NA,NA,NA,NA,NA,NA,NA,"HQ DEN","EXCEPTION"
"Reported a white quad copter UAS off the right sided at the same altitude of 1,400 feet 4 SSW of Oakland. No evasive action reported. Unknown if LE was notified. ","1/23/2018","4:55","2018-01-23T04:55Z","N380CS","NCRCC","UAS",NA,"OAK",NA,NA,NA,NA,NA,NA,NA,NA,NA,NA,NA,NA,NA,NA,NA,NA,"OAK","EXCEPTION"
"USCP conducting UAS operations at the US Capitol at orbelow 400 feet until 1800L. Operations completed at 2046, ACN.","1/24/2018","17:00","2018-01-24T17:00Z",NA,"NCRCC","NCR-COORDINATION","PAGED, UAS","USCP",NA,NA,NA,NA,NA,NA,NA,NA,NA,NA,NA,NA,NA,NA,NA,NA,"USCP","EXCEPTION"
"Observed a UAS off the right side while SW bound at 3,000 feet 9 ESE LGA. No evasive action taken. NYPD Aviation notified at.","1/25/2018","3:44","2018-01-25T03:44Z","RPA5972","NCRCC","UAS",NA,"N90",NA,NA,NA,NA,NA,NA,NA,NA,NA,NA,NA,NA,NA,NA,NA,NA,"N90","EXCEPTION"
"Reported a UAS 100 feet below aircraft off the left side while S bound in the vicinity of SBY. No evasive action taken. LEO notification not reported. ","1/25/2018","22:58","2018-01-25T22:58Z","EDV3661","DEN","UAS",NA,"WOC",NA,NA,NA,NA,NA,NA,NA,NA,NA,NA,NA,NA,NA,NA,NA,NA,"WOC","EXCEPTION"
"Reported a white quad-copter UAS at 1,800 feet 4 N DeKalb-Peachtree Airport. No evasive action taken. DeKalb PD notified at.","1/26/2018","0:05","2018-01-26T00:05Z","N20HX","NCRCC","UAS",NA,"A80",NA,NA,NA,NA,NA,NA,NA,NA,NA,NA,NA,NA,NA,NA,NA,NA,"A80","EXCEPTION"
"Reported a phantom UAS 200 feet below while E bound at 1,300 feet 7 W FLL. No evasive action taken. Broward County Sheriff notified at.","1/26/2018","0:40","2018-01-26T00:40Z","ROU1624","NCRCC","UAS",NA,"FLL",NA,NA,NA,NA,NA,NA,NA,NA,NA,NA,NA,NA,NA,NA,NA,NA,"FLL","EXCEPTION"
"Reported a black quad-copter while E bound at 9,500 feet, 500 feet to the right and hovering at the same altitude. No evasive action taken. W Virginia State PD Williamson Branch notified at.","1/26/2018","3:06","2018-01-26T03:06Z","N1595R","NCRCC","UAS",NA,"ZID",NA,NA,NA,NA,NA,NA,NA,NA,NA,NA,NA,NA,NA,NA,NA,NA,"ZID","EXCEPTION"
"A concerned citizen reported a UAS hovering 1 NM form the Cincinnati Municipal Airport. No reports were received from the ATCT or aircraft. Cincinnati PD notified (no number provided). ","1/26/2018","6:23","2018-01-26T06:23Z",NA,"NCRCC","UAS",NA,"LUK",NA,NA,NA,NA,NA,NA,NA,NA,NA,NA,NA,NA,NA,NA,NA,NA,"LUK","EXCEPTION"
"Reported a UAS operating in the vicinity of the Hollywood sign at the same altitude while maneuvering at 1,600 feet 5 S of BUR. No evasive actionreported. Burbank-Glendale-Pasadena PD Air Division notified on frequency. UAS was located and ground units were responding.","1/26/2018","6:26","2018-01-26T06:26Z","N893P","NCRCC","UAS",NA,"BUR",NA,NA,NA,NA,NA,NA,NA,NA,NA,NA,NA,NA,NA,NA,NA,NA,"BUR","EXCEPTION"
"Reported a small quad-copter UAS 200 feet above and off the right side of the aircraft. UAS was approximately 1 square foot in size with a white top and blue bottom. Aircraft was W bound at 5,000 feet 15 E of ORD. No evasive action taken. FBI notified at.","1/26/2018","22:58","2018-01-26T22:58Z","AWI3872","NCRCC","UAS",NA,"C90",NA,NA,NA,NA,NA,NA,NA,NA,NA,NA,NA,NA,NA,NA,NA,NA,"C90","EXCEPTION"
"While S bound at 7,000 feet, reported a 2X2 foot gray quad-copter pass directly over at 12 o'clock within 500 feet 13.5 NE of ABQ. No evasive action taken. New Mexico State Police notified at.","1/27/2018","2:39","2018-01-27T02:39Z","SKW5448","NCRCC","UAS",NA,"ABQ",NA,NA,NA,NA,NA,NA,NA,NA,NA,NA,NA,NA,NA,NA,NA,NA,"ABQ","EXCEPTION"
"Base personnelreported a black quad rotor UAS pass overhead at 100 feet No aircraft involved. Ventura County Sheriff notified at. ","1/28/2018","0:14","2018-01-28T00:14Z",NA,"DEN","UAS",NA,"NTD",NA,NA,NA,NA,NA,NA,NA,NA,NA,NA,NA,NA,NA,NA,NA,NA,"NTD","EXCEPTION"
"Kings Bay P50 reports possible violation of P50 by UAS traveling S to N. UAS not sighted visually. No tracks displayed on AADS. ","1/28/2018","2:30","2018-01-28T02:30Z",NA,"DEN","UAS",NA,"HQ DEN",NA,NA,NA,NA,NA,NA,NA,NA,NA,NA,NA,NA,NA,NA,NA,NA,"HQ DEN","EXCEPTION"
"While flying towards FTW, reported 2 RC aircraft in the vicinity of Interstate 820. Pilot stated that one RC was above and one RC was below the aircraft byapproximately 100 feet. No evasive action taken. LE not notified.","1/29/2018","3:04","2018-01-29T03:04Z","AIREVAC115","NCRCC","UAS",NA,"FTW",NA,NA,NA,NA,NA,NA,NA,NA,NA,NA,NA,NA,NA,NA,NA,NA,"FTW","EXCEPTION"
"Reported a UAS while E bound at 10,000 feet 17 W of Santa Monica. No evasive action taken. LAPD Air Support notified. ","1/29/2018","3:07","2018-01-29T03:07Z","QFA17","NCRCC","UAS",NA,"SMO",NA,NA,NA,NA,NA,NA,NA,NA,NA,NA,NA,NA,NA,NA,NA,NA,"SMO","EXCEPTION"
"Observed a UAS pass below at an unknown altitude. Type unknown. No evasive action taken. LEO not notified.","1/30/2018","7:35","2018-01-30T07:35Z","CBP SI14","DEN","UAS",NA,"OKC",NA,NA,NA,NA,NA,NA,NA,NA,NA,NA,NA,NA,NA,NA,NA,NA,"OKC","EXCEPTION"
"USSS reports seeing a UAS being flown around the Washington Monument.USSS is questioning the suspect. 0521: USSS states that UAS was being carried by person but not seen airborne. Since it was not seen in the air, USSS will not pursue action. NFA. 0602: USSS now says that Park Police did the interview after the suspect was stopped by USSS. ","2/5/2018","10:09","2018-02-05T10:09Z",NA,"NCRCC","UAS",NA,"USSS",NA,NA,NA,NA,NA,NA,NA,NA,NA,NA,NA,NA,NA,NA,NA,NA,"USSS","EXCEPTION"
"LFI reported an individual was flying a personal UAS on Langley AFB with no prior coordination. Security forces responded and took a statement from the individual. Individual was educated on the proper procedures for operating UASs on/near USAF installations/local airports. There was no conflict with local flying operations.","2/7/2018","21:37","2018-02-07T21:37Z",NA,"DEN","UAS",NA,"WOC",NA,NA,NA,NA,NA,NA,NA,NA,NA,NA,NA,NA,NA,NA,NA,NA,"WOC","EXCEPTION"
"PIC reported a blue UASin the vicinity of Memphis Stadium at 2,500 FT. No evasive action taken. LEOnotification not reported.  ","2/10/2018","1:42","2018-02-10T01:42Z","N9236H","DEN","UAS",NA,"MEM",NA,NA,NA,NA,NA,NA,NA,NA,NA,NA,NA,NA,NA,NA,NA,NA,"MEM","EXCEPTION"
"Aircraft reported 2 UAS while crossing the Napali Coast near Nuuolo. One UAS hit the belly of the helicopter. No significant damage reported. Kauai Police Department notified.","2/10/2018","7:30","2018-02-10T07:30Z","N11QM","DEN","UAS",NA,"LIH",NA,NA,NA,NA,NA,NA,NA,NA,NA,NA,NA,NA,NA,NA,NA,NA,"LIH","EXCEPTION"
"Reported a UAS over Century Link Field at approximately 1,000 feet. No evasive action reported. Unknown if LE notified.","2/12/2018","8:46","2018-02-12T08:46Z","N6043M","NCRCC","UAS",NA,"BFI",NA,NA,NA,NA,NA,NA,NA,NA,NA,NA,NA,NA,NA,NA,NA,NA,"BFI","EXCEPTION"
"Reported a UAS with a blue light on the bottom in the downwind at approximately 1,850 feet. PD 10 (LE Helo) was notified on frequency and searched the area without success.","2/12/2018","9:42","2018-02-12T09:42Z","N6959A","NCRCC","UAS",NA,"VNY",NA,NA,NA,NA,NA,NA,NA,NA,NA,NA,NA,NA,NA,NA,NA,NA,"VNY","EXCEPTION"
"DCA1: Black UAS reported by UAL1633 while on 7 NM final at 2,200'. UAS was right side, S bound,no evasive action taken. More information forthcoming. 2046: DCA supervisor confirmed with PIC that aircraft was at 2,500', turning base, and saw UAS at 2,200'. UAS was black and round. PG HELO notified at. DCA will do MOR. ","2/13/2018","1:23","2018-02-13T01:23Z","UAL1633","NCRCC","UAS","MOR","DCA",NA,NA,NA,NA,NA,NA,NA,NA,NA,NA,NA,NA,NA,NA,NA,NA,"DCA","EXCEPTION"
"Reported observing 3 UAS's off of the left wing at the same altitude. PIC applied right rudder when the UAS's were 10 to 15 feet off of the nose. Not known if LEO was notified. ","2/13/2018","2:44","2018-02-13T02:44Z","JIA5225","DEN","UAS",NA,"CLT",NA,NA,NA,NA,NA,NA,NA,NA,NA,NA,NA,NA,NA,NA,NA,NA,"CLT","EXCEPTION"
"Aircraft parked at the Atlantic FBO at BUR when the PIC reported a 3 rotor UAS orbiting at 1,200 feet over the Atlantic ramp and then was observed heading SE bound. Burbank-Glendale PD Aircraft (Police100, type unknown) was notified on frequency but was unable to locate the UAS. Burbank Airport Operations Center notified at.","2/14/2018","7:47","2018-02-14T07:47Z","N621JA","NCRCC","UAS",NA,"BUR",NA,NA,NA,NA,NA,NA,NA,NA,NA,NA,NA,NA,NA,NA,NA,NA,"BUR","EXCEPTION"
"Reported 2 UAS within 100 feet while NE bound along I-10 in Santa Monica. No evasive action reported. Santa Monica PD notified at. ","2/14/2018","8:10","2018-02-14T08:10Z","SHERIFF22","NCRCC","UAS",NA,"SCT",NA,NA,NA,NA,NA,NA,NA,NA,NA,NA,NA,NA,NA,NA,NA,NA,"SCT","EXCEPTION"
"Reported a blue and white UAS 60 feet off the right wing while E bound at 2,600 feet 3 SW of SDL. No evasive action reported. Unknown if LE notified.","2/14/2018","9:23","2018-02-14T09:23Z","N766A","NCRCC","UAS",NA,"SDL",NA,NA,NA,NA,NA,NA,NA,NA,NA,NA,NA,NA,NA,NA,NA,NA,"SDL","EXCEPTION"
"1756HELO departed CHS as VRTICL3. 1800HELOdeparted Class C airspace, ATC services were terminated, HELO squawked 1200. HELO continued VFR. 1836 HELO observed a UAS, took evasive action to avoid the UAS, struck a tree and crashed landed.2 POB, no injuries reported. HELO is on the Sern tip ofDaniel's Island (per AADS playback approximately CHS130008).PIC did not report seeing the UAS operator.ROC, FSDO, MR advised. 1934 CHS advised PIC reported no fire and they were walking out of the swamp. HQ DEN contacted Charleston Police to advise, HQ DEN provided last observed lat/long 032:49:16N/079:55:06W. 1942 WOC advised ROC reported UAS collided with the tail rotor of HELO. HQ DEN contacted US Coast Guard station Charleston, SC in vicinity of Daniel's Island. 1949 WOC advised ROC reported substantial damage to HELO.PIC reported UAS was white. 2012 USCG advises POBs were an instructor pilot and student pilot. 2104 WOC advised ROC reported HELO tail rotorhit tree, not UAS. 2257 CHS advised FSDO on scene. NTSB notified. ","2/15/2018","0:02","2018-02-15T00:02Z","N337H","DEN","UAS","MOR","CHS",NA,NA,NA,NA,NA,NA,NA,NA,NA,NA,NA,NA,NA,NA,NA,NA,"CHS","EXCEPTION"
"Reported a white UAS over the Santa Monica pier at 200 feet. No evasive action taken. LE notified but no number provided.","2/15/2018","9:08","2018-02-15T09:08Z","N112JJ","NCRCC","UAS",NA,"SMO",NA,NA,NA,NA,NA,NA,NA,NA,NA,NA,NA,NA,NA,NA,NA,NA,"SMO","EXCEPTION"
"DCA-1; 1848; Aircraft reported sighting a yellow drone at approximately the DCA290011 (2 W of Tyson's Corner)at 600 feet. Drone was Wbound. 1856; BKJK Scrambled. 1901; BKJK Airborne. FFX1 investigating. 1902; BKJK RTB.2002;FFX1 advised DCA drone was 2 1/2 feet in diameter with 4 rotors. Drone was 100 feet from aircraft, no evasive action taken. FFX1 had no further sightings. DCA filed MOR. NFA.","2/15/2018","23:58","2018-02-15T23:58Z","FFX1","NCRCC","UAS","MOR","DCA",NA,NA,NA,NA,NA,NA,NA,NA,NA,NA,NA,NA,NA,NA,NA,NA,"DCA","EXCEPTION"
"Aircraft observed what appeared to be a UAS off their right side over Bachman Lakewhile on short final at DAL. No evasive action taken. LEO notification not reported. ","2/16/2018","6:53","2018-02-16T06:53Z","GPD27","DEN","UAS",NA,"DAL",NA,NA,NA,NA,NA,NA,NA,NA,NA,NA,NA,NA,NA,NA,NA,NA,"DAL","EXCEPTION"
"Aircraft Observed a white quadcopter UAS at 2,400 feet 1 S of FFZ. No evasive action taken. Mesa PD notified at. ","2/17/2018","4:53","2018-02-17T04:53Z","OXF275","DEN","UAS",NA,"FFZ",NA,NA,NA,NA,NA,NA,NA,NA,NA,NA,NA,NA,NA,NA,NA,NA,"FFZ","EXCEPTION"
"Reported a UAS while at 3,500 feet W bound 8 E ATL. UAS size / color not reported. UAS passed within 500 feet of the aircraft. Evasive action not reported. Clayton County Sheriff notified at.","2/18/2018","1:37","2018-02-18T01:37Z","EDV3433","NCRCC","UAS",NA,"A80",NA,NA,NA,NA,NA,NA,NA,NA,NA,NA,NA,NA,NA,NA,NA,NA,"A80","EXCEPTION"
"Reported a small yellow UAS 700 feet below aircraft whileW bound at 1,700 feet 7 W of Wilmington. Pilot reportedly made a right turn to avoid the UAS. New Castle PD notified at. Information received by the WOCfrom a DRAthrough the ROC. ","2/18/2018","1:48","2018-02-18T01:48Z","CAP779","NCRCC","UAS","PAGED","ILG",NA,NA,NA,NA,NA,NA,NA,NA,NA,NA,NA,NA,NA,NA,NA,NA,"ILG","EXCEPTION"
"Reported a red UAS onthe left side 200 feet above the aircraft while WNW bound at 6,000 feet 18 E of HOU. No evasive action taken. FBI notified at.","2/18/2018","3:06","2018-02-18T03:06Z","SWA4136","NCRCC","UAS",NA,"I90",NA,NA,NA,NA,NA,NA,NA,NA,NA,NA,NA,NA,NA,NA,NA,NA,"I90","EXCEPTION"
"Reported a UAS 50 feet from the aircraft while at 1,700 feet in the vicinity of Cheviot Hills. Pilot took evasive action. Airport PD and local LE notified. No further information provided. Information received by the WOCfrom a DRAthrough the ROC. ","2/18/2018","4:13","2018-02-18T04:13Z","N2092L","NCRCC","UAS","PAGED","SMO",NA,NA,NA,NA,NA,NA,NA,NA,NA,NA,NA,NA,NA,NA,NA,NA,"SMO","EXCEPTION"
"Reported an 8 -12 inch red quad-copter UAS 100 feet below and off the right side while NE bound at 5,000 feet in the vicinity of Burnett, TX. No evasive action taken. Burnett County Sheriff notified at. ","2/18/2018","6:27","2018-02-18T06:27Z","N118SV","NCRCC","UAS",NA,"AUS",NA,NA,NA,NA,NA,NA,NA,NA,NA,NA,NA,NA,NA,NA,NA,NA,"AUS","EXCEPTION"
"While orbiting at 400 feet 3 SE Miami Executive Airport when a UAS began to follow the aircraft. No evasive action reported. MP6 followed the UAS and dispatched ground units to attempt to locate the UAS operator.","2/18/2018","7:23","2018-02-18T07:23Z","MP6","NCRCC","UAS",NA,"TMB",NA,NA,NA,NA,NA,NA,NA,NA,NA,NA,NA,NA,NA,NA,NA,NA,"TMB","EXCEPTION"
"Reported a black and orange UAS approximately the size of a basketball off the right side 800 feet laterally and at the same altitudewhile N bound at 7,000 feet 15 W of BCT. No evasive action reported. Palm Beach Sheriff's Office notified at.","2/19/2018","1:42","2018-02-19T01:42Z","N9461N","NCRCC","UAS",NA,"PBI",NA,NA,NA,NA,NA,NA,NA,NA,NA,NA,NA,NA,NA,NA,NA,NA,"PBI","EXCEPTION"
"Reported a UAS while NW bound at 3,000 feet 16 NW of Ft. Myers. UAS size and color not reported. UAS passed within 200 feet underneath the aircraft. No evasive action reported. Lee County Sheriff notified at.","2/19/2018","2:52","2018-02-19T02:52Z","N8747X","NCRCC","UAS",NA,"RSW",NA,NA,NA,NA,NA,NA,NA,NA,NA,NA,NA,NA,NA,NA,NA,NA,"RSW","EXCEPTION"
"A passenger reported to the captain as he was exiting the Aircraft that he spotted a UAS about 1 minute prior to landing. Pilot estimated the UAS's altitude to be approximately 300 feet. Atlanta PD Air One notified. ","2/19/2018","4:41","2018-02-19T04:41Z","DAL981","DEN","UAS",NA,"A80",NA,NA,NA,NA,NA,NA,NA,NA,NA,NA,NA,NA,NA,NA,NA,NA,"A80","EXCEPTION"
"Reported a black and orange UAS at 2,000 feet 4 NW of Miami-Opa Locka Executive airport. No evasive action taken. LE not notified due to controller workload. ","2/21/2018","2:14","2018-02-21T02:14Z","N168BF","NCRCC","UAS",NA,"MIA",NA,NA,NA,NA,NA,NA,NA,NA,NA,NA,NA,NA,NA,NA,NA,NA,"MIA","EXCEPTION"
"Reported a black-quad copter UAS 100 feet below while S bound at 1,500 in the vicinity of W 30th Street Heliport. No evasive action taken. NYPD Aviation Unit notified at.","2/21/2018","4:11","2018-02-21T04:11Z","N431HF","NCRCC","UAS",NA,"EWR",NA,NA,NA,NA,NA,NA,NA,NA,NA,NA,NA,NA,NA,NA,NA,NA,"EWR","EXCEPTION"
"1938; Reported a News Media drone at350 feet, at the intersection Chads Ford Dr and Chadsey Ln,Brandywine, MD. Location within SFRA. PG County PD on the scene. 2141; No further reports. ","2/22/2018","2:26","2018-02-22T02:26Z","PG2","NCRCC","UAS",NA,"CBP",NA,NA,NA,NA,NA,NA,NA,NA,NA,NA,NA,NA,NA,NA,NA,NA,"CBP","EXCEPTION"
"Perry Nuclear Power Plant personnel observed a UAS operating in the vicinity of the Nuclear Facility. No specifics as to color, type, operating height could be provided. Cleveland ATCT personnel contacted the Lake County Sheriff's Department at for notification. ","3/4/2018","12:53","2018-03-04T12:53Z",NA,"DEN","UAS",NA,"CLE",NA,NA,NA,NA,NA,NA,NA,NA,NA,NA,NA,NA,NA,NA,NA,NA,"CLE","EXCEPTION"
"UAS: Pilot reported a red UAS at altitude 5,500 feet off the DCA180028. No evasive action reported. Time of sighting was 1541. Charles County Police are being notified at. 1550: PCT reports the Charles county PD POC is Ms. Garmin, badge 1802. ","3/4/2018","20:46","2018-03-04T20:46Z","UAL1067","NCRCC","TOI-NCR SFRA","PAGED, TOI, UAS","PCT",NA,NA,NA,NA,NA,NA,NA,NA,NA,NA,NA,NA,NA,NA,NA,NA,"PCT","EXCEPTION"
"DCAATCT called to verify ifMr. Bill Muirhead is allowed to fly a UAS W of DCA. NCRCC has no record of coordination from Mr. Muirhead. TSA NCRCC reports no waivers are on file citing that name and no 24 hour coordination email was received. DCA ATCT is denying this operation. ","3/5/2018","18:25","2018-03-05T18:25Z",NA,"NCRCC","UAS",NA,"DCA",NA,NA,NA,NA,NA,NA,NA,NA,NA,NA,NA,NA,NA,NA,NA,NA,"DCA","EXCEPTION"
"UAS operations coordinated outside of SFRA, 1900-0100Z. ","3/7/2018","0:01","2018-03-07T00:01Z",NA,"NCRCC","UAS",NA,"NCRCC",NA,NA,NA,NA,NA,NA,NA,NA,NA,NA,NA,NA,NA,NA,NA,NA,"NCRCC","EXCEPTION"
"Reported a small 1.5 FT white UAS while 5 N BOS at 5,500 FT. The UAS was 500 FT below A/C. No evasive action taken. Massachusetts State PD notified. ","3/11/2018","3:27","2018-03-11T03:27Z","SKV7674","DEN","UAS",NA,"BOS",NA,NA,NA,NA,NA,NA,NA,NA,NA,NA,NA,NA,NA,NA,NA,NA,"BOS","EXCEPTION"
"Aircraft reported passing 300 feet from aUAS while on approach to PIE. No evasive action reported. Unknown LEO notification.","3/12/2018","2:56","2018-03-12T02:56Z","N403PK","DEN","UAS",NA,"PIE",NA,NA,NA,NA,NA,NA,NA,NA,NA,NA,NA,NA,NA,NA,NA,NA,"PIE","EXCEPTION"
"Aircraft reported NM AC with 2 small UAS at 16,000 feet, FL200 and FL220 while maneuvering in the Bulldog MOA in the vicinity of Louisville, GA. Pilot reported UAS and aircraft merged on the aircraft's radar display. Aircraft terminated operations in the MOA to avoid further conflict. Specific evasive action not reported. UNKN if LEO was notified. ","3/20/2018","23:38","2018-03-20T23:38Z","JOKER01","DEN","UAS",NA,"ZTL",NA,NA,NA,NA,NA,NA,NA,NA,NA,NA,NA,NA,NA,NA,NA,NA,"ZTL","EXCEPTION"
"PIC reported taking evasive action to avoid a UAS by .25 NM. Altitude, location and description of UAS not provided. Columbia County Sheriff notified. ROC had no additional INFO.","3/21/2018","10:21","2018-03-21T10:21Z","N24266","DEN","UAS",NA,"ZSE",NA,NA,NA,NA,NA,NA,NA,NA,NA,NA,NA,NA,NA,NA,NA,NA,"ZSE","EXCEPTION"
"Reported observing a silver UAS at 1,000 feet in the vicinity of Myrtle Beach Resort. No evasive action taken. Horry County Sheriff notified at.","3/24/2018","0:47","2018-03-24T00:47Z","MYRTLE6","DEN","UAS",NA,"MYR",NA,NA,NA,NA,NA,NA,NA,NA,NA,NA,NA,NA,NA,NA,NA,NA,"MYR","EXCEPTION"
"Aircraft on short final landing HWY at 1000 feetobserved an UAS, dark in color, approximately 3-6 feet, approximately 1200 feet, no evasive action taken. Fauquier County Sheriff notified at. PCT filed aMOR.","3/25/2018","22:00","2018-03-25T22:00Z","FLC71","NCRCC","UAS",NA,"PCT",NA,NA,NA,NA,NA,NA,NA,NA,NA,NA,NA,NA,NA,NA,NA,NA,"PCT","EXCEPTION"
"UAS operations at Walter Reed/Bethesda Hospital, 1230-1430pm. ","3/27/2018","20:29","2018-03-27T20:29Z",NA,"NCRCC","UAS",NA,"SW1",NA,NA,NA,NA,NA,NA,NA,NA,NA,NA,NA,NA,NA,NA,NA,NA,"SW1","EXCEPTION"
"Reported a UAS along the freeway at 2,000 feet while E bound 3.9 E of HNL. 911 notified. No further information provided.","3/28/2018","5:48","2018-03-28T05:48Z","MHO08","DEN","UAS",NA,"HNL",NA,NA,NA,NA,NA,NA,NA,NA,NA,NA,NA,NA,NA,NA,NA,NA,"HNL","EXCEPTION"
"Reported a UAS while E bound at 1,700 feet 1,5 E of El Monte. UNKN if evasive action was taken. El Monte PD was notified at.","3/30/2018","4:39","2018-03-30T04:39Z","N819CE","DEN","UAS",NA,"EMT",NA,NA,NA,NA,NA,NA,NA,NA,NA,NA,NA,NA,NA,NA,NA,NA,"EMT","EXCEPTION"
"DCA-1: White House at condition Yellow. Reports of possible drone. USSS investigating. 1702: USSS confirms UAS was airborne over The Ellipse, described as a sharper imagewhite quad copter 1703: Operators apprehended. 1707: WH at condition Green. DCA file MOR. 1940: USSS update: USPPwasthe agency that responded to the Ellipse, cited two Caucasian 17 year old deaf children with their parents. Theydid not confiscate UAS and released individuals. Names of the individuals were not released due to age. Parents names are Jamie Annette Miner and Beth Smith.. USPP citation number: CFR100586. ","3/31/2018","21:59","2018-03-31T21:59Z",NA,"NCRCC","TOI-PA-P-56A","MOR, PAGED, TOI, TOI-PA, UAS","USSS",NA,NA,NA,NA,NA,NA,NA,NA,NA,NA,NA,NA,NA,NA,NA,NA,"USSS","EXCEPTION"
"Reported having a UAS pass 100 feet overhead while descending to land at Deaconess Gateway Hospital. No evasive action taken. Warrick County Sheriff notified at. ","4/1/2018","20:55","2018-04-01T20:55Z","EVAC46","DEN","UAS",NA,"EVV",NA,NA,NA,NA,NA,NA,NA,NA,NA,NA,NA,NA,NA,NA,NA,NA,"EVV","EXCEPTION"
"PIC reported a black 2-foot wide UAS quad-copter off left side while E bound at 1,000 feet. No evasive action taken. Broward County Sheriff notified at. ","4/2/2018","21:01","2018-04-02T21:01Z","N347D","DEN","UAS",NA,"FXE",NA,NA,NA,NA,NA,NA,NA,NA,NA,NA,NA,NA,NA,NA,NA,NA,"FXE","EXCEPTION"
"Reported observing a dark brown/black UAS quad-copter 1.5 feet diameter left of Taxiway J4 at 10 feet AGL. No evasive action taken. Not reported to LEO. ","4/7/2018","2:00","2018-04-07T02:00Z","N564K","DEN","UAS",NA,"RDU",NA,NA,NA,NA,NA,NA,NA,NA,NA,NA,NA,NA,NA,NA,NA,NA,"RDU","EXCEPTION"
"Reported observing a white UAS with green lights operating at 10,000 feet E of LAX. No evasive action reported. LAPD Air Support notified at. ","4/8/2018","1:58","2018-04-08T01:58Z","SGF6918","DEN","UAS",NA,"SCT",NA,NA,NA,NA,NA,NA,NA,NA,NA,NA,NA,NA,NA,NA,NA,NA,"SCT","EXCEPTION"
"FBI advised BOS ATCT of an unidentified UAS hovering of the pitcher's mound at Fenway Park during a game. Altitude and description unreported. LEO responding. ","4/8/2018","23:00","2018-04-08T23:00Z",NA,"DEN","UAS",NA,"FBI",NA,NA,NA,NA,NA,NA,NA,NA,NA,NA,NA,NA,NA,NA,NA,NA,"FBI","EXCEPTION"
"Reported a UAS pass under left side at 1,200 feet on final to BFI. Evasive action not reported. LEO notification not reported. ","4/10/2018","7:28","2018-04-10T07:28Z","LXA19T","DEN","UAS",NA,"SEA",NA,NA,NA,NA,NA,NA,NA,NA,NA,NA,NA,NA,NA,NA,NA,NA,"SEA","EXCEPTION"
"Naval Station Great Lakes advised personnel observed a UAS at UNKN altitude along the shores of SW lake Michigan, E of the Naval Station. Security was dispatched, but unable tolocate the UAS or operator. Naval Station Great Lakes station phone ext. 250. ","4/11/2018","23:35","2018-04-11T23:35Z",NA,"DEN","UAS",NA,"WOC",NA,NA,NA,NA,NA,NA,NA,NA,NA,NA,NA,NA,NA,NA,NA,NA,"WOC","EXCEPTION"
"PIC reported a UAS at 600 feet within a 5 NM radius of 3GA3. No evasive action taken. LEO notification not reported. Reported to HQ DEN on 4/16/18.","4/16/2018","19:09","2018-04-16T19:09Z","N813MW","DEN","UAS","NOTIFICATION-LATE","ROC",NA,NA,NA,NA,NA,NA,NA,NA,NA,NA,NA,NA,NA,NA,NA,NA,"ROC","EXCEPTION"
"ADW ATCT called and reported that ADW police were contacted by a Mr. David Hicks. Mr. Hicks reported that he lost a UAS he was flying at 800 feet in Temple Hills, MD. No other amplifying details were provided.","4/17/2018","19:49","2018-04-17T19:49Z",NA,"NCRCC","UAS","PAGED","ADW",NA,NA,NA,NA,NA,NA,NA,NA,NA,NA,NA,NA,NA,NA,NA,NA,"ADW","EXCEPTION"
"Walter Reed Medical Center is flying UASs from 1330L to 1530L. ","4/17/2018","19:54","2018-04-17T19:54Z",NA,"NCRCC","UAS",NA,"TSOC",NA,NA,NA,NA,NA,NA,NA,NA,NA,NA,NA,NA,NA,NA,NA,NA,"TSOC","EXCEPTION"
"Giant Killerreported aircraft observing a UAS in W72A at coordinates 3552N/07514W. Altitude information not given. ROMAN35 will be briefing on the exact specifics when they get on deck. ","4/18/2018","3:52","2018-04-18T03:52Z","ROMAN35","DEN","UAS",NA,"HQ DEN",NA,NA,NA,NA,NA,NA,NA,NA,NA,NA,NA,NA,NA,NA,NA,NA,"HQ DEN","EXCEPTION"
"Plant security was advised by a concerned citizen of a UAS maneuvering over Comanche Peak Nuclear power plant in the vicinity of Glen Rose. Aircraft operations not impacted. Somervell Co Sheriff notified. ","4/19/2018","19:24","2018-04-19T19:24Z",NA,"DEN","UAS",NA,"WOC",NA,NA,NA,NA,NA,NA,NA,NA,NA,NA,NA,NA,NA,NA,NA,NA,"WOC","EXCEPTION"
"Reported observing a UASA opposite direction and just below while at 6,000 feet in the area of Chattanooga. No evasive action taken. Lookout Mountain PD notified at. ","4/21/2018","1:26","2018-04-21T01:26Z","N144EZ","DEN","UAS",NA,"CHA",NA,NA,NA,NA,NA,NA,NA,NA,NA,NA,NA,NA,NA,NA,NA,NA,"CHA","EXCEPTION"
"UAS activity around P56A, on WH grounds,until 1000z. ","4/21/2018","8:00","2018-04-21T08:00Z",NA,"NCRCC","UAS",NA,"USSS",NA,NA,NA,NA,NA,NA,NA,NA,NA,NA,NA,NA,NA,NA,NA,NA,"USSS","EXCEPTION"
"PIC reported a UAS, black, 2-3 feet in diameter,at the DCA267026, 3,500 feet (same altitude as aircraft), 300-500 yards off the wing,Ebound. No evasive action reported. Fauquier County Sheriff notified at, cruiser dispatched. 2228 CLOSEOUT: Followed up with Fauquier County Sheriff - dispatched Officer did not report any findings. NFA.","4/22/2018","1:48","2018-04-22T01:48Z","SWA4402","NCRCC","UAS","PAGED","PCT",NA,NA,NA,NA,NA,NA,NA,NA,NA,NA,NA,NA,NA,NA,NA,NA,"PCT","EXCEPTION"
"HELO observed a black, 8 inch in length, 4 rotor UAS while S bound at 200 feet in the vicinity of SMO. No evasive action was taken. Santa Monica PD relayed information to Los Angeles PD.","4/22/2018","4:12","2018-04-22T04:12Z","N443SA","DEN","UAS",NA,"SCT",NA,NA,NA,NA,NA,NA,NA,NA,NA,NA,NA,NA,NA,NA,NA,NA,"SCT","EXCEPTION"
"PIC reported a yellow quad-copter UAS above while orbiting at 1,500 feet VCNTY LGA. No evasive action taken. NYPD Aviation Unit notified at.","4/24/2018","3:58","2018-04-24T03:58Z","N355MH","DEN","UAS",NA,"LGA",NA,NA,NA,NA,NA,NA,NA,NA,NA,NA,NA,NA,NA,NA,NA,NA,"LGA","EXCEPTION"
"USCP conducting UAS operationswithin the USCapitol Exclusion Zone until approximately 1400L. 1428 UAS operations concluded.","4/24/2018","14:15","2018-04-24T14:15Z",NA,"NCRCC","UAS","PAGED","USCP",NA,NA,NA,NA,NA,NA,NA,NA,NA,NA,NA,NA,NA,NA,NA,NA,"USCP","EXCEPTION"
"UAS operations DCA271012. Operations terminated at 1620z.","4/26/2018","21:20","2018-04-26T21:20Z",NA,"NCRCC","UAS",NA,"SW1",NA,NA,NA,NA,NA,NA,NA,NA,NA,NA,NA,NA,NA,NA,NA,NA,"SW1","EXCEPTION"
"PIC reported a small black UAS passed 500 feet below Aircraft at 4,000 feet. No other location details provided.No evasive action taken. FBI notified at.","4/27/2018","5:16","2018-04-27T05:16Z","LOF4744","DEN","UAS",NA,"ORD",NA,NA,NA,NA,NA,NA,NA,NA,NA,NA,NA,NA,NA,NA,NA,NA,"ORD","EXCEPTION"
"A UAS was observed flying acrobatics over the crowd assembling for the CHS Air Show. CHS ATCTnotified Air Force Security through Base OPS at. Base OPS investigated, CHS ATCT does not know if the subject was located but the UAS activity has ceased.HQ DEN briefed CHS ATCT of the requirement to notified the DEN of any unauthorized UAS activity. ","4/28/2018","21:50","2018-04-28T21:50Z",NA,"DEN","UAS","PAGED","CHS",NA,NA,NA,NA,NA,NA,NA,NA,NA,NA,NA,NA,NA,NA,NA,NA,"CHS","EXCEPTION"
"Reported a UAS off the right side of aircraft at 2,000 feet of base leg inbound to SFB. No evasive action taken. Sanford PD notified at. ","4/29/2018","6:36","2018-04-29T06:36Z","BKA759","DEN","UAS",NA,"F11",NA,NA,NA,NA,NA,NA,NA,NA,NA,NA,NA,NA,NA,NA,NA,NA,"F11","EXCEPTION"
"VACAPES reported SaltyDog25 reported a UAS 500 feet above aircraft while climbing from 16,500 feet, 16 SSE of SWL. No evasive action taken. LEO was not notified. ","4/30/2018","23:02","2018-04-30T23:02Z","SDT25","DEN","UAS",NA,"NTU",NA,NA,NA,NA,NA,NA,NA,NA,NA,NA,NA,NA,NA,NA,NA,NA,"NTU","EXCEPTION"
"Received notification from EADS, who received a report from the Baltimore NOSCthat a drone, being flown by a civilian over the base hit a power line and crashed on the base. The drone operator/owneris outside the fence asking for his drone back. The location of this event is outside the SFRA. NCRCC attempted to contact BWI FSDO, no answer, no voice mail. Baltimore PD on scene and will forward a copy of their report to EADS. No description of the drone provided. SH notified. NFA. ","5/1/2018","2:37","2018-05-01T02:37Z",NA,"NCRCC","UAS","PAGED","NCRCC",NA,NA,NA,NA,NA,NA,NA,NA,NA,NA,NA,NA,NA,NA,NA,NA,"NCRCC","EXCEPTION"
"ATCT reported UAS landed or crashed in front of aircraft while on ramp. No damage to aircraft or airport property. Connecticut State PD notified at.","5/2/2018","2:45","2018-05-02T02:45Z",NA,"DEN","UAS",NA,"OXC",NA,NA,NA,NA,NA,NA,NA,NA,NA,NA,NA,NA,NA,NA,NA,NA,"OXC","EXCEPTION"
"DCA-3: //LATE NOTIFICATION//At 0000,DCA330010, RPA4659, E75,passed a grayish coloreddrone, on the right side of aircraft at 3000 feet, no evasive action taken.The PIC reported the incident to DCA ATCT at 0055.Montgomery Police Department notified. MOR filed. ","5/2/2018","5:55","2018-05-02T05:55Z","RPA4659","NCRCC","UAS","NOTIFICATION-LATE","DCA",NA,NA,NA,NA,NA,NA,NA,NA,NA,NA,NA,NA,NA,NA,NA,NA,"DCA","EXCEPTION"
"Commercial UAS activity at Rippon Landing Park in Woodbridge, VA. NYG021006 until 1300Z. POC: Matt Dufilho","5/2/2018","16:55","2018-05-02T16:55Z",NA,"NCRCC","UAS",NA,"NCRCC",NA,NA,NA,NA,NA,NA,NA,NA,NA,NA,NA,NA,NA,NA,NA,NA,"NCRCC","EXCEPTION"
"Reported sighting a grey UAS heading Ebound at 5,000 feet, while Wbound at 5,000 feet over CMK. No evasive action taken. Connecticut State PD notified at. ","5/2/2018","19:10","2018-05-02T19:10Z","WIG536","DEN","UAS","PAGED","N90",NA,NA,NA,NA,NA,NA,NA,NA,NA,NA,NA,NA,NA,NA,NA,NA,"N90","EXCEPTION"
"Reported sighting at UAS operating at 2,500 feet while on a 6 NM final over HDF. No evasive action taken. Riverside County Sheriff notified at. ","5/3/2018","22:34","2018-05-03T22:34Z","BAJA42","DEN","UAS",NA,"RIV",NA,NA,NA,NA,NA,NA,NA,NA,NA,NA,NA,NA,NA,NA,NA,NA,"RIV","EXCEPTION"
"FRZ UAS: DCA265010, UAS operations, until 1315L. 1357: UAS operations terminated.","5/4/2018","17:15","2018-05-04T17:15Z",NA,"NCRCC","UAS","PAGED","SW1",NA,NA,NA,NA,NA,NA,NA,NA,NA,NA,NA,NA,NA,NA,NA,NA,"SW1","EXCEPTION"
"Reported sighting a black and white UAS operating at 7,000 feet, 300 feet off of the right side. No evasive action taken. Lee County Sheriff notified at. ","5/5/2018","19:55","2018-05-05T19:55Z","N2451Q","DEN","UAS",NA,"RSW",NA,NA,NA,NA,NA,NA,NA,NA,NA,NA,NA,NA,NA,NA,NA,NA,"RSW","EXCEPTION"
"Aircraftreported a small white rotorcraft UAS, the size of a dinner plate, at3 o'clock position while N bound,over Governor's Island, along the Hudson River at 2,000 feet. No evasive action required. NY PDAviation Unit notified at.","5/6/2018","3:13","2018-05-06T03:13Z","N207MH","DEN","UAS",NA,"EWR",NA,NA,NA,NA,NA,NA,NA,NA,NA,NA,NA,NA,NA,NA,NA,NA,"EWR","EXCEPTION"
"Reported a UAS while SSE bound at 2,500 feet at the MEM040010. UAS was at 1,500 feet 1 NM behind aircraft. No evasive action taken. LEO not notified. ","5/7/2018","21:39","2018-05-07T21:39Z","N5450W","DEN","UAS",NA,"ZME",NA,NA,NA,NA,NA,NA,NA,NA,NA,NA,NA,NA,NA,NA,NA,NA,"ZME","EXCEPTION"
"Reported 2 UAS, one fixed wing and one rotorcraft, 300 feet below aircraft while E bound at 4,000 feet in the vicinity of ORD. No evasive action taken. FBI notified at.","5/7/2018","22:07","2018-05-07T22:07Z","ENY3326","DEN","UAS",NA,"ORD",NA,NA,NA,NA,NA,NA,NA,NA,NA,NA,NA,NA,NA,NA,NA,NA,"ORD","EXCEPTION"
"Reported a UAS 100 feet below aircraft while NE bound at 7,000 feet at the MEI093017. No evasive action taken. LEO not notified. ","5/7/2018","22:20","2018-05-07T22:20Z","N1809U","DEN","UAS",NA,"MEI",NA,NA,NA,NA,NA,NA,NA,NA,NA,NA,NA,NA,NA,NA,NA,NA,"MEI","EXCEPTION"
"USSS UAS activity in Beltsville Maryland begins. 1515: UAS activity concluded.","5/8/2018","20:15","2018-05-08T20:15Z",NA,"NCRCC","UAS","PAGED","USSS",NA,NA,NA,NA,NA,NA,NA,NA,NA,NA,NA,NA,NA,NA,NA,NA,"USSS","EXCEPTION"
"PIC reported a quad-copter UAS off right side 500 feet below while at 4,700 feet VCNTY FUL. Evasive action not reported. LEO notification not reported.","5/9/2018","3:45","2018-05-09T03:45Z","CPZ5820","DEN","UAS",NA,"FUL",NA,NA,NA,NA,NA,NA,NA,NA,NA,NA,NA,NA,NA,NA,NA,NA,"FUL","EXCEPTION"
"PIC reported a UAS at 2,800 feet OVR George Washington Bridge W of LGA. Evasive action not reported. NYPD Aviation Unit notified, phone number not provided. ","5/9/2018","22:55","2018-05-09T22:55Z","JIA5586","DEN","UAS",NA,"N90",NA,NA,NA,NA,NA,NA,NA,NA,NA,NA,NA,NA,NA,NA,NA,NA,"N90","EXCEPTION"
"Reported observing a red and silver UAS approximately 500 feet below while Nbound at 4,500 feet in the vicinity of Houston, TX. No evasive action taken. FBI notified at. ","5/10/2018","21:53","2018-05-10T21:53Z","N546CB","DEN","UAS",NA,"HOU",NA,NA,NA,NA,NA,NA,NA,NA,NA,NA,NA,NA,NA,NA,NA,NA,"HOU","EXCEPTION"
"Reported a black UAS 500 above aircraft while heading ENE bound on a downwind to LAX. No evasive action taken. LA Co Sheriff notified at.","5/11/2018","4:10","2018-05-11T04:10Z","AFR066","DEN","UAS",NA,"SCT",NA,NA,NA,NA,NA,NA,NA,NA,NA,NA,NA,NA,NA,NA,NA,NA,"SCT","EXCEPTION"
"UAS waiver activated for activity inside the FRZ.Approximately the DCA263011 form 0800-1000 local.The location is just W of where Braddock Road and I-495 intersect, still inside the FRZ.1253:UAS activity inside the FRZhas concluded for the day. ","5/11/2018","17:29","2018-05-11T17:29Z",NA,"NCRCC","UAS","PAGED","NCRCC",NA,NA,NA,NA,NA,NA,NA,NA,NA,NA,NA,NA,NA,NA,NA,NA,"NCRCC","EXCEPTION"
"W-ROC reported that aircraft observed a UAS at 4,500 feet in the vicinity of DMA, near the University of Arizona. Tucson PD notified. ","5/12/2018","0:02","2018-05-12T00:02Z","ZAPER51","DEN","UAS",NA,"SW1",NA,NA,NA,NA,NA,NA,NA,NA,NA,NA,NA,NA,NA,NA,NA,NA,"SW1","EXCEPTION"
"Reported a UAS within 75 feet of aircraft while at 5,500 feet in the vicinity of Shaw AFB. No evasive action reported. LEO notification not reported. ","5/13/2018","2:01","2018-05-13T02:01Z","N15143","DEN","UAS",NA,"WOC",NA,NA,NA,NA,NA,NA,NA,NA,NA,NA,NA,NA,NA,NA,NA,NA,"WOC","EXCEPTION"
"PIC reported while on final approach to R06, reported seeing a drone operating at approximately 1300 feet, 8 NM away from TEB. PIC reported drone passed off the leftwing. No other information available other than the color was black. Local LE and DEN notified. ","5/13/2018","17:32","2018-05-13T17:32Z","DARYR","DEN","UAS",NA,"TEB",NA,NA,NA,NA,NA,NA,NA,NA,NA,NA,NA,NA,NA,NA,NA,NA,"TEB","EXCEPTION"
"PICreported a possible drone or balloon within 7 NM of Huntsville, AL at 10,000 but the pilot was unsure since it went by so fast. ","5/13/2018","21:50","2018-05-13T21:50Z","N214TX","DEN","UAS",NA,"HSV",NA,NA,NA,NA,NA,NA,NA,NA,NA,NA,NA,NA,NA,NA,NA,NA,"HSV","EXCEPTION"
"Reported a UAS came within 2 feet of aircraft while at 5,500 feet in the vicinity of GSO. LEO notification not reported. No evasive action reported.","5/14/2018","4:28","2018-05-14T04:28Z","N57370","DEN","UAS",NA,"GSO",NA,NA,NA,NA,NA,NA,NA,NA,NA,NA,NA,NA,NA,NA,NA,NA,"GSO","EXCEPTION"
"Reported a NM AC with a white UAS at 12 o'clock and .5 NM over OSI while SW bound at 8,400 feet. No evasive action taken. San Mateo PD notified at.","5/14/2018","5:49","2018-05-14T05:49Z","ASA1750","DEN","UAS",NA,"NCT",NA,NA,NA,NA,NA,NA,NA,NA,NA,NA,NA,NA,NA,NA,NA,NA,"NCT","EXCEPTION"
"Reported a UAS at the same altitude while W bound at 4,000 feet 20 N CLT. No evasive action taken. Charlotte-Mecklenburg Pd notified at.","5/15/2018","2:10","2018-05-15T02:10Z","JIA5331","DEN","UAS",NA,"CLT",NA,NA,NA,NA,NA,NA,NA,NA,NA,NA,NA,NA,NA,NA,NA,NA,"CLT","EXCEPTION"
"Reported a red and white UAS off their right wing at 2,000 feet in the vicinity of HOU. No evasive action taken.FBI notified.","5/15/2018","5:54","2018-05-15T05:54Z","N919TC","DEN","UAS",NA,"HOU",NA,NA,NA,NA,NA,NA,NA,NA,NA,NA,NA,NA,NA,NA,NA,NA,"HOU","EXCEPTION"
"Reported observing a white UAS at the same altitude off of the right side while on a3 NM final to R17L at 11,000 feet. No evasive action taken. Orange County Sheriff notified at. ","5/16/2018","22:35","2018-05-16T22:35Z","SWA1644","DEN","UAS",NA,"MCO",NA,NA,NA,NA,NA,NA,NA,NA,NA,NA,NA,NA,NA,NA,NA,NA,"MCO","EXCEPTION"
"TV4 and TV7 reported a UAS below aircraft while hovering over a police pursuit. No evasive action taken. LEO notification not reported.","5/18/2018","9:37","2018-05-18T09:37Z","TV4","DEN","UAS",NA,"SNA",NA,NA,NA,NA,NA,NA,NA,NA,NA,NA,NA,NA,NA,NA,NA,NA,"SNA","EXCEPTION"
"Reported observing a white 3 blade UAS at the same altitude, 1 NM ahead and off of the right side while on short final. Evasive action taken was not reported. Duval County Sheriff notified. ","5/18/2018","21:43","2018-05-18T21:43Z","EDV3309","DEN","UAS",NA,"JAX",NA,NA,NA,NA,NA,NA,NA,NA,NA,NA,NA,NA,NA,NA,NA,NA,"JAX","EXCEPTION"
"Aircraft reported overflying a fixed wing UAS by 100 feet while SWbound at 1300 feet, 3 NE of EVV. No evasive action taken. Vanderburgh Sheriff notified.","5/20/2018","2:49","2018-05-20T02:49Z","AWI3912","DEN","UAS",NA,"BNA",NA,NA,NA,NA,NA,NA,NA,NA,NA,NA,NA,NA,NA,NA,NA,NA,"BNA","EXCEPTION"
"Aircraft observed seeing a UAS, black medium-size,off their right side while on final to IAH. No evasive action taken. LocalFBI was notified at.","5/20/2018","4:13","2018-05-20T04:13Z","RPA4577","DEN","UAS",NA,"I90",NA,NA,NA,NA,NA,NA,NA,NA,NA,NA,NA,NA,NA,NA,NA,NA,"I90","EXCEPTION"
"NTSB-SGI-eCOA UAS operations for a train derailment in Alexandria, VA in effect from 1100 - 1300. Location: DCA231/004.4 (38:48:21N / 77:05:57W), AOB 200 feet. DCA notified. 1415 Confirmed mission complete for 5/20-21. DCA notified. ","5/20/2018","15:54","2018-05-20T15:54Z",NA,"NCRCC","UAS","NCR-COORDINATION, PAGED","NCRCC",NA,NA,NA,NA,NA,NA,NA,NA,NA,NA,NA,NA,NA,NA,NA,NA,"NCRCC","EXCEPTION"
"MSY APCH relayed report from pilot of RPA4462. The pilot reported a possible drone or balloon strike to the right of the flight deck at altitude 9,500 off the MSY360034 at 0039Z. First officer believed it was a drone. No injuries reported. The flight crew will call back to MSY APCH with more details about aircraft damage after they have landed. 0149 CLOSEOUT: Republic dispatch reports the PIC reported possible bird strike. Maintenance reported bird remains of bird on Aircraft. Dispatch will contact WOCC after confirmation report comes from PIC. ","5/21/2018","5:57","2018-05-21T05:57Z","RPA4462","NCRCC","UAS",NA,"SW1",NA,NA,NA,NA,NA,NA,NA,NA,NA,NA,NA,NA,NA,NA,NA,NA,"SW1","EXCEPTION"
"SJU airport personnel reported a black UAS operating over the Air National Guard Ramp. No altitude or other details given. Aircraft not effected. San Juan Airport Police notified, phone number not provided. ","5/21/2018","23:29","2018-05-21T23:29Z",NA,"DEN","UAS",NA,"SJU",NA,NA,NA,NA,NA,NA,NA,NA,NA,NA,NA,NA,NA,NA,NA,NA,"SJU","EXCEPTION"
"USCP UAS Operations on US Capitol Grounds, AOB 400 feet,commencing.1254; UAS operations terminated.","5/22/2018","15:08","2018-05-22T15:08Z",NA,"NCRCC","NCR-COORDINATION","UAS","USCP",NA,NA,NA,NA,NA,NA,NA,NA,NA,NA,NA,NA,NA,NA,NA,NA,"USCP","EXCEPTION"
"PIC reported a large 5x5 foot white UAS crossed in front E-to-W. No evasive action taken. Broward County Sheriff notified at. No other information provided. ","5/23/2018","5:09","2018-05-23T05:09Z","N192DS","DEN","UAS",NA,"MIA",NA,NA,NA,NA,NA,NA,NA,NA,NA,NA,NA,NA,NA,NA,NA,NA,"MIA","EXCEPTION"
"PIC reported a silver UAS 50 feet above while ESE bound at 3,100 feet VCNTY PHX. No evasive action taken. LEO notification not reported.","5/24/2018","1:51","2018-05-24T01:51Z","N43MS","DEN","UAS",NA,"PHX",NA,NA,NA,NA,NA,NA,NA,NA,NA,NA,NA,NA,NA,NA,NA,NA,"PHX","EXCEPTION"
"PIC reported a silver and blue UAS while ESE bound at 2,300 feet VCNTY IWA. No evasive action reported. Mesa Police notified at, phone number not provided.","5/24/2018","2:31","2018-05-24T02:31Z","NDU531","DEN","UAS",NA,"IWA",NA,NA,NA,NA,NA,NA,NA,NA,NA,NA,NA,NA,NA,NA,NA,NA,"IWA","EXCEPTION"
"DCA-2: PCT relayed a report from SWA1969 of a drone sighting at the DCA260012 altitude 050. Pilot reports the drone appeared to be white with black props.Sighting occurred at 1448Z. LEO's are being notified. 1516: PCT reports Fairfax County PD was notified , badge number 309566, at. 1535: Fairfax county PD sent a unit to approximate location of UAS report in Burke, VA. They were unable to find the UAS operator. NFA. ","5/24/2018","19:55","2018-05-24T19:55Z","SWA1969","NCRCC","TOI-NCR FRZ","MOR, PAGED, TOI, UAS","NCRCC",NA,NA,NA,NA,NA,NA,NA,NA,NA,NA,NA,NA,NA,NA,NA,NA,"NCRCC","EXCEPTION"
"Reported sighting a UAS operating at 300 feet, N of San Juan. No evasive action taken. Puerto Rico Port Authority notified. ","5/25/2018","20:23","2018-05-25T20:23Z","N137BC","DEN","UAS",NA,"SJU",NA,NA,NA,NA,NA,NA,NA,NA,NA,NA,NA,NA,NA,NA,NA,NA,"SJU","EXCEPTION"
"2005 DCA-1: Reported a black drone, approximately the size of abasketball,5S of DCA at 9,000 feet. Unable to discern any movement. PCT to file MOR. Prince Georges County PD notified at. ","5/26/2018","1:11","2018-05-26T01:11Z","LOF4248","NCRCC","UAS","MOR, PAGED","PCT",NA,NA,NA,NA,NA,NA,NA,NA,NA,NA,NA,NA,NA,NA,NA,NA,"PCT","EXCEPTION"
"Reported a UAS while 1 NM from Blue Bells PA at 3,000 feet. No evasive action taken. LEO not notified.","5/26/2018","1:19","2018-05-26T01:19Z","N654AG","DEN","UAS",NA,"WOC",NA,NA,NA,NA,NA,NA,NA,NA,NA,NA,NA,NA,NA,NA,NA,NA,"WOC","EXCEPTION"
"Reported sighting a white Quad-copter UAS operating 800 feet below while Wbound at 6,500 feet over SLC. Evasive action was not reported. Salt Lake City Airport PD notified at. ","5/26/2018","21:58","2018-05-26T21:58Z","N2097G","DEN","UAS",NA,"SLC",NA,NA,NA,NA,NA,NA,NA,NA,NA,NA,NA,NA,NA,NA,NA,NA,"SLC","EXCEPTION"
"Aircraft reported passing within 100 feet of a white and black UAS while at 4,500 feet in the vicinity of SCAPE intersection. No evasive action taken. UNKN if LEO notified. ","5/27/2018","21:20","2018-05-27T21:20Z","N50CT","DEN","UAS",NA,"HGR",NA,NA,NA,NA,NA,NA,NA,NA,NA,NA,NA,NA,NA,NA,NA,NA,"HGR","EXCEPTION"
"PIC reported a 2-rotor UAS at mid-field and W of RWL34L above the tree tops while S bound at 2,500 feet. No other information provided. ","5/28/2018","1:32","2018-05-28T01:32Z","N527TB","DEN","UAS",NA,"PAE",NA,NA,NA,NA,NA,NA,NA,NA,NA,NA,NA,NA,NA,NA,NA,NA,"PAE","EXCEPTION"
"PIC reported a UAS 100 feet off left side at 3,000 feet moving E bound while departing PHX. No evasive action taken. LEO notified, agency and phone number not provided.","5/28/2018","1:38","2018-05-28T01:38Z","AAL544","DEN","UAS",NA,"P50",NA,NA,NA,NA,NA,NA,NA,NA,NA,NA,NA,NA,NA,NA,NA,NA,"P50","EXCEPTION"
"HELO observed a yellow UAS orbiting over downtown Fort Worth at 500 feet. No evasive action was taken. DPS notified at.","5/28/2018","7:26","2018-05-28T07:26Z","TBEAR1","DEN","UAS",NA,"FTW",NA,NA,NA,NA,NA,NA,NA,NA,NA,NA,NA,NA,NA,NA,NA,NA,"FTW","EXCEPTION"
"Naval Magazine Indian Island, WA reported a UAS landed on their property. UAS owner was flying it out over the water from Port Townsend, WA when the UAS went out of range, theowner saw it land in a parking lot near a building on Indian Island. The owner called Port Townsend Police to find out how to get the UAS back. Port Townsend Police notified Naval Magazine Indian Island. Indian Island personnel did not see the UAS land but were able to locate the UAS and are currently in possession of the UAS. CDO may be reached at for further information. ","5/28/2018","10:23","2018-05-28T10:23Z",NA,"DEN","UAS","PAGED","SW1",NA,NA,NA,NA,NA,NA,NA,NA,NA,NA,NA,NA,NA,NA,NA,NA,"SW1","EXCEPTION"
"Reported observing a red, white, and blue Quad-copter UAS operating 150 feet off of the right side at the same altitude while S bound at 5,000 feet in the vicinity of Seattle. Evasive action not reported. Federal Way PD notified. ","5/29/2018","21:22","2018-05-29T21:22Z","QXE2389","DEN","UAS",NA,"SEA",NA,NA,NA,NA,NA,NA,NA,NA,NA,NA,NA,NA,NA,NA,NA,NA,"SEA","EXCEPTION"
"Reported observing a yellow, DJI UAS operating at 1,700 feet while on a 5 NM final to RW 21L. No evasive action taken. Chamblee County PD notified at. ","5/30/2018","19:29","2018-05-30T19:29Z","N53NW","DEN","UAS","PAGED","PDK",NA,NA,NA,NA,NA,NA,NA,NA,NA,NA,NA,NA,NA,NA,NA,NA,"PDK","EXCEPTION"
"Reported a UAS 100 feet off the right side while climbing through 1,800 feet. No evasive action taken. LEO notification not reported. ","6/1/2018","21:41","2018-06-01T21:41Z","N2202A","DEN","UAS",NA,"ROC",NA,NA,NA,NA,NA,NA,NA,NA,NA,NA,NA,NA,NA,NA,NA,NA,"ROC","EXCEPTION"
"PIC reported a red and gold UAS at 1,500 feet while NE bound at 3,000 feet while on approach to FAY. No evasive action taken. Fayetteville Police notified at.","6/2/2018","1:33","2018-06-02T01:33Z","N112BR","DEN","UAS",NA,"FAY",NA,NA,NA,NA,NA,NA,NA,NA,NA,NA,NA,NA,NA,NA,NA,NA,"FAY","EXCEPTION"
"Event occurred 6-2-18 1539Z. Reported a UAS pass 1,000 feet below aircraft in the vicinity of BNA. No evasive action taken. LEO notification unknown. ","6/3/2018","20:14","2018-06-03T20:14Z","N9458X","DEN","UAS","NOTIFICATION-LATE","BNA",NA,NA,NA,NA,NA,NA,NA,NA,NA,NA,NA,NA,NA,NA,NA,NA,"BNA","EXCEPTION"
"PIC reported a large UAS pass within 500-1000 feet from Aircraft VCNTY FAY. No other details reported. Evasive action not reported. LEO notification not reported.","6/4/2018","6:09","2018-06-04T06:09Z","N524JA","DEN","UAS",NA,"FAY",NA,NA,NA,NA,NA,NA,NA,NA,NA,NA,NA,NA,NA,NA,NA,NA,"FAY","EXCEPTION"
"Pilot observed a cylindrical UAS at the DCA264095 at 700 feet heading NW. No evasive action taken. Rockingham County PDnotified at. ","6/5/2018","2:49","2018-06-05T02:49Z","N2409C","NCRCC","UAS",NA,"NCRCC",NA,NA,NA,NA,NA,NA,NA,NA,NA,NA,NA,NA,NA,NA,NA,NA,"NCRCC","EXCEPTION"
"DCA-1, DCA190009, pilot reported a black UAS at3400. No direction given and no evasive action taken. Fairfax County Police notified at. DCA will file MOR. ","6/5/2018","3:46","2018-06-05T03:46Z","RPA4622","NCRCC","TOI-NCR FRZ","PAGED, TOI, UAS","DCA",NA,NA,NA,NA,NA,NA,NA,NA,NA,NA,NA,NA,NA,NA,NA,NA,"DCA","EXCEPTION"
"PIC reported a UAS S of Cairo, GA (CYR) below 2,000 feet. No other details given. No evasive action taken. Grady County Sheriff notified at.","6/5/2018","23:14","2018-06-05T23:14Z","N91834","DEN","UAS",NA,"TLH",NA,NA,NA,NA,NA,NA,NA,NA,NA,NA,NA,NA,NA,NA,NA,NA,"TLH","EXCEPTION"
"AVFT reported a dark colored UASwhile NEbound at 1,800 feet in VCNTY of LAX. No evasive action reported. Los Angeles World Airports Operations center notified at.","6/6/2018","8:53","2018-06-06T08:53Z","ACA795","DEN","UAS",NA,"LAX",NA,NA,NA,NA,NA,NA,NA,NA,NA,NA,NA,NA,NA,NA,NA,NA,"LAX","EXCEPTION"
"Reported a rotorcraft UAS 100 FT off right side at same altitude at 2,000 FT. No evasive action reported. Columbus PD notified at. ","6/7/2018","20:54","2018-06-07T20:54Z","MONARCH1","DEN","UAS",NA,"CMH",NA,NA,NA,NA,NA,NA,NA,NA,NA,NA,NA,NA,NA,NA,NA,NA,"CMH","EXCEPTION"
"FRZ UAS:2018-PIC-142833, I-495 and Seminary Road, commenced.1700 UAS activity complete. ","6/7/2018","22:02","2018-06-07T22:02Z",NA,"NCRCC","NCR-COORDINATION","PAGED, UAS","NCRCC",NA,NA,NA,NA,NA,NA,NA,NA,NA,NA,NA,NA,NA,NA,NA,NA,"NCRCC","EXCEPTION"
"Reported a large UAS at 400FT off aircraft right side at same altitude of 2,200FT 2NW of STP. No evasive action taken. State Patrol notified at. ","6/7/2018","22:25","2018-06-07T22:25Z","N121NS","DEN","UAS",NA,"STP",NA,NA,NA,NA,NA,NA,NA,NA,NA,NA,NA,NA,NA,NA,NA,NA,"STP","EXCEPTION"
"Aircraft reporteda grey UAS flew within50 feet, over their aircraft, in the VCNTY of185th St near the Sportsman Warehouse N of HWY26.Pilot reportedthey made a hard left turn to avoid the UAS. 0215 CLOSEOUT: HQ DEN contacted P-80 TRACON who advised the described location was within Portland-Hillsboro (HIO) ATCT airspace. HIO reported the following additional information regarding the UAS incident:Aircraft was operating VFR at 700 feet when UAS flew within 50 feet of their Aircraft.PIC informedATCT that he made a hard left turn to avoid the UAS and intendsto file a NM AC report. HIO ATCT notified Washington County PD and filed MOR. PIC is Roscoe Gray,. ","6/8/2018","6:56","2018-06-08T06:56Z","N1215CL","DEN","UAS",NA,"WOC",NA,NA,NA,NA,NA,NA,NA,NA,NA,NA,NA,NA,NA,NA,NA,NA,"WOC","EXCEPTION"
"DCA-2: EAGLE2reported a large blackUAS sighted in the vicinity of the Capital One Arena (DCA021/2.5)NE, 1400 feet. EAGLE2 followed the drone to the Old Soldiers Home Golf Course andsubsequently loss visual contact.DC Metro PD notified at. DCA will file MOR. ","6/8/2018","8:55","2018-06-08T08:55Z","EAGLE2","NCRCC","TOI-PA-P-56A","TOI, TOI-PA, UAS","NCRCC",NA,NA,NA,NA,NA,NA,NA,NA,NA,NA,NA,NA,NA,NA,NA,NA,"NCRCC","EXCEPTION"
"DCA-1: FALCON1 reported awhite UASquad-copteroperating in the vicinity of the Capital One Arena (DCA021/2.5) Ebound heading, 800-900 feet. DC Metro PD notified at. DCA will file MOR. ","6/8/2018","9:07","2018-06-08T09:07Z","FALCON1","NCRCC","TOI-PA-P-56A","TOI, TOI-PA, UAS","DCA",NA,NA,NA,NA,NA,NA,NA,NA,NA,NA,NA,NA,NA,NA,NA,NA,"DCA","EXCEPTION"
"Reported sighting a grey UAS as it flew 50 feet above the aircraft in the vicinity of 185th Street near the Sportsman Warehouse N of HWY26. PCI indicated that a hard left turn was made to avoid. Notification information was not provided. This incident occurred on 06/07/2018 at 2329. ","6/8/2018","15:00","2018-06-08T15:00Z","N125CL","DEN","UAS","PAGED","PDX",NA,NA,NA,NA,NA,NA,NA,NA,NA,NA,NA,NA,NA,NA,NA,NA,"PDX","EXCEPTION"
"HQ DEN contacted LGA regarding multiple UAS reports. The UAS activity hasceased and not occurred during the last 1-2 hours.NYPD informed OM that they saw multiple red balloons in VCNTY, but no UASwerelocated.Puerto Rican Day Parade was held today in NYC. ","6/11/2018","3:18","2018-06-11T03:18Z",NA,"DEN","UAS",NA,"HQ DEN",NA,NA,NA,NA,NA,NA,NA,NA,NA,NA,NA,NA,NA,NA,NA,NA,"HQ DEN","EXCEPTION"
"Aircraft observed green UAS off the right while NW bound at 15,000 feet over Gurley, AL. No evasive action was taken. FBI was notified at.","6/11/2018","8:51","2018-06-11T08:51Z","DAL1075","DEN","UAS",NA,"HSV",NA,NA,NA,NA,NA,NA,NA,NA,NA,NA,NA,NA,NA,NA,NA,NA,"HSV","EXCEPTION"
"1030; USCP UAS activity commencing on US Capitol grounds AOB 400 feet. 1236; UAS activity concluded.","6/11/2018","15:15","2018-06-11T15:15Z",NA,"NCRCC","NCR-COORDINATION","PAGED, UAS","USCP",NA,NA,NA,NA,NA,NA,NA,NA,NA,NA,NA,NA,NA,NA,NA,NA,"USCP","EXCEPTION"
"DCA-1: 1455; DCA159001.5,white and black drone sighted by DIA employee at the DIA building in the vicinity of McChord St SW and Brookley Ave SW. Drone headed W and hovered at Blanchard Ave then headed W toward the lower Potomac River. Drone was reported higher than a 9 Story building. JBAB Military Police are investigating. DCA will file MOR.1617; Closeout: JBAB Police confirm drone sighting was actuallya black and white helium balloon. ","6/11/2018","20:38","2018-06-11T20:38Z",NA,"NCRCC","TOI-NCR FRZ","TOI, UAS","NCRCC",NA,NA,NA,NA,NA,NA,NA,NA,NA,NA,NA,NA,NA,NA,NA,NA,"NCRCC","EXCEPTION"
"Confirmed waiver activation. Drone activity commencing at Walter Reed Medical Center 1400-1600 local. ","6/12/2018","22:03","2018-06-12T22:03Z",NA,"NCRCC","UAS",NA,"NCRCC",NA,NA,NA,NA,NA,NA,NA,NA,NA,NA,NA,NA,NA,NA,NA,NA,"NCRCC","EXCEPTION"
"Reported observing a UAS operating at 3,000 feet over Norfolk while inbound to NAS Norfolk. No evasive action reported. LEO notification was not provided. ","6/13/2018","23:24","2018-06-13T23:24Z","RAWHD72","DEN","UAS",NA,"ORF",NA,NA,NA,NA,NA,NA,NA,NA,NA,NA,NA,NA,NA,NA,NA,NA,"ORF","EXCEPTION"
"Reported observing a yellow UAS operating at 1,000 feet while on a 3 NM final to R24R. No evasive action taken. Los Angeles Airport PD notified at. ","6/14/2018","6:31","2018-06-14T06:31Z","CPZ6008","DEN","UAS",NA,"LAX",NA,NA,NA,NA,NA,NA,NA,NA,NA,NA,NA,NA,NA,NA,NA,NA,"LAX","EXCEPTION"
"EXEC1F departed LGA at 1750. ","6/14/2018","22:58","2018-06-14T22:58Z","EXEC1F","NORAD","UAS","PAGED","N/NC",NA,NA,NA,NA,NA,NA,NA,NA,NA,NA,NA,NA,NA,NA,NA,NA,"N/NC","EXCEPTION"
"PIC reported a UAS at mid-fieldand at approach end of RWL6L while taxiing for departure at CLE. ATCTwas unablesee UAS. Evasive action not reported. Cleveland Police notified, phone number not provided.","6/16/2018","1:09","2018-06-16T01:09Z","N194SW","DEN","UAS",NA,"ZOB",NA,NA,NA,NA,NA,NA,NA,NA,NA,NA,NA,NA,NA,NA,NA,NA,"ZOB","EXCEPTION"
"PIC reported seeing a drone maneuvering at 6,300', two other aircraft also reported seeing the drone as well. No evasive action taken, W minister PD notified. ","6/16/2018","19:57","2018-06-16T19:57Z","N998DW","DEN","UAS",NA,"ZDV",NA,NA,NA,NA,NA,NA,NA,NA,NA,NA,NA,NA,NA,NA,NA,NA,"ZDV","EXCEPTION"
"PIC reported a medium size red fixed-wing UAS 300 feet off left side and climbing at 2,500 feet while inbound to ADS. No evasive action taken. Texas DPS notified at.","6/16/2018","22:55","2018-06-16T22:55Z","N22QQ","DEN","UAS",NA,"ADS",NA,NA,NA,NA,NA,NA,NA,NA,NA,NA,NA,NA,NA,NA,NA,NA,"ADS","EXCEPTION"
"PIC reported a black and white UAS below while on final at 400 feet. No evasive action taken. No other information provided. Broward County Sheriff notified, phone number not provided.","6/17/2018","3:22","2018-06-17T03:22Z","XOJ757","DEN","UAS",NA,"FLL",NA,NA,NA,NA,NA,NA,NA,NA,NA,NA,NA,NA,NA,NA,NA,NA,"FLL","EXCEPTION"
"PIC reported a red UAS or R/C Aircraft off right side whileS bound at 800-1,000 feet VCNTY HIO. No evasive action reported. LEO notification not reported. ","6/17/2018","5:45","2018-06-17T05:45Z","N356HA","DEN","UAS",NA,"HIO",NA,NA,NA,NA,NA,NA,NA,NA,NA,NA,NA,NA,NA,NA,NA,NA,"HIO","EXCEPTION"
"Aircraft reported being overflown by a black quadcopter UAS,approximately 1200 feet,while inbound2 NM ME of LGA.No evasive action taken. NYPD Aviation Unit notified at.","6/17/2018","20:48","2018-06-17T20:48Z","SWA3296","DEN","UAS",NA,"LGA",NA,NA,NA,NA,NA,NA,NA,NA,NA,NA,NA,NA,NA,NA,NA,NA,"LGA","EXCEPTION"
"PIC reported a silver UAS off right side while SW bound at 8,000 feet OVR LGA. No evasive action reported. NYPD Aviation Unit notified at.","6/17/2018","22:34","2018-06-17T22:34Z","EDV5324","DEN","UAS",NA,"N90",NA,NA,NA,NA,NA,NA,NA,NA,NA,NA,NA,NA,NA,NA,NA,NA,"N90","EXCEPTION"
"HELO observed a black UAS over the Santa Monica pier while E bound at 1,000 feet. No evasive action was taken. LEO notification not reported.","6/19/2018","3:31","2018-06-19T03:31Z","C6547","DEN","UAS",NA,"SMO",NA,NA,NA,NA,NA,NA,NA,NA,NA,NA,NA,NA,NA,NA,NA,NA,"SMO","EXCEPTION"
"Joint BasePearl Harbor Hickam AFBreporting that a drone crashed into a fence near pier B14 between 1330 and 1340and is in the custody of CID. The drone has an attached camera. Thedrone operatorhad not been apprehended at time of reporting.The drone will be given custody to NCIS for furtherinvestigation.  ","6/19/2018","7:12","2018-06-19T07:12Z",NA,"DEN","UAS",NA,"SW1",NA,NA,NA,NA,NA,NA,NA,NA,NA,NA,NA,NA,NA,NA,NA,NA,"SW1","EXCEPTION"
"NCT reporting that a black Quad-copter was operating for 20 minuteswithin aquarter NM of San Jose at approximately 500 feet. No evasive action taken. San Jose PD notified at. ","6/21/2018","10:09","2018-06-21T10:09Z",NA,"DEN","UAS",NA,"NCT",NA,NA,NA,NA,NA,NA,NA,NA,NA,NA,NA,NA,NA,NA,NA,NA,"NCT","EXCEPTION"
"1200: FRZ UAS Operation (2018-PIC7-141595), DCA318005,Washington Golf Club, Arlington, VAuntil 1400. DCA and PCT notified.1400: Extended operation until 1600, DCA and PCT notified.1529 Operation terminated. DCA and PCT notified.","6/21/2018","16:17","2018-06-21T16:17Z",NA,"NCRCC","NCR-COORDINATION","PAGED, UAS","NCRCC",NA,NA,NA,NA,NA,NA,NA,NA,NA,NA,NA,NA,NA,NA,NA,NA,"NCRCC","EXCEPTION"
"Reported a UAS at the 1'oclock position. No other information given.","6/23/2018","4:34","2018-06-23T04:34Z","JBU1179","DEN","UAS",NA,"RIV",NA,NA,NA,NA,NA,NA,NA,NA,NA,NA,NA,NA,NA,NA,NA,NA,"RIV","EXCEPTION"
"Reported a UAS off the left side at 6,500 feet while N bound. No evasive action taken. LEO notified. ","6/23/2018","4:44","2018-06-23T04:44Z","AFR671","DEN","UAS",NA,"ABQ",NA,NA,NA,NA,NA,NA,NA,NA,NA,NA,NA,NA,NA,NA,NA,NA,"ABQ","EXCEPTION"
"LAS Airport Operations found a white Phantom quad-copter UAS at the intersection of TWY E and TWY S. No Aircraft were involved. UAS will be turned over to LEO. Las Vegas Metro PD notified at.","6/23/2018","19:29","2018-06-23T19:29Z",NA,"DEN","UAS",NA,"LAS",NA,NA,NA,NA,NA,NA,NA,NA,NA,NA,NA,NA,NA,NA,NA,NA,"LAS","EXCEPTION"
"Aircraft reporteda NM ACwith silver quadcopterUAS at the 12 o'clock position, within 100 feet of Aircraft,while NNWbound at 8,000 feet in ClassB airspace in VCNTY of RHV. No evasive action reported. A second Aircraftreported seeing the UAS in same VCNTY at 6,000 feet, 7 minutes later.No evasive action reported. Santa Clara County Sheriff notified at.HQ DEN contacted NCT OMwho stated the controller requestedNM AC information from PIC, butdid notobtain PIC contact info or askpilot if they intended to file a NM AC report.HQ DEN UASreporting procedures was given toNCT OM and requested they share it with other OM's.","6/25/2018","5:58","2018-06-25T05:58Z","SKW5929","DEN","UAS",NA,"WOC",NA,NA,NA,NA,NA,NA,NA,NA,NA,NA,NA,NA,NA,NA,NA,NA,"WOC","EXCEPTION"
"PIC reported a black fixed-wing basketball sized UAS while NW bound at 4,000 feet 5NW NW of DET. No evasive action reported. Eer District Police notified at.","6/26/2018","6:40","2018-06-26T06:40Z","N604LB","DEN","UAS",NA,"D21",NA,NA,NA,NA,NA,NA,NA,NA,NA,NA,NA,NA,NA,NA,NA,NA,"D21","EXCEPTION"
"PIC reported a UAS OVR New Jersey Shore while SSW bound at 4,300 feet. No other details given. No evasive action taken. LEO not notified.","6/26/2018","7:53","2018-06-26T07:53Z","DAL2173","DEN","UAS",NA,"N90",NA,NA,NA,NA,NA,NA,NA,NA,NA,NA,NA,NA,NA,NA,NA,NA,"N90","EXCEPTION"
"FRZ UAS:ApprovedVDOT UAS operation in progress, AOB 100 feet,in the vicinity of Route 1 and Hybla Valley, VA until 1300L. ","6/26/2018","20:00","2018-06-26T20:00Z",NA,"NCRCC","UAS","NCR-COORDINATION","NCRCC",NA,NA,NA,NA,NA,NA,NA,NA,NA,NA,NA,NA,NA,NA,NA,NA,"NCRCC","EXCEPTION"
"ATCT reported a large, white quad copter UAS, 3 SW of CSG. No acft affected. Columbus Public Safety notified at.","6/27/2018","2:50","2018-06-27T02:50Z",NA,"DEN","UAS",NA,"CSG",NA,NA,NA,NA,NA,NA,NA,NA,NA,NA,NA,NA,NA,NA,NA,NA,"CSG","EXCEPTION"
"FRZ UAS: 2018-PIC-141595, Arlington, VA, AOB 250 feet 1200-1600, pilot will reactivateat 2 hours, DCA and PCT advised. 1605: Pilot advised UAS operations complete.","6/28/2018","16:25","2018-06-28T16:25Z",NA,"NCRCC","NCR-COORDINATION","UAS","NCRCC",NA,NA,NA,NA,NA,NA,NA,NA,NA,NA,NA,NA,NA,NA,NA,NA,"NCRCC","EXCEPTION"
"FRZ UAS: Waivered UAS operation (PIC7-141595)in progress in the vicinity of the Washington Golf Course(DCA320/5nm), AOB 250 feet,until 1000L. LEO on-site. DCA notified. ","6/29/2018","17:07","2018-06-29T17:07Z",NA,"NCRCC","UAS","NCR-COORDINATION","NCRCC",NA,NA,NA,NA,NA,NA,NA,NA,NA,NA,NA,NA,NA,NA,NA,NA,"NCRCC","EXCEPTION"
"PIC reported a red and black 2-3 feet diameter UAS while at 11,500 feet in the vicinity of ITH. No evasive action taken. LEO was notified, agency and phone number not provided.","6/30/2018","4:10","2018-06-30T04:10Z","N888D","DEN","UAS",NA,"WOC",NA,NA,NA,NA,NA,NA,NA,NA,NA,NA,NA,NA,NA,NA,NA,NA,"WOC","EXCEPTION"
"PIC reported a UAS VCNTY AVL at 4,000 feet. No other details given. No evasive action taken. UNKN if LEO notified.","7/1/2018","2:28","2018-07-01T02:28Z","CAP3263","DEN","UAS",NA,"AVL",NA,NA,NA,NA,NA,NA,NA,NA,NA,NA,NA,NA,NA,NA,NA,NA,"AVL","EXCEPTION"
"Aircraft W bound at 6,700 feet reported a 3 foot diameter 4 rotor red UAS passed 300 feet directly below aircraft 12 SW GGT. No evasive action taken. Chenango County Sheriff notified. ","7/1/2018","22:10","2018-07-01T22:10Z","N900PK","DEN","UAS",NA,"SYR",NA,NA,NA,NA,NA,NA,NA,NA,NA,NA,NA,NA,NA,NA,NA,NA,"SYR","EXCEPTION"
"PIC reported a UAS OVR EWR while NE bound at 5,000 feet. No evasive action taken. NJ State Police Aviation Unit notified at.","7/2/2018","5:05","2018-07-02T05:05Z","DJT101","DEN","UAS",NA,"N90",NA,NA,NA,NA,NA,NA,NA,NA,NA,NA,NA,NA,NA,NA,NA,NA,"N90","EXCEPTION"
"USCP conducting UAS operations within the US Capitol Exclusion Zone until approximately 1300. 1357: USCP UAS operations have concluded for the day.","7/2/2018","14:09","2018-07-02T14:09Z",NA,"NCRCC","NCR-COORDINATION","PAGED, UAS","NCRCC",NA,NA,NA,NA,NA,NA,NA,NA,NA,NA,NA,NA,NA,NA,NA,NA,"NCRCC","EXCEPTION"
"Aircraft reported UAS while WNW bound at 800 feet 2 ESE of SJC. No evasive action taken. San Jose Police notified. ","7/2/2018","21:06","2018-07-02T21:06Z","CPZ6011","DEN","UAS",NA,"SJC",NA,NA,NA,NA,NA,NA,NA,NA,NA,NA,NA,NA,NA,NA,NA,NA,"SJC","EXCEPTION"
"PIC observed a blue and white UAS with orange propellers hovering at 3,000', .25 NM off the right side while SE bound 10NE of Boston. No evasive action reported. MA State Police notified at. ","7/3/2018","19:33","2018-07-03T19:33Z","RPA5908","DEN","UAS",NA,"A90",NA,NA,NA,NA,NA,NA,NA,NA,NA,NA,NA,NA,NA,NA,NA,NA,"A90","EXCEPTION"
"Reported a UAS while N bound at 4,500 feet to the left and 500 feet below aircraft. No evasive action reported. Duval Co Sheriff notified at.","7/4/2018","21:47","2018-07-04T21:47Z","N3888D","DEN","UAS",NA,"JAX",NA,NA,NA,NA,NA,NA,NA,NA,NA,NA,NA,NA,NA,NA,NA,NA,"JAX","EXCEPTION"
"Aircraft reporteda UASwith red lights off left wing in VCNTY of MSY. No evasive action taken. Jefferson Parish Sheriff office notified at.","7/5/2018","8:12","2018-07-05T08:12Z","NKS955","DEN","UAS",NA,"WOC",NA,NA,NA,NA,NA,NA,NA,NA,NA,NA,NA,NA,NA,NA,NA,NA,"WOC","EXCEPTION"
"PIC reported a UAS traveling S bound along the Hudson River at 1,500FT vicinity of LGA. No evasive action reported. LGA ATCT attempted to contact NYPD with no answer.","7/7/2018","22:57","2018-07-07T22:57Z","N909CP","DEN","UAS",NA,"N90",NA,NA,NA,NA,NA,NA,NA,NA,NA,NA,NA,NA,NA,NA,NA,NA,"N90","EXCEPTION"
"PIC reported flying over a red and white fixed wing UAS while SSW bound at 7600FT 4 E Mentone. No evasive action reported. Warsaw PD notified at.","7/7/2018","23:11","2018-07-07T23:11Z","N929TG","DEN","UAS",NA,"ZAU",NA,NA,NA,NA,NA,NA,NA,NA,NA,NA,NA,NA,NA,NA,NA,NA,"ZAU","EXCEPTION"
"PIC reported UAS off it's left wing at same altitude of 9000FT location SIE330012. UAS was heading N bound. No evasive action was taken. Sea Isle PD was notified at.","7/7/2018","23:33","2018-07-07T23:33Z","PDT4865","DEN","UAS",NA,"ZDC",NA,NA,NA,NA,NA,NA,NA,NA,NA,NA,NA,NA,NA,NA,NA,NA,"ZDC","EXCEPTION"
"PIC reported small white UAS 150FT from aircraft while NE bound at 5500FT. No evasive action taken but PIC will file NM AC report. Harford PD notified at.","7/8/2018","1:26","2018-07-08T01:26Z","N8023L","DEN","UAS",NA,"BDL",NA,NA,NA,NA,NA,NA,NA,NA,NA,NA,NA,NA,NA,NA,NA,NA,"BDL","EXCEPTION"
"PIC reported a UAS 1 NM off the right side NE bound at 4500FT 6 N PDX. No evasive action taken. Port of Portland PD notified via 911.","7/8/2018","2:54","2018-07-08T02:54Z","BTQ354","DEN","UAS",NA,"PDX",NA,NA,NA,NA,NA,NA,NA,NA,NA,NA,NA,NA,NA,NA,NA,NA,"PDX","EXCEPTION"
"PIC reported a black quad copter UAS at the 3 o'clock position 500FT below aircraft while WNW bound at 2500FT 6 NE BOS. No evasive action taken. Massachusetts state PD notified at.","7/8/2018","5:14","2018-07-08T05:14Z","SKW4705","DEN","UAS",NA,"BOS",NA,NA,NA,NA,NA,NA,NA,NA,NA,NA,NA,NA,NA,NA,NA,NA,"BOS","EXCEPTION"
"LGA ATCT advised large red UAS between 2000 and 3000FT vicinity of Statue of Liberty. No aircraft impacted. NYPD Aviation Unit notified at.","7/8/2018","5:55","2018-07-08T05:55Z",NA,"DEN","UAS",NA,"LGA",NA,NA,NA,NA,NA,NA,NA,NA,NA,NA,NA,NA,NA,NA,NA,NA,"LGA","EXCEPTION"
"PIC observed a UAS at the 12 o'clock position while NE bound at 3000FT 4 NW LGA, over the George Washington bridge. No evasive action taken. NYPD Aviation Unit notified at. ","7/8/2018","5:59","2018-07-08T05:59Z","SWA3085","DEN","UAS",NA,"N90",NA,NA,NA,NA,NA,NA,NA,NA,NA,NA,NA,NA,NA,NA,NA,NA,"N90","EXCEPTION"
"PIC reported a quad copter UAS flying 200 to 300 FT above Casino Queen 2 NW St Louis Downtown airport. No evasive action taken. Sauget PD notified at. ","7/8/2018","6:17","2018-07-08T06:17Z","MAVRK1","DEN","UAS",NA,"CPS",NA,NA,NA,NA,NA,NA,NA,NA,NA,NA,NA,NA,NA,NA,NA,NA,"CPS","EXCEPTION"
"Reported a gold triangular UAS 1 NM off the right side an 100 feet below while NE bound at 1,400 feet 6 SE RDU. No evasive action taken. Wake County Sheriff notified. ","7/8/2018","21:22","2018-07-08T21:22Z","N6A","DEN","UAS",NA,"RDU",NA,NA,NA,NA,NA,NA,NA,NA,NA,NA,NA,NA,NA,NA,NA,NA,"RDU","EXCEPTION"
"PCT reports blue quad copter outside of SFRA, MRB070005, at 8,500'. PCT is contacting Berkley PD at.","7/8/2018","22:07","2018-07-08T22:07Z",NA,"NCRCC","UAS",NA,"PCT",NA,NA,NA,NA,NA,NA,NA,NA,NA,NA,NA,NA,NA,NA,NA,NA,"PCT","EXCEPTION"
"Reported observing a large UAS while over LGA SW bound at 2,500 feet on final to R22. No evasive action reported. NYPD notified. ","7/9/2018","2:20","2018-07-09T02:20Z","SWA5294","DEN","UAS",NA,"LGA",NA,NA,NA,NA,NA,NA,NA,NA,NA,NA,NA,NA,NA,NA,NA,NA,"LGA","EXCEPTION"
"PIC reported a black UAS 200 feet off right side while N bound at 1,800 feet. Location not provided.No evasive action reported. LEO was not notified.","7/9/2018","6:31","2018-07-09T06:31Z","N9307M","DEN","UAS",NA,"AVP",NA,NA,NA,NA,NA,NA,NA,NA,NA,NA,NA,NA,NA,NA,NA,NA,"AVP","EXCEPTION"
"PIC reported two UAS, 2-3FT in diameter off right wing of Aircraft at 6,500FT while S bound at 7,200FT. No evasive action reported. Denver ARPT authority notified at. ","7/15/2018","1:34","2018-07-15T01:34Z","SWA3518","DEN","UAS",NA,"D01",NA,NA,NA,NA,NA,NA,NA,NA,NA,NA,NA,NA,NA,NA,NA,NA,"D01","EXCEPTION"
"PIC reported teal blue quad-copter 200FT above Aircraft VCNTY DAL at 3,500FT. No evasive action reported. DFW DPS notified at.","7/15/2018","3:25","2018-07-15T03:25Z","N700CP","DEN","UAS",NA,"DAL",NA,NA,NA,NA,NA,NA,NA,NA,NA,NA,NA,NA,NA,NA,NA,NA,"DAL","EXCEPTION"
"PIC reported UAS passed 10-20FT below Aircraft at 5,000FT 10 SE PHL. No evasive action taken. LEO notification not reported.","7/15/2018","6:21","2018-07-15T06:21Z","SKV7536","DEN","UAS",NA,"PHL",NA,NA,NA,NA,NA,NA,NA,NA,NA,NA,NA,NA,NA,NA,NA,NA,"PHL","EXCEPTION"
"PIC reported a white UAS while on departure climb-out from DFW. No altitude INFO provided. No evasive action taken. DFW DPS notified at.","7/16/2018","2:30","2018-07-16T02:30Z","AAL2406","DEN","UAS",NA,"D10",NA,NA,NA,NA,NA,NA,NA,NA,NA,NA,NA,NA,NA,NA,NA,NA,"D10","EXCEPTION"
"FRZ UAS activity: 2018-UAS-143316 site 4 in the vicinity of Bethesda, MD until 0715. DCA notified. 1115: Site 1 activated 1129: site 3 activated.1210: Site 2 activated. 1420: Site 1 activated..1620: Site 5 activated. ","7/16/2018","15:01","2018-07-16T15:01Z",NA,"NCRCC","NCR-COORDINATION","UAS","NCRCC",NA,NA,NA,NA,NA,NA,NA,NA,NA,NA,NA,NA,NA,NA,NA,NA,"NCRCC","EXCEPTION"
"Reported observing a black quad-copter UAS operating at 1,800 feet in the same vicinity and altitude. No evasive action taken. LEO notification was not made. ","7/17/2018","12:10","2018-07-17T12:10Z","N24580","DEN","UAS",NA,"NCT",NA,NA,NA,NA,NA,NA,NA,NA,NA,NA,NA,NA,NA,NA,NA,NA,"NCT","EXCEPTION"
"Aircraft reported seeing a UAS pass below their aircraft while at 9,500 feet while on final to PHL. No evasive action taken. Law enforcement notification not reported.","7/17/2018","22:19","2018-07-17T22:19Z","RPA4680","DEN","UAS",NA,"WOC",NA,NA,NA,NA,NA,NA,NA,NA,NA,NA,NA,NA,NA,NA,NA,NA,"WOC","EXCEPTION"
"Hospital helipad ground crew reported observing a white UAS overflying at 400 feet the landing aircraft at Enloe Hospital helipad in Chico, CA. Evasive action not reported. LEO was not notified. ","7/19/2018","9:27","2018-07-19T09:27Z","MED4","DEN","UAS",NA,"CIC",NA,NA,NA,NA,NA,NA,NA,NA,NA,NA,NA,NA,NA,NA,NA,NA,"CIC","EXCEPTION"
"PIC reported black UAS, 4-5FT in diameter,over ORW at 19,000FT opposite direction 10-20FT below Aircraft. No evasive action reported. LEO notified at. ","7/19/2018","23:47","2018-07-19T23:47Z","AAL2146","DEN","UAS",NA,"ZBW",NA,NA,NA,NA,NA,NA,NA,NA,NA,NA,NA,NA,NA,NA,NA,NA,"ZBW","EXCEPTION"
"PIC reported a white bi-wing UAS operating 1,500-1,700FT while NNE bound at 1,800FT 2NE Danbury, CT. No evasive action taken. Danbury PD notified at.","7/19/2018","23:56","2018-07-19T23:56Z","N93719","DEN","UAS",NA,"DXR",NA,NA,NA,NA,NA,NA,NA,NA,NA,NA,NA,NA,NA,NA,NA,NA,"DXR","EXCEPTION"
"PIC reported 2 rotor craft UAS while N bound at 8,000FT 8 N SLC. No evasive action taken. Salt Lake City PD notified at.","7/20/2018","1:31","2018-07-20T01:31Z","DAL2846","DEN","UAS",NA,"S56",NA,NA,NA,NA,NA,NA,NA,NA,NA,NA,NA,NA,NA,NA,NA,NA,"S56","EXCEPTION"
"PIC reported a UAS 2FT in diameter at 9,000FT in VNCTY of APA. No evasive action reported. LEO notification not reported.","7/20/2018","2:33","2018-07-20T02:33Z","N340DF","DEN","UAS",NA,"APA",NA,NA,NA,NA,NA,NA,NA,NA,NA,NA,NA,NA,NA,NA,NA,NA,"APA","EXCEPTION"
"PIC reported a UAS 1,000FT below Aircraft at 12 o'clock while E bound at 12,000FT 20 ENE Seattle. No evasive action reported. King County Sheriff notified at.","7/20/2018","6:15","2018-07-20T06:15Z","ASA1080","DEN","UAS",NA,"ZSE",NA,NA,NA,NA,NA,NA,NA,NA,NA,NA,NA,NA,NA,NA,NA,NA,"ZSE","EXCEPTION"
"PIC reported a small black UAS 100FT off left side at 11 o'clock while S bound at 2,500FT 4 NM SBP. No evasive action taken. San Luis Obispo sheriff notified at.","7/21/2018","1:02","2018-07-21T01:02Z","BYF17","DEN","UAS",NA,"SBP",NA,NA,NA,NA,NA,NA,NA,NA,NA,NA,NA,NA,NA,NA,NA,NA,"SBP","EXCEPTION"
"BAB AFB reported sercurity personnel observed a UAS operating over the Air Force base education center. No description or altitude given. Base security is investigating. ","7/21/2018","7:54","2018-07-21T07:54Z",NA,"DEN","UAS",NA,"BAB",NA,NA,NA,NA,NA,NA,NA,NA,NA,NA,NA,NA,NA,NA,NA,NA,"BAB","EXCEPTION"
"PIC reported a UAS at 500FT while on 3 NM final. No evasive actin taken. Oak Creek PD notified at.","7/22/2018","2:45","2018-07-22T02:45Z","TBIRD6","DEN","UAS",NA,"MKE",NA,NA,NA,NA,NA,NA,NA,NA,NA,NA,NA,NA,NA,NA,NA,NA,"MKE","EXCEPTION"
"PIC reported UAS while SW bound at 4,000FT, over Norwood (OWD) ARPT. No evasive action taken. Massachusetts State PD Notified at. ","7/22/2018","2:49","2018-07-22T02:49Z","JZA462","DEN","UAS",NA,"BOS",NA,NA,NA,NA,NA,NA,NA,NA,NA,NA,NA,NA,NA,NA,NA,NA,"BOS","EXCEPTION"
"PIC reported a small white UAS passed underneath the Aircraft at approximately 1,800FT. No evasive action taken. LEO notification was not reported.","7/22/2018","3:14","2018-07-22T03:14Z","N791PS","DEN","UAS",NA,"N90",NA,NA,NA,NA,NA,NA,NA,NA,NA,NA,NA,NA,NA,NA,NA,NA,"N90","EXCEPTION"
"Aircraft at 2,500 feet reported a white UAS 1,000feet below at 12 o`clock position 6 SSE MCO. No evasive action taken. Orange County Sherriff notified at.","7/22/2018","22:10","2018-07-22T22:10Z","N13986","DEN","UAS",NA,"F11",NA,NA,NA,NA,NA,NA,NA,NA,NA,NA,NA,NA,NA,NA,NA,NA,"F11","EXCEPTION"
"Reported a small quadcopter UAS while NE bound at 1,700 feet 1 E Concord, NC. No evasive action taken. Concord PD notified at.","7/28/2018","5:47","2018-07-28T05:47Z","N471A","DEN","UAS",NA,"JQF",NA,NA,NA,NA,NA,NA,NA,NA,NA,NA,NA,NA,NA,NA,NA,NA,"JQF","EXCEPTION"
"Reported UAS approximately 1 foot in diameter at 1000 feet below, at the 12 o'clock position, E bound at 7000 feet and 6 S of ORD. No evasive action taken. FBI notified.","7/28/2018","5:52","2018-07-28T05:52Z","NKS948","DEN","UAS",NA,"C90",NA,NA,NA,NA,NA,NA,NA,NA,NA,NA,NA,NA,NA,NA,NA,NA,"C90","EXCEPTION"
"FRZ UAS: Rockville, MD, 2018-UAS-143310 until 1400L. PCT and DCA notified.","7/28/2018","21:03","2018-07-28T21:03Z",NA,"NCRCC","NCR-COORDINATION","UAS","NCRCC",NA,NA,NA,NA,NA,NA,NA,NA,NA,NA,NA,NA,NA,NA,NA,NA,"NCRCC","EXCEPTION"
"ATC advised unknown aircraft, unknown type, reported a red UAS, 2 feet in diameter at the same altitude while at 3000 feet, 2 NNW Langley, WA. No evasive action reported. Island County Sherriff notified at.","7/28/2018","23:49","2018-07-28T23:49Z",NA,"DEN","UAS",NA,"NUW",NA,NA,NA,NA,NA,NA,NA,NA,NA,NA,NA,NA,NA,NA,NA,NA,"NUW","EXCEPTION"
"PIC reported a orange fixed wing UAS while in bound at 3000 feet, 15 W of Seattle. No evasive action reported. Bremerton PD notified at.","7/29/2018","3:42","2018-07-29T03:42Z","N3506T","DEN","UAS",NA,"S46",NA,NA,NA,NA,NA,NA,NA,NA,NA,NA,NA,NA,NA,NA,NA,NA,"S46","EXCEPTION"
"PIC reported a white UAS about 1000 feet below aircraft, right side while at 6000 feet, 18 WSW Austin. No evasive action taken. Austin PD notified at.","7/29/2018","4:00","2018-07-29T04:00Z","AAL2404","DEN","UAS",NA,"AUS",NA,NA,NA,NA,NA,NA,NA,NA,NA,NA,NA,NA,NA,NA,NA,NA,"AUS","EXCEPTION"
"Reported a UAS while W bound at 8,000 FT 20 E LAS. No evasive action taken. Las Vegas PD notified at.","7/29/2018","7:20","2018-07-29T07:20Z","FFT765","DEN","UAS",NA,"L30",NA,NA,NA,NA,NA,NA,NA,NA,NA,NA,NA,NA,NA,NA,NA,NA,"L30","EXCEPTION"
"Reported a NM AC with a UAS near the University of Washington. Aircraft was climbing out of 900 feet and took evasive action to avoid collision. The UAS was one foot across. LEO notification not reported. ","7/29/2018","23:08","2018-07-29T23:08Z","N8397Q","DEN","UAS","PAGED","WOC",NA,NA,NA,NA,NA,NA,NA,NA,NA,NA,NA,NA,NA,NA,NA,NA,"WOC","EXCEPTION"
"Reported a black and white UAS from the 12 o'clock position while SW bound at 3,100 feet. No evasive action taken. Detroit-Metro PD notified.","7/29/2018","23:12","2018-07-29T23:12Z","DAL17","DEN","UAS",NA,"DTW",NA,NA,NA,NA,NA,NA,NA,NA,NA,NA,NA,NA,NA,NA,NA,NA,"DTW","EXCEPTION"
"Aircraftreported a UAS at 3,600 feet while performing airwork W of JFK. No evasive action taken. NYPD Aviation unit notified. ","7/30/2018","1:24","2018-07-30T01:24Z","N733MX","DEN","UAS",NA,"ZNY",NA,NA,NA,NA,NA,NA,NA,NA,NA,NA,NA,NA,NA,NA,NA,NA,"ZNY","EXCEPTION"
"FA-18 Blue Angels, Air Boss and FAA controller assisting air showreported a UAS in the TFR. Law enforcement and Fargo FSDO Notified. No conflict with Blue Angels performance.","7/30/2018","3:05","2018-07-30T03:05Z","VVBA06","DEN","UAS",NA,"FAR",NA,NA,NA,NA,NA,NA,NA,NA,NA,NA,NA,NA,NA,NA,NA,NA,"FAR","EXCEPTION"
"Reported a UAS 100 feet below aircraft while at 2,800 feet in the vicinity of Auburn, WA. No evasive action taken. Pierce Co Sheriff notified at.","7/30/2018","4:06","2018-07-30T04:06Z","N2620N","DEN","UAS",NA,"S46",NA,NA,NA,NA,NA,NA,NA,NA,NA,NA,NA,NA,NA,NA,NA,NA,"S46","EXCEPTION"
"Reported a black and white quad copter UAS within 200 FT while WSW at 1,800 FT 6 ENE LAX. No evasive action taken. Los Angeles World Airport Command Center notified. ","7/30/2018","7:23","2018-07-30T07:23Z","UAL816","DEN","UAS",NA,"LAX",NA,NA,NA,NA,NA,NA,NA,NA,NA,NA,NA,NA,NA,NA,NA,NA,"LAX","EXCEPTION"
"Late notification. 07/28/2018 2234. Reported white UAS hovering at 3500 feet. No evasive action taken. Not reported if LE was advised. ","7/31/2018","1:45","2018-07-31T01:45Z","SWA2965","DEN","UAS",NA,"MDW",NA,NA,NA,NA,NA,NA,NA,NA,NA,NA,NA,NA,NA,NA,NA,NA,"MDW","EXCEPTION"
"Reported sighting a reddish/orange UAS after departure while climbing through 5,000 feet at it's 12 O'clock. The UAS passed at 5,200 feet. No evasive action taken. LEO was not notified. ","7/31/2018","3:21","2018-07-31T03:21Z","AAL2562","DEN","UAS",NA,"PHL",NA,NA,NA,NA,NA,NA,NA,NA,NA,NA,NA,NA,NA,NA,NA,NA,"PHL","EXCEPTION"
"Eielson AFB Security Forces,, confiscated a white UAS from a minor locatedon base housing property. Individual was flying UAS 15-20 feet in immediate area of home. No impact to aviation reported. ","7/31/2018","3:49","2018-07-31T03:49Z",NA,"DEN","UAS",NA,"FAI",NA,NA,NA,NA,NA,NA,NA,NA,NA,NA,NA,NA,NA,NA,NA,NA,"FAI","EXCEPTION"
"Naval Base San Diego reported 1-2 drone were sighted by naval ships in the yard in the VCNTY Piers 13 and 10. UAS(s) were traveling N to S. Altitude unknown. Navy CDO notified along with Naval port authority at.","7/31/2018","11:07","2018-07-31T11:07Z",NA,"DEN","UAS",NA,"SAN",NA,NA,NA,NA,NA,NA,NA,NA,NA,NA,NA,NA,NA,NA,NA,NA,"SAN","EXCEPTION"
"Reported a UAS while NE bound at 1,000 feet. UAS was 300 feet and below. NYPD Aviation unit notified at.","8/1/2018","2:51","2018-08-01T02:51Z","NY36","DEN","UAS",NA,"N90",NA,NA,NA,NA,NA,NA,NA,NA,NA,NA,NA,NA,NA,NA,NA,NA,"N90","EXCEPTION"
"DCA-1. UAS seen at Washington Monument by USSS. Suspect is in custody. DCA will do MOR. Phantom type UAS. 0328 UPDATE, USCP advised USPP responded to call and described the subjectsas 2 Pakistani males.LEO actually did notobserve the subjects flying the drone, nor was there any evidence that they flew it through video replay so no citation issued.. They were only observed carrying the drone. After further investigation, another drone was found in their car and thelicense plate on the cardid not match the car. NCRCC did not ask DCA to rescind MOR due to suspicious nature of the event.","8/1/2018","5:13","2018-08-01T05:13Z",NA,"NCRCC","TOI-PA-P-56A","MOR, PAGED, TOI, TOI-PA, UAS","USSS",NA,NA,NA,NA,NA,NA,NA,NA,NA,NA,NA,NA,NA,NA,NA,NA,"USSS","EXCEPTION"
"Reported a quad copter UAS with green and red lights at 2,5000 FT 7 SW of LIT. Evasive action not reported. LEO not notified. ","8/1/2018","5:57","2018-08-01T05:57Z","ENY3414","DEN","UAS",NA,"LIT",NA,NA,NA,NA,NA,NA,NA,NA,NA,NA,NA,NA,NA,NA,NA,NA,"LIT","EXCEPTION"
"Reported a blinking light flew directly over them. Due to nighttime visibility only, no identification of UAS given other than blinking light while heading S at 6,000 FT 7 SSW of LAX. No reported evasive action. LA Sheriff Air Division notified. ","8/1/2018","11:50","2018-08-01T11:50Z","DAL1106","DEN","UAS",NA,"LAX",NA,NA,NA,NA,NA,NA,NA,NA,NA,NA,NA,NA,NA,NA,NA,NA,"LAX","EXCEPTION"
"WROC reported Fire Boss reported a UAS in division B (S End) of the fire heading E. N ofurther information.","8/2/2018","3:36","2018-08-02T03:36Z",NA,"DEN","UAS",NA,"WOC",NA,NA,NA,NA,NA,NA,NA,NA,NA,NA,NA,NA,NA,NA,NA,NA,"WOC","EXCEPTION"
"Reported a white UAS at 1,000 feet 2 S of Everett. No evasive action reported. LEO notification not reported.","8/2/2018","5:07","2018-08-02T05:07Z","N2064S","DEN","UAS",NA,"PAE",NA,NA,NA,NA,NA,NA,NA,NA,NA,NA,NA,NA,NA,NA,NA,NA,"PAE","EXCEPTION"
"Reported a near mid-air collision with a UAS operating TFR 8/7397. Aircraft executed evasive maneuvers to avoid the UAS. Freemont County Sheriff's notified at. Sheriff's Deputies located the UAS pilot. Aerial Firefighting operations were suspended for 2 hours following the event.","8/2/2018","6:27","2018-08-02T06:27Z","N8PJ","DEN","UAS","PAGED","IDA",NA,NA,NA,NA,NA,NA,NA,NA,NA,NA,NA,NA,NA,NA,NA,NA,"IDA","EXCEPTION"
"Progressive FieldTOI #1: Unauthorized UAS operating at Progressive Field (Cleveland Indians Ballpark TFR). UAS pilot was identified and instructed to terminate operations. Cleveland PD notified at.","8/4/2018","8:56","2018-08-04T08:56Z",NA,"DEN","TOI-TFR","TOI, UAS","BKL",NA,NA,NA,NA,NA,NA,NA,NA,NA,NA,NA,NA,NA,NA,NA,NA,"BKL","EXCEPTION"
"Pilot reported UAS at 800 feet in the vicinity of Myrtle Beach High School. Myrtle Beach PD notified at. ","8/6/2018","5:56","2018-08-06T05:56Z","N413BD","DEN","UAS",NA,"MYR",NA,NA,NA,NA,NA,NA,NA,NA,NA,NA,NA,NA,NA,NA,NA,NA,"MYR","EXCEPTION"
"ZME advised facility securitypersonnel found a small (6 inch)UAS with a camera on the ground, inside the fence of ZME ARTCC. Facility security has contacted local LEO and will turn over the UAS to the LEO. ZME filed incident report. MR notified. ","8/6/2018","13:20","2018-08-06T13:20Z",NA,"DEN","UAS",NA,"ZME",NA,NA,NA,NA,NA,NA,NA,NA,NA,NA,NA,NA,NA,NA,NA,NA,"ZME","EXCEPTION"
"Reported a silver UAS at 2 o'clock, 500 feet below while ESE bound at 3500 feet, 6 N the Bronx. No evasive action taken. NYPD notified at. ","8/6/2018","18:16","2018-08-06T18:16Z","EDV5222","DEN","UAS",NA,"N90",NA,NA,NA,NA,NA,NA,NA,NA,NA,NA,NA,NA,NA,NA,NA,NA,"N90","EXCEPTION"
"Aircraft reported overflying a UAS operating between 3,500 and 3,900 feet while NW bound at 4,000 feet in the vicinity of IAH. No evasive action taken. Houston PD notified at.","8/7/2018","7:18","2018-08-07T07:18Z","UAL2131","DEN","UAS",NA,"I90",NA,NA,NA,NA,NA,NA,NA,NA,NA,NA,NA,NA,NA,NA,NA,NA,"I90","EXCEPTION"
"Pilot reported a quad-copter UAS at 4,500 feet, 15 feet on left side of airplane while over3M5. No evasive action taken. LEO not notified. ","8/8/2018","2:00","2018-08-08T02:00Z","N64027","DEN","UAS",NA,"HSV",NA,NA,NA,NA,NA,NA,NA,NA,NA,NA,NA,NA,NA,NA,NA,NA,"HSV","EXCEPTION"
"PIC reported a black and white UAS at same altitude of 2,200FT 4 NE HFD. No evasive action reported. E Hartford PD notified at.","8/8/2018","21:40","2018-08-08T21:40Z","N449A","DEN","UAS",NA,"HFD",NA,NA,NA,NA,NA,NA,NA,NA,NA,NA,NA,NA,NA,NA,NA,NA,"HFD","EXCEPTION"
"Concerned citizen reported a UAS struck a pine tree causing the UAS to fall 50 feet and crash onto a driveway near Godwin, NC. No injuries or property damage reported. LEO notification not reported. ","8/9/2018","7:27","2018-08-09T07:27Z",NA,"DEN","UAS",NA,"WOC",NA,NA,NA,NA,NA,NA,NA,NA,NA,NA,NA,NA,NA,NA,NA,NA,"WOC","EXCEPTION"
"Pilot reported silver and whiteUAS over IAD at 14000 feet, heading Ebound.No evasive action taken.Loudoun County PD notified at. ","8/10/2018","16:31","2018-08-10T16:31Z","UAL605","NCRCC","UAS",NA,"PCT",NA,NA,NA,NA,NA,NA,NA,NA,NA,NA,NA,NA,NA,NA,NA,NA,"PCT","EXCEPTION"
"E-ROC advises: Security at Pottstown-Limerick, PAnuclear power planobserved 4-6 UAS 3-5 feet in diameter operating over the plant for approximately 1+00 hour. FBI and LEO notified by plant security. FBI notified Allentown FSDO. ROC notified PHL. No other information provided. MR notified. ","8/11/2018","1:10","2018-08-11T01:10Z",NA,"DEN","UAS","NOTIFICATION-LATE, PAGED","ATO",NA,NA,NA,NA,NA,NA,NA,NA,NA,NA,NA,NA,NA,NA,NA,NA,"ATO","EXCEPTION"
"PIC reported a UAS while S bound at 1,200 feet over Signal Hill, vicinity Long Beach, CA. No evasive action taken. LEO notified, agency name and phone number not provided.","8/11/2018","6:22","2018-08-11T06:22Z","N48340","DEN","UAS",NA,"LGB",NA,NA,NA,NA,NA,NA,NA,NA,NA,NA,NA,NA,NA,NA,NA,NA,"LGB","EXCEPTION"
"Reported observing a black Quad-copter UAS while Nbound at 1,600 feet in the vicinity of Montgomery-Gibbs Executive Airport. The closed proximity was 300 feet. No evasive action taken. San Diego PD notified at. ","8/12/2018","10:36","2018-08-12T10:36Z","FR2","DEN","UAS",NA,"SAN",NA,NA,NA,NA,NA,NA,NA,NA,NA,NA,NA,NA,NA,NA,NA,NA,"SAN","EXCEPTION"
"Aircraft reported A UAS 11 N SEA at 3,500 feet off the left side, while S bound. No evasive action reported. Seattle Police notified VIA 911.","8/13/2018","4:47","2018-08-13T04:47Z","ASA96","DEN","UAS",NA,"S46",NA,NA,NA,NA,NA,NA,NA,NA,NA,NA,NA,NA,NA,NA,NA,NA,"S46","EXCEPTION"
"PIC reported a UAS at same altitude while W bound at 9,500FT. No evasive action reported. Miami-Dade PD notified. ","8/13/2018","23:04","2018-08-13T23:04Z","RPA4682","DEN","UAS",NA,"FLL",NA,NA,NA,NA,NA,NA,NA,NA,NA,NA,NA,NA,NA,NA,NA,NA,"FLL","EXCEPTION"
"PIC reported a white UAS passed 200Ft below the aircraft while at 3,800FT. No evasive action reported. No additional information reported.","8/14/2018","0:00","2018-08-14T00:00Z","N45RR","DEN","UAS",NA,"BNA",NA,NA,NA,NA,NA,NA,NA,NA,NA,NA,NA,NA,NA,NA,NA,NA,"BNA","EXCEPTION"
"PIC reported black UAS at 5,000FT heading NW bound. Manchester PD notified at.","8/14/2018","3:45","2018-08-14T03:45Z","N504A","DEN","UAS",NA,"ZME",NA,NA,NA,NA,NA,NA,NA,NA,NA,NA,NA,NA,NA,NA,NA,NA,"ZME","EXCEPTION"
"PIC reported a UAS possibly being controlled by an individual white van near Lionshead Ave. Evasive action not reported. Carlsbad PD notified.","8/14/2018","22:52","2018-08-14T22:52Z","N6232Y","DEN","UAS",NA,"CRQ",NA,NA,NA,NA,NA,NA,NA,NA,NA,NA,NA,NA,NA,NA,NA,NA,"CRQ","EXCEPTION"
"Pilot reported UAS 300-400 feet below Aircraft inbound at UNKN ALT in vicinity of BOI.No evasive action reported. PIC unreachable for more information. Mountain Home LEO notified. ","8/18/2018","1:35","2018-08-18T01:35Z","SWA1689","DEN","UAS",NA,"BOI",NA,NA,NA,NA,NA,NA,NA,NA,NA,NA,NA,NA,NA,NA,NA,NA,"BOI","EXCEPTION"
"US Forest Service reported a black and red rotorcraft 2 feet in diameter UAS came within 250 feet of firefighting Aircraft at 450 feet. UAS was moving SE bound. Local LEO notified.","8/18/2018","13:12","2018-08-18T13:12Z",NA,"DEN","UAS",NA,"RDD",NA,NA,NA,NA,NA,NA,NA,NA,NA,NA,NA,NA,NA,NA,NA,NA,"RDD","EXCEPTION"
"DCA-1: DCA097006, UAS, no description given,indicating 2,500feet. Local law enforcement will be contacted by ADW and will call NCRCC with information. ADW will do MOR. 1608 PG County PD notified at.","8/18/2018","19:49","2018-08-18T19:49Z","WILD1","NCRCC","TOI-NCR FRZ","MOR, PAGED, TOI, UAS","ADW",NA,NA,NA,NA,NA,NA,NA,NA,NA,NA,NA,NA,NA,NA,NA,NA,"ADW","EXCEPTION"
"UAS reported by N92CD at the RIC090007, 8,000'. Aircraft had to turn to avoid. New Kent Sheriff notified at. ","8/18/2018","22:10","2018-08-18T22:10Z","N92CD","NCRCC","UAS","MOR, PAGED","PCT",NA,NA,NA,NA,NA,NA,NA,NA,NA,NA,NA,NA,NA,NA,NA,NA,"PCT","EXCEPTION"
"Pilot reported a UAS 0.25 NM fromthe airport below 100 feet while in sequence for departure. Burlingame LEO notified. ","8/18/2018","23:39","2018-08-18T23:39Z","DAL64","DEN","UAS",NA,"SFO",NA,NA,NA,NA,NA,NA,NA,NA,NA,NA,NA,NA,NA,NA,NA,NA,"SFO","EXCEPTION"
"Pilot reported possible contact with UAS VCNTY of La Jolla Cove, CA. Aircraft made precautionary landing at NKX to inspect tail rotor after hearing a ping.PIC did not find damage and departed. ","8/19/2018","4:59","2018-08-19T04:59Z","OMAHA55L","DEN","UAS",NA,"SCT",NA,NA,NA,NA,NA,NA,NA,NA,NA,NA,NA,NA,NA,NA,NA,NA,"SCT","EXCEPTION"
"Reported a UAS 200 feet below aircraft while heading N bound at 2,400 feet. No evasive action taken. St. Charles Co PD notified at.","8/19/2018","21:42","2018-08-19T21:42Z","SWA4244","DEN","UAS",NA,"STL",NA,NA,NA,NA,NA,NA,NA,NA,NA,NA,NA,NA,NA,NA,NA,NA,"STL","EXCEPTION"
"Pilot reported quad-copter on midfield downwind at pattern altitude. Evasive action not reported. LEO notification UNKN. ","8/19/2018","23:12","2018-08-19T23:12Z","N53SL","DEN","UAS",NA,"IWA",NA,NA,NA,NA,NA,NA,NA,NA,NA,NA,NA,NA,NA,NA,NA,NA,"IWA","EXCEPTION"
"Reported observing a black and red UAS off of the left side at 4,000 feet in the vicinity of Las Vegas. Evasive action not reported. LEO was not notified. ","8/20/2018","5:16","2018-08-20T05:16Z","SWA3164","DEN","UAS",NA,"L30",NA,NA,NA,NA,NA,NA,NA,NA,NA,NA,NA,NA,NA,NA,NA,NA,"L30","EXCEPTION"
"PIC reported a UAS at same altitude of 3,000FT while in a turn to DFW. DFW Airport PD notified at.","8/20/2018","21:43","2018-08-20T21:43Z","AAL1412","DEN","UAS",NA,"DFW",NA,NA,NA,NA,NA,NA,NA,NA,NA,NA,NA,NA,NA,NA,NA,NA,"DFW","EXCEPTION"
"PIC reported a UAS at 16,500 feet near LAL. No evasive action taken. Lakeland PDnotified at.","8/22/2018","2:23","2018-08-22T02:23Z","N84LL","DEN","UAS",NA,"LAL",NA,NA,NA,NA,NA,NA,NA,NA,NA,NA,NA,NA,NA,NA,NA,NA,"LAL","EXCEPTION"
"DCA-1, observed a red and white UAS over Georgetown, DC. Reported at 300 feet, climbing N bound. No evasive action taken. BKJK2 did not pursue. UAS observed on USSS cameras. DC Metro PD notified at. DCA filed MOR . Metro PD searched areas with negative results. ","8/22/2018","4:08","2018-08-22T04:08Z","BKJK2","NCRCC","UAS","MOR","NCRCC",NA,NA,NA,NA,NA,NA,NA,NA,NA,NA,NA,NA,NA,NA,NA,NA,"NCRCC","EXCEPTION"
"PIC reported UAS at 12 o'clock position while descending from 8,000FT W bound 6 NM from MIA. No evasive action taken. Miami PD notified at.","8/22/2018","16:58","2018-08-22T16:58Z","AAL906","DEN","UAS",NA,"MIA",NA,NA,NA,NA,NA,NA,NA,NA,NA,NA,NA,NA,NA,NA,NA,NA,"MIA","EXCEPTION"
"E-ROC advised: Limerick/Pottstown, PNNuclear Power Plant,facilitysecurity observed 3-4 UAS DRONES loitering over the facility. Reports indicated the event started approximately 0100z. Power plant security advised, they have hired a counter UAS company due to recent, similar events. FBI has been notified and the Coventry Police Department is on the scene. FAA LEAP Agent notified.NW notified. ","8/24/2018","8:33","2018-08-24T08:33Z",NA,"DEN","UAS","LAW ENFORCEMENT, SUSPICIOUS ACTIVITY","WOC",NA,NA,NA,NA,NA,NA,NA,NA,NA,NA,NA,NA,NA,NA,NA,NA,"WOC","EXCEPTION"
"Reported a white quad copter UAS off the left side at 3,500 feet 5 S of SHIRLEY. No evasive action taken. Suffolk County PD notified at.","8/25/2018","0:29","2018-08-25T00:29Z","N7166E","DEN","UAS",NA,"N90",NA,NA,NA,NA,NA,NA,NA,NA,NA,NA,NA,NA,NA,NA,NA,NA,"N90","EXCEPTION"
"Reported a fixed wing UAS pass below aircraft while SSE bound at 9,000 feet. No evasive action taken. Oakland PD notified at.","8/25/2018","3:39","2018-08-25T03:39Z","UAL2044","DEN","UAS",NA,"NCT",NA,NA,NA,NA,NA,NA,NA,NA,NA,NA,NA,NA,NA,NA,NA,NA,"NCT","EXCEPTION"
"PIC reported a red UAS at 1,900 feet while orbiting at 2,900 feet VCNTY Luzerne, PA. No evasive action taken. Butler Township Police notified via 911.","8/25/2018","5:18","2018-08-25T05:18Z","LIFEFLIGHT","DEN","UAS",NA,"AVP",NA,NA,NA,NA,NA,NA,NA,NA,NA,NA,NA,NA,NA,NA,NA,NA,"AVP","EXCEPTION"
"Pilot reported UAS at the DCA250017, 4600 feet, stationary. Described as medium size, black and yellow quad copter. No evasive action taken. Prince William County PD notified ","8/25/2018","17:30","2018-08-25T17:30Z","JIA5516","NCRCC","UAS","PAGED","PCT",NA,NA,NA,NA,NA,NA,NA,NA,NA,NA,NA,NA,NA,NA,NA,NA,"PCT","EXCEPTION"
"Reported a UAS 300 feet above aircraft while SE bound 3 NW of Greenville. No evasive action taken. Greenville PD notified at.","8/25/2018","22:49","2018-08-25T22:49Z","N89GX","DEN","UAS",NA,"GMU",NA,NA,NA,NA,NA,NA,NA,NA,NA,NA,NA,NA,NA,NA,NA,NA,"GMU","EXCEPTION"
"Reported a Orange and Gold UAS 500 feet below the aircraft while at 3,000 5 E of PDK while W bound. No evasive action taken. Champlee PD notified at.","8/26/2018","0:14","2018-08-26T00:14Z","N8699N","DEN","UAS",NA,"PDK",NA,NA,NA,NA,NA,NA,NA,NA,NA,NA,NA,NA,NA,NA,NA,NA,"PDK","EXCEPTION"
"Reported a UAS while E bound at 3,500 feet 4 SW of LZU. PIC executed a right turn to avoid UAS. LEO was not contacted due to late notification to ATCT.","8/26/2018","3:55","2018-08-26T03:55Z","N585GT","DEN","UAS",NA,"LZU",NA,NA,NA,NA,NA,NA,NA,NA,NA,NA,NA,NA,NA,NA,NA,NA,"LZU","EXCEPTION"
"Reported a UAS while WSW bound at 6,500 feet 20 ENE of MKE. No evasive action taken. LEO not notified.","8/26/2018","4:10","2018-08-26T04:10Z","WWI25","DEN","UAS",NA,"MKE",NA,NA,NA,NA,NA,NA,NA,NA,NA,NA,NA,NA,NA,NA,NA,NA,"MKE","EXCEPTION"
"Reported a quadcopter UAS while NW bound at 4,500 feet 10 NNE of MGM. No evasive action taken. Montgomery PD notified at.","8/26/2018","4:56","2018-08-26T04:56Z","N7544Y","DEN","UAS",NA,"MGM",NA,NA,NA,NA,NA,NA,NA,NA,NA,NA,NA,NA,NA,NA,NA,NA,"MGM","EXCEPTION"
"Reported a black quadcopter UAS while WSW bound at 2,500 feet 9 E of LAX. No evasive action taken. LAPD Air Support notified at.","8/26/2018","5:05","2018-08-26T05:05Z","NAX7087","DEN","UAS",NA,"SCT",NA,NA,NA,NA,NA,NA,NA,NA,NA,NA,NA,NA,NA,NA,NA,NA,"SCT","EXCEPTION"
"Reported a UAS at 2,000 feet below aircraft while N bound at 11,000 feet 15 NNE of PHX. No evasive action taken. PHX Airport PD notified at.","8/26/2018","6:10","2018-08-26T06:10Z","AAL686","DEN","UAS",NA,"P50",NA,NA,NA,NA,NA,NA,NA,NA,NA,NA,NA,NA,NA,NA,NA,NA,"P50","EXCEPTION"
"Reported a UAS while in VCNTY of SMO pier at 400 FT 3 S of SMO. No evasive action taken. Santa Monica Airport police notified via LC frequency.","8/26/2018","7:24","2018-08-26T07:24Z","N805HD","DEN","UAS",NA,"SMO",NA,NA,NA,NA,NA,NA,NA,NA,NA,NA,NA,NA,NA,NA,NA,NA,"SMO","EXCEPTION"
"Reported observing a white and red UAS while on a 7 NM final. Evasive action was not reported. LEO notification was not made. ","8/27/2018","3:10","2018-08-27T03:10Z","DCM4091","DEN","UAS",NA,"VNY",NA,NA,NA,NA,NA,NA,NA,NA,NA,NA,NA,NA,NA,NA,NA,NA,"VNY","EXCEPTION"
"Reported observing an orange and white Quad-copter UAS off of the left side operating 500 feet above his aircraft in the vicinity of Houston, TX. No evasive action taken. FBI notified at. ","8/27/2018","4:13","2018-08-27T04:13Z","N6105U","DEN","UAS",NA,"I90",NA,NA,NA,NA,NA,NA,NA,NA,NA,NA,NA,NA,NA,NA,NA,NA,"I90","EXCEPTION"
"Reported observing a black swept wing UAS flying in the opposite direction along the lakeshore. No evasive action taken. LEO notification was not made. ","8/27/2018","4:16","2018-08-27T04:16Z","N747KA","DEN","UAS",NA,"ZAU",NA,NA,NA,NA,NA,NA,NA,NA,NA,NA,NA,NA,NA,NA,NA,NA,"ZAU","EXCEPTION"
"Reported observing a five prop UAS operating off of the right side in the vicinity of LaGuardia Airport. NYPD Aviation Unit notified at. ","8/27/2018","4:58","2018-08-27T04:58Z","N860SM","DEN","UAS",NA,"N90",NA,NA,NA,NA,NA,NA,NA,NA,NA,NA,NA,NA,NA,NA,NA,NA,"N90","EXCEPTION"
"Observed a UAS while heading Sbound at 3,000 FT 4 NW of Las Vegas. No evasive action taken.","8/27/2018","8:57","2018-08-27T08:57Z","MT2","DEN","UAS",NA,"LAS",NA,NA,NA,NA,NA,NA,NA,NA,NA,NA,NA,NA,NA,NA,NA,NA,"LAS","EXCEPTION"
"USCP conducting UAS operations on US Capitol grounds until approximately 0900L. ","8/27/2018","15:00","2018-08-27T15:00Z",NA,"NCRCC","UAS",NA,"USCP",NA,NA,NA,NA,NA,NA,NA,NA,NA,NA,NA,NA,NA,NA,NA,NA,"USCP","EXCEPTION"
"Pilot reported a red UAS at 3,800 feet directly above the Tampa International Airport. No evasive action taken. Hillsborough County Sheriff Aviation Unit notified. ","8/27/2018","22:38","2018-08-27T22:38Z","C1718","DEN","UAS",NA,"TPA",NA,NA,NA,NA,NA,NA,NA,NA,NA,NA,NA,NA,NA,NA,NA,NA,"TPA","EXCEPTION"
"USCP conducting UAS operations below 400 feeton US Capitol grounds until 0900L. ","8/28/2018","15:00","2018-08-28T15:00Z",NA,"NCRCC","UAS",NA,"NCRCC",NA,NA,NA,NA,NA,NA,NA,NA,NA,NA,NA,NA,NA,NA,NA,NA,"NCRCC","EXCEPTION"
"PIC reported a small silver 4 prop UAS while SE bound at 5,500FT 400FT above Aircraft heading S to N in VCNTY New Bedford, MA. No evasive action taken. Massachusetts State Police to be notified. ","8/29/2018","3:15","2018-08-29T03:15Z","N48MW","DEN","UAS",NA,"A90",NA,NA,NA,NA,NA,NA,NA,NA,NA,NA,NA,NA,NA,NA,NA,NA,"A90","EXCEPTION"
"PIC reported a UAS 200FT away from Aircraft while NE bound at 9,600FT in VCNTY Kalispell, MT. No evasive action taken. LEO notification not reported.","8/31/2018","0:09","2018-08-31T00:09Z","N131LT","DEN","UAS",NA,"GPI",NA,NA,NA,NA,NA,NA,NA,NA,NA,NA,NA,NA,NA,NA,NA,NA,"GPI","EXCEPTION"
"PIC reported a black UAS at 800FT in VCNTY Witham Field ARPT, FL. No evasive action reported. LEO notification not reported. ","8/31/2018","0:54","2018-08-31T00:54Z","N65957","DEN","UAS",NA,"WOC",NA,NA,NA,NA,NA,NA,NA,NA,NA,NA,NA,NA,NA,NA,NA,NA,"WOC","EXCEPTION"
